product_code,product_name,first_collected_date
99742745,AULA NOVA75 유무선 기계식 해외구매 (경우축),2026-07-02
97955657,CHERRY G80-3000S TKL 블랙 (중고),2026-07-02
97476518,앱코 AN94BT 무선 블루투스 기계식 솜사탕 (중고),2026-07-02
97404899,KSI K104R HM801 키보드 마우스 세트,2026-07-02
97404866,KSI K104R,2026-07-02
9523836,로지텍 MX KEYS (정품),2026-07-02
94450298,한성컴퓨터 GK204 기계식 (중고),2026-07-02
94449446,AULA F75 MAX 유무선 기계식 올리비아 화이트 (중고),2026-07-02
94081823,Razer Huntsman V3 Pro KR 중고,2026-07-02
9225315,스틸시리즈 Apex 7 TKL (적축),2026-07-02
77620547,Keychron B6 유무선 (바닐라 크림),2026-07-02
74489981,Keychron B6 PRO 유무선 (레트로 그린),2026-07-02
74489693,Keychron B6 PRO 유무선 (레트로 레드),2026-07-02
74489690,Keychron B6 PRO 유무선 (레트로 블루),2026-07-02
60226601,Keychron B6 PRO 유무선 (바닐라 크림),2026-07-02
60226598,Keychron B6 PRO 유무선 (스페이스 그레이),2026-07-02
58025984,Keychron B6 유무선 (딥블랙),2026-07-02
5040324,앱코 HACKER K640 축교환 게이밍 기계식 블랙 (적축),2026-07-02
5040307,앱코 HACKER K640 축교환 게이밍 기계식 블랙 (갈축),2026-07-02
4709084,앱코 HACKER K640 축교환 게이밍 기계식 블랙 (청축),2026-07-02
30228065,PYHO JPTZ002 무선 키보드 마우스 세트 (해외구매),2026-07-02
28926971,로지텍 Wave Keys (해외구매),2026-07-02
28857425,Melgeek Mojo84 유무선 기계식 플라스틱 투명 (해외구매),2026-07-02
28798190,Keychron B6 유무선 (민트그린),2026-07-02
28798181,Keychron B6 유무선 (레몬옐로우),2026-07-02
28798172,Keychron B6 유무선 (스페이스그레이),2026-07-02
2096226,로지텍 MK220 (병행수입),2026-07-02
20722838,맥컬리 RFACEKEY 무선,2026-07-02
19544126,iFLYTEK AI-KTVS-001 AI 무선,2026-07-02
17658773,로지텍 G713 TKL 오로라 컬렉션 (정품) (리니어),2026-07-02
15370208,ASUS ROG FALCHION NX (적축),2026-07-02
15035945,에이데이타코리아 DDZONE DMK-W9800 (핑크),2026-07-02
14199830,로지텍 MK295 SILENT (병행수입),2026-07-02
13805981,로지텍 K380 키스킨미포함 (정품) (화이트),2026-07-02
12803069,몬스타 MP37 메모리폼 손목패드 (L),2026-07-02
12803048,몬스타 MP37 메모리폼 손목패드 (M),2026-07-02
12762821,몬스타 우드팜레스트 키보드손목받침대 (웬지),2026-07-02
122718970,ASUS ROG 에이조스 익스트림 20주년 리미티드 에디션,2026-07-02
122718574,SPM 세모키 프로 ARA108 유무선 기계식,2026-07-02
122718526,SPM PL108W 아라 유무선 기계식 딸기우유 (선셋축),2026-07-02
122718432,SPM PL108W 아라 유무선 기계식 딸기우유 (봉숭아축),2026-07-02
122717082,주연테크 긱스타 파운데이션 (뉴트럴 아이보리),2026-07-02
122717059,주연테크 긱스타 파운데이션 (포슬린 화이트),2026-07-02
122717054,주연테크 긱스타 파운데이션 (시카민트),2026-07-02
122717042,COX CF108 유무선 기계식 쿨네이비 (저소음 안개축),2026-07-02
122717031,COX CF108 유무선 기계식 쿨네이비 (오렌지축),2026-07-02
122717029,COX CF108 유무선 기계식 웜아이보리 (저소음 안개축),2026-07-02
122717025,COX CF108 유무선 기계식 웜아이보리 (오렌지축),2026-07-02
122716995,로지텍 G304 X SUPERLIGHT + G316 X 98 키보드 마우스 세트,2026-07-02
122716970,로지텍 G316 X 98 블랙 (적축),2026-07-02
122716969,로지텍 G316 X 98 블랙 (갈축),2026-07-02
122716968,로지텍 G316 X 98 화이트 (적축),2026-07-02
122716967,로지텍 G316 X 98 화이트 (갈축),2026-07-02
122710731,FL-ESPORTS NX108 유무선 기계식 크림 핑크 (중고),2026-07-02
122703421,Chilkey ND104 유무선 소프트 핑크 (WS Silent Linear),2026-07-02
122703415,Chilkey ND104 유무선 스카이 블루 (WS Silent Linear),2026-07-02
122703414,Chilkey ND104 유무선 스카이 블루 (WS Breeze),2026-07-02
122703410,Chilkey ND104 유무선 루나 화이트 (WS Silent Linear),2026-07-02
122703408,Chilkey ND104 유무선 루멘 옐로우 (WS Silent Linear),2026-07-02
122703401,Chilkey ND104 유무선 루나 화이트 (WS Breeze),2026-07-02
122703392,Chilkey ND104 유무선 쉐도우 블랙 (WS Breeze),2026-07-02
122703334,Chilkey SF60 (핑크),2026-07-02
122703331,Chilkey SF60 (옐로우),2026-07-02
122703328,Chilkey SF60 (블루),2026-07-02
122703324,Chilkey SF60 (블랙),2026-07-02
122701063,TNT TX108 유무선 기계식 스톤 모카 (리치베리축),2026-07-02
122701061,TNT TX108 유무선 기계식 스톤 모카 (그레이 스노우축),2026-07-02
122701059,TNT TX108 유무선 기계식 스톤 모카 (벚꽃축),2026-07-02
122701056,TNT TX108 유무선 기계식 솜사탕 (그레이 스노우축),2026-07-02
122701054,TNT TX108 유무선 기계식 솜사탕 (벚꽃축),2026-07-02
122701052,TNT TX108 유무선 기계식 솜사탕 (리치베리축),2026-07-02
122701049,TNT TX108 유무선 기계식 메카 코어 (그레이 스노우축),2026-07-02
122701047,TNT TX108 유무선 기계식 메카 코어 (벚꽃축),2026-07-02
122701044,TNT TX108 유무선 기계식 메카 코어 (리치베리축),2026-07-02
122693549,SAKUYA R2,2026-07-02
122693287,ePBT Brutalist Base,2026-07-02
122693275,ePBT Soju Alpha Spacebars,2026-07-02
122693161,Hammerworks CRP R5 Alphas Tulip Beige,2026-07-02
122693114,Net Runner Numpad,2026-07-02
122693089,ePBT Warrior MK2 (BLACK),2026-07-02
122692480,ePBT Warrior MK2 (NOVELTIES),2026-07-02
122692477,ePBT Warrior MK2 (NON STANDARD),2026-07-02
122692472,ePBT Warrior MK2 (Base),2026-07-02
122692468,THOK Artisan 소주 아티산,2026-07-02
122692463,Hammerworks C64 R2 (PAD),2026-07-02
122692265,GB Melon Milk Keycaps Base kit,2026-07-02
122692250,Hammerworks C64 R2 (ALPHAS),2026-07-02
122692066,Melgeek Horseman base C,2026-07-02
122652085,ASUS ROG Falchion Ace 75 HE 화이트 (V2X축),2026-07-02
11784886,로지텍 K380 한영 전용 키스킨 (판타스틱 블루),2026-07-02
11784817,로지텍 K380 한영 전용 키스킨 (판타스틱 블랙),2026-07-02
11784796,로지텍 K380 한영 전용 키스킨 (그리데언트 민트),2026-07-02
11784772,로지텍 K380 한영 전용 키스킨 (그리데언트 그린),2026-07-02
11784745,로지텍 K380 한영 전용 키스킨 (블랙),2026-07-02
11784730,로지텍 K380 한영 전용 키스킨 (실버),2026-07-02
11784670,로지텍 K380 한영 전용 키스킨 (투명),2026-07-02
11784661,로지텍 K380 한영 전용 키스킨 (화이트),2026-07-02
11356164,CHERRY MX BOARD 3.0S RGB 화이트 (청축),2026-07-02
10333404,ANYZEN MK100 PU 세트 with PAD,2026-07-02
99050090,지클릭커 OFFICEPRO EK300 인체공학 무선 (중고),2026-06-30
99050060,지클릭커 OFFICEPRO OPK10 (중고),2026-06-30
98486345,몬스타기어 크라이톡스 구리스 GLP205 G2 윤활제 (10g),2026-06-30
97955423,CHERRY MX BOARD 3.0S TKL 블랙 (중고),2026-06-30
97843808,COX CNK84L 유무선 무접점 중고,2026-06-30
97842953,지클릭커 OFFICEPRO WK50 사일런스 M RGB 무소음 방수 무선 블루투스 108 (중고),2026-06-30
94450130,로지텍 G PRO X TKL RAPID (정품) (중고),2026-06-30
94128839,한성컴퓨터 GK797PRO 유무선 기계식 오션 화이트 (중고),2026-06-30
74489585,Keychron B1 PRO 유무선 (레트로 블루),2026-06-30
73890014,Keychron B1 PRO 유무선 (레트로 그린),2026-06-30
68578226,CORSAIR K70 RGB PRO 해외구매,2026-06-30
60235238,앱코 AM61 자석축 래피드 트리거,2026-06-30
60226793,Keychron B1 PRO 유무선 (바닐라 크림),2026-06-30
37988543,AULA F81 유무선 기계식 해외구매 (빙백축),2026-06-30
34335710,웨이코스 씽크웨이 VGN TV99 유무선 기계식 프로즌 화이트 (저소음 딥씨 프로축),2026-06-30
28551686,"엠스톤글로벌 수제윤활 그루브스톤 특주축 55ea (저소음 코랄, 55g)",2026-06-30
28551668,"엠스톤글로벌 수제윤활 그루브스톤 특주축 55ea (저소음 코랄, 45g)",2026-06-30
28551659,"엠스톤글로벌 수제윤활 그루브스톤 특주축 55ea (저소음 코랄, 38g)",2026-06-30
28551605,"엠스톤글로벌 수제윤활 그루브스톤 특주축 55ea (저소음 밀키, 55g)",2026-06-30
28551578,"엠스톤글로벌 수제윤활 그루브스톤 특주축 55ea (저소음 밀키, 45g)",2026-06-30
28551563,"엠스톤글로벌 수제윤활 그루브스톤 특주축 55ea (저소음 밀키, 38g)",2026-06-30
28551530,"엠스톤글로벌 수제윤활 그루브스톤 특주축 55ea (코랄V2, 45g)",2026-06-30
28551452,"엠스톤글로벌 수제윤활 그루브스톤 특주축 55ea (코랄V2, 38g)",2026-06-30
28551356,"엠스톤글로벌 수제윤활 그루브스톤 특주축 55ea (밀키V2, 55g)",2026-06-30
28551350,"엠스톤글로벌 수제윤활 그루브스톤 특주축 55ea (밀키V2, 45g)",2026-06-30
28551305,"엠스톤글로벌 수제윤활 그루브스톤 특주축 55ea (밀키V2, 38g)",2026-06-30
1958686,로지텍 MK200 (중고),2026-06-30
13208633,"앱코 K660P 프리미엄 카일광축 무빙 LED 게이밍 기계식 키보드 (다크 그레이, 클릭)",2026-06-30
13208612,"앱코 K660P 프리미엄 카일광축 무빙 LED 게이밍 기계식 키보드 (마젠타, 클릭)",2026-06-30
122716151,퓨전에프앤씨 INOTE KM70RB 무선 키보드 마우스 세트 (화이트),2026-06-30
122716147,퓨전에프앤씨 INOTE KM70RB 무선 키보드 마우스 세트 (블랙),2026-06-30
122693582,JXM (NOVELTIES G),2026-06-30
122693303,JXM (MODEL M ALPHAS),2026-06-30
122693260,JXM (NOVELTIES O),2026-06-30
122693242,JXM (NUMPAD),2026-06-30
122693235,JXM (ORANGE MOD),2026-06-30
122693228,JXM (RU MOD),2026-06-30
122693187,JXM (RU ALPHAS),2026-06-30
122693170,JXM (ALPHAS),2026-06-30
101011586,"엠스톤글로벌 수제윤활 그루브스톤 특주축 55ea (저소음 밀키S축, 38g)",2026-06-30
101011583,"엠스톤글로벌 수제윤활 그루브스톤 특주축 55ea (저소음 밀키S축, 45g)",2026-06-30
101011571,"엠스톤글로벌 수제윤활 그루브스톤 특주축 55ea (저소음 갈축, 45g)",2026-06-30
101011565,"엠스톤글로벌 수제윤활 그루브스톤 특주축 55ea (저소음 갈축, 38g)",2026-06-30
97955312,ASUS ROG STRIX SCOPE II 96 유무선 기계식 WHITE (중고),2026-06-29
97838738,darkFlash GD108 유무선 기계식 (중고),2026-06-29
97476497,에이투 AG0401 무선 키보드 마우스 세트 중고,2026-06-29
94999652,로지텍 MX Keys S (정품) (중고),2026-06-29
94027874,QSENN Q104 PBT 풀윤활 가스켓 유무선 기계식 화이트 (중고),2026-06-29
33386147,darkFlash GD108 유무선 기계식 (히아신스),2026-06-29
21470333,darkFlash GD108 유무선 기계식 (별빛 파랑),2026-06-29
21470327,darkFlash GD108 유무선 기계식 (밀크 브라운),2026-06-29
21470318,darkFlash GD108 유무선 기계식 (흑설탕),2026-06-29
122685443,프리플로우 archon M1 PRO 2 TKL (중고),2026-06-29
70005068,앱코 AN07S (핑크),2026-06-28
69656141,앱코 AN07C 블루 (리니어),2026-06-28
69656138,앱코 AN07C 블루 (클릭),2026-06-28
68785349,앱코 AN07C 라일락 (리니어),2026-06-28
64393778,앱코 AN07S (블랙),2026-06-28
64393676,앱코 AN07C 라일락 (클릭),2026-06-28
18043670,EPOMAKER Theory TH80 (해외구매),2026-06-28
15790886,Britz BK500GBTC,2026-06-28
14269409,삼성전자 스마트키보드 트리오 500 (화이트),2026-06-28
14269259,삼성전자 스마트키보드 트리오 500 (블랙),2026-06-28
98925899,앱코 K517 레트로 기계식 (중고),2026-06-27
122687604,CORSAIR 클리퍼 PRO 미니 60 (화이트),2026-06-27
99050084,지클릭커 OFFICEPRO EK600 무선 기계식 네온 화이트 (중고),2026-06-26
98073068,NuPhy AIR75 V3 유무선 기계식 노바 화이트 (갈축),2026-06-26
97904147,QSENN SEM-DT45 NEW Plus (USB 중고),2026-06-26
97842998,퓨전에프앤씨 INOTE KM960RB 무선 블루투스 키보드 마우스 세트 중고,2026-06-26
97773665,Magicforce MF17 (갈축),2026-06-26
82394492,NuPhy AIR96 팜레스트,2026-06-26
78100772,SPM 아크릴 스위치 테스터 보관함,2026-06-26
32125112,SPM Soulcat 고함량 PBT 염료승화 영문 키캡 141키 딸기양,2026-06-26
32125097,SPM Soulcat 고함량 PBT 염료승화 영문 키캡 141키 거품토끼,2026-06-26
28419563,몬스타 몬스타기어 Kelowna 스테빌 필름,2026-06-26
27863762,글로리어스 POLYCHROMA RGB 키캡 세트,2026-06-26
21694286,아이리버 EQwear-MVS6000 무선 키보드 마우스 세트 (화이트),2026-06-26
21694283,아이리버 EQwear-MVS6000 무선 키보드 마우스 세트 (블랙),2026-06-26
13169835,CORSAIR FPS/MOBA Pudding Keycap Mod Kit Gunmetal Gray,2026-06-26
122711498,CORSAIR K65 RGB PLUS 유무선 기계식 아토믹 퍼플,2026-06-26
122710938,AULA F108 유무선 기계식 치즈 화이트 (황축),2026-06-26
122710768,Teamwolf RAVEN 68 HE (중고),2026-06-26
122710754,FL-ESPORTS Geo75 유무선 기계식 드림 그린 (중고),2026-06-26
122710751,FL-ESPORTS Geo75 유무선 기계식 러브 핑크 (중고),2026-06-26
122710749,FL-ESPORTS Geo75 유무선 기계식 딥 그레이 (중고),2026-06-26
122710734,FL-ESPORTS NX87HE 민트 블랙 (중고),2026-06-26
122710732,FL-ESPORTS NX87HE 네온 그레이 (중고),2026-06-26
122710730,FL-ESPORTS NX108HE 민트 블랙 (중고),2026-06-26
122710697,ATK Yogo 75 유무선 기계식 크림 옐로우 (중고),2026-06-26
122710696,ATK Yogo 75 유무선 기계식 실버 화이트 (중고),2026-06-26
122710695,ATK Yogo 75 유무선 기계식 블랙 (중고),2026-06-26
122710687,ATK Yogo 75 Pro 유무선 기계식 실버 화이트 (중고),2026-06-26
122710686,ATK Yogo 75 Pro 유무선 기계식 블랙 (중고),2026-06-26
122710672,AULA F108 기계식 라이트 그레이 (중고),2026-06-26
122710646,AULA S102 (중고),2026-06-26
122710246,프리플로우 archon AK68 DualDial 유무선 기계식 (더 블랙),2026-06-26
122709290,한성컴퓨터 TFG Magnetox 2XL 저소음 (쿠키앤크림),2026-06-26
122709288,한성컴퓨터 TFG Magnetox 2XL (쿠키앤크림),2026-06-26
122709273,한성컴퓨터 TFG Magnetox 2XF 저소음 (쿠키앤크림),2026-06-26
122709267,한성컴퓨터 TFG Magnetox 2XF 저소음 (픽셀),2026-06-26
122709266,한성컴퓨터 TFG Magnetox 2XF (픽셀),2026-06-26
122709263,한성컴퓨터 TFG Magnetox 2XF (쿠키앤크림),2026-06-26
122709253,"그루브스톤 GV10 수제윤활 애플라떼 GA (저소음 밀키S축, 45g)",2026-06-26
122709251,"그루브스톤 GV10 수제윤활 애플라떼 GA (저소음 밀키S축, 38g)",2026-06-26
122698367,지클릭커 그릭 슬림 실리콘 팜레스트 키보드 손목받침대,2026-06-26
97903901,SPM PL87W 목새 유무선 기계식 (중고),2026-06-23
94082054,CORSAIR K70 MAX RGB MGX 게이밍 기계식 (중고),2026-06-23
94028462,앱코 MK108W 무선 (중고),2026-06-23
93858794,ROYCHE 산리오 캐릭터즈 레진 키캡 (마이멜로디),2026-06-23
75940034,SPM GP100 키보드 마우스 세트 (블랙),2026-06-23
59923691,서진네트웍스 UNICORN BK-1200SB 무선,2026-06-23
28862972,COX CK01 SAHARA HUANO 퀵스압 게이밍 기계식 (갈축),2026-06-23
122708008,로지텍 G PRO X SUPERLIGHT 2c + PRO X TKL LIGHTSPEED 키보드 마우스 세트,2026-06-23
122707954,로지텍 G413 SE + G102 키보드 마우스 세트 토이스토리 에디션 (레트로),2026-06-23
76946579,LEOBOG HI86 유무선 기계식 해외구매 (옐로우축),2026-06-22
76946576,LEOBOG HI86 유무선 기계식 해외구매 (성시축),2026-06-22
57692105,사오파오 써커스2,2026-06-22
122693217,JXM (GRAY MOD),2026-06-22
11889436,한성컴퓨터 TFG ARF 게이트론 RGB 게이밍 LP 광축 화이트 (청축),2026-06-22
11889358,한성컴퓨터 TFG ARF 게이트론 RGB 게이밍 LP 광축 블랙 (청축),2026-06-22
97843100,QSENN MK450 무선 키보드 마우스 세트 (중고),2026-06-21
90269465,"그루브스톤 GV10 수제윤활 애플라떼 GA (저소음 밀키축, 45g)",2026-06-21
90269450,"그루브스톤 GV10 수제윤활 애플라떼 GA (저소음 밀키축, 38g)",2026-06-21
90269417,"그루브스톤 GV10 수제윤활 애플라떼 GA (저소음 갈축, 45g)",2026-06-21
90269408,"그루브스톤 GV10 수제윤활 애플라떼 GA (저소음 갈축, 38g)",2026-06-21
61842338,Topre REALFORCE R3S R3SC11 (해외구매),2026-06-21
92546342,ASUS ROG STRIX SCOPE II X 기계식 (STORM축),2026-06-20
92546336,ASUS ROG STRIX SCOPE II X 기계식 (SNOW축),2026-06-20
122705649,강원전자 NETmate NM-KB04N,2026-06-20
91348541,한성컴퓨터 TFG Cloud Max CF 염료승화 유무선 기계식 서피 (브라운슈가 토독),2026-06-19
62564189,Teamwolf RAVEN 68 (해외구매),2026-06-19
122705193,로지텍 G413 SE + G102 키보드 마우스 세트 토이스토리 에디션 (버즈),2026-06-19
122704979,상도아이앤티 ANYZONE ANY-K7 (블랙핑크),2026-06-19
122704972,상도아이앤티 ANYZONE ANY-K7 (다크그레이),2026-06-19
122703918,AULA HERO 75HE 유무선 (해외구매),2026-06-19
122703909,AULA F68 RX (해외구매),2026-06-19
122703899,AULA AG63 (해외구매),2026-06-19
10408785,HyperX Alloy Origins (적축),2026-06-19
99742769,AULA NOVA75 유무선 기계식 해외구매 (해당축),2026-06-18
99053969,MAXTILL GM-MK909 무선 키보드 마우스 세트 (중고),2026-06-18
94449311,AULA F87 Pro 기계식 라이트 올리비아 한글 (중고),2026-06-18
67847672,"그루브스톤 GV10 수제윤활 라이트G GA (저소음 갈축, 45g)",2026-06-18
67847546,"그루브스톤 GV10 수제윤활 라이트G GA (저소음 밀키축, 45g)",2026-06-18
67847534,"그루브스톤 GV10 수제윤활 라이트G GA (저소음 밀키축, 38g)",2026-06-18
59924828,SPM Soulcat 고함량 PBT 염료승화 영문 키캡 164키 판다,2026-06-18
32125121,SPM Soulcat 고함량 PBT 염료승화 영문 키캡 141키 구름 강아지,2026-06-18
17345081,글로리어스 AURA KEYCAPS V2 (핑크),2026-06-18
17345069,글로리어스 AURA KEYCAPS V2 (화이트),2026-06-18
17345051,글로리어스 AURA KEYCAPS V2 (블랙),2026-06-18
15794654,머레이 MBK-1000 블루투스 스마트폰 키보드 태블릿형 (핑크),2026-06-18
122703418,Chilkey ND104 유무선 소프트 핑크 (WS Breeze),2026-06-18
122703406,Chilkey ND104 유무선 루멘 옐로우 (WS Breeze),2026-06-18
122703400,Chilkey ND104 유무선 쉐도우 블랙 (WS Silent Linear),2026-06-18
122702171,펠로우즈 브레이타 컴팩트 키보드 손목받침대 (블랙),2026-06-18
122702169,펠로우즈 브레이타 컴팩트 키보드 손목받침대 (그레이),2026-06-18
122702168,펠로우즈 브레이타 컴팩트 키보드 손목받침대 (마린),2026-06-18
122702167,펠로우즈 브레이타 컴팩트 키보드 손목받침대 (세이지),2026-06-18
122702165,펠로우즈 브레이타 컴팩트 키보드 손목받침대 (샌드),2026-06-18
122701131,"그루브스톤 GV10 수제윤활 라이트크레용 GA (저소음 밀키S축, 45g)",2026-06-18
122701130,"그루브스톤 GV10 수제윤활 라이트크레용 GA (저소음 밀키S축, 38g)",2026-06-18
122701119,"그루브스톤 GV10 수제윤활 라이트크레용 GA (저소음 갈축, 45g)",2026-06-18
122701116,"그루브스톤 GV10 수제윤활 라이트크레용 GA (저소음 갈축, 38g)",2026-06-18
122701112,"그루브스톤 GV10 수제윤활 라이트크레용 GA (저소음 밀키축, 45g)",2026-06-18
122701107,"그루브스톤 GV10 수제윤활 라이트크레용 GA (저소음 밀키축, 38g)",2026-06-18
122701091,"그루브스톤 GV10 수제윤활 라이트G GA (저소음 갈축, 38g)",2026-06-18
122701079,"그루브스톤 GV10 수제윤활 라이트G GA (저소음 밀키S축, 45g)",2026-06-18
122701077,"그루브스톤 GV10 수제윤활 라이트G GA (저소음 밀키S축, 38g)",2026-06-18
122666868,로지텍 G512 X 98 팜레스트,2026-06-18
122654053,MACHENIKE KG87 유무선,2026-06-18
122634170,"그루브스톤 GV10M 8K 유무선 기계식 라이트크레용 (저소음 밀키축, 45g)",2026-06-18
106222241,AULA S102Pro 유무선 (핑크),2026-06-18
98780501,Womier RD75 Pro 유무선 (중고),2026-06-16
5122935,앱코 HACKER K840 조약돌 레트로 축교환 기계식 블랙 (적축),2026-06-16
28557293,ASUS ROG AZOTH WHITE PBT 유무선 영문 (적축),2026-06-16
20328707,아이노비아 YUNZII X75 (화이트),2026-06-16
19976957,아이노비아 YUNZII X75 (블랙),2026-06-16
18020336,데이비드테크 엔보우 N패드 맥스 (블랙),2026-06-16
18020273,데이비드테크 엔보우 N패드 맥스 (화이트),2026-06-16
15825857,앱코 K840 사각 레트로 축교환 기계식 블랙 (적축),2026-06-16
15825842,앱코 K840 사각 레트로 축교환 기계식 블랙 (갈축),2026-06-16
15825632,앱코 K840 사각 레트로 축교환 기계식 블랙 (청축),2026-06-16
122699150,FL-ESPORTS NX87HE 네온 그레이 (레몬축),2026-06-16
122699149,FL-ESPORTS NX87HE 네온 그레이 (저소음 스톰축),2026-06-16
122699046,주연테크 긱스타 GK108FE (겨울 그루잠),2026-06-16
122699045,주연테크 긱스타 GK108FE (가을 아람),2026-06-16
122699044,주연테크 긱스타 GK108FE (여름 윤슬),2026-06-16
122699043,주연테크 긱스타 GK108FE (봄 꽃비),2026-06-16
122631824,로지텍 PRO X2 SUPERSTRIKE + G PRO X 60 키보드 마우스 세트,2026-06-16
106045907,로지텍 PRO X2 SUPERSTRIKE + G PRO X TKL 키보드 마우스 세트,2026-06-16
106045850,로지텍 PRO X2 SUPERSTRIKE + PRO X TKL RAPID 키보드 마우스 세트,2026-06-16
97955678,CORSAIR K70 RGB CORE 게이밍 기계식 (중고),2026-06-15
91422770,Keychron PR53 실리콘 팜레스트,2026-06-15
76870934,MCHOSE G75 PRO 유무선 기계식 해외구매 (배추두부축),2026-06-15
72671282,로지텍 Wave Keys (병행수입),2026-06-15
63464750,MCHOSE G75 PRO 유무선 기계식 해외구매 (옵션선택구성),2026-06-15
52065695,YUNZII AL66 유무선 기계식 (해외구매),2026-06-15
94999592,QSENN K1000 무선키보드 (중고),2026-06-14
98780078,COX CA75 3모드 CNC 알루미늄 유무선 기계식 실버 (중고),2026-06-13
97904024,이음전산 스마텍 STBK-F2000 무선 중고,2026-06-13
94028288,darkFlash GD87 유무선 기계식 (중고),2026-06-13
89529653,Actto B309 유무선 (화이트),2026-06-13
65302943,COX CK80 유무선 기계식,2026-06-13
57295067,지클릭커 레트로 M 레드 SPRK104 RGB 무선 키보드 무소음 마우스 세트 (RB2),2026-06-13
56153978,Keychron CC-21 하드 케이스,2026-06-13
56059229,지클릭커 레트로 M 레드 SPRK104 RGB 무선 키보드 무소음 마우스 세트 (RB1),2026-06-13
35810393,퓨전에프앤씨 카카오프렌즈 KFKM-200 춘식이 죠르디 무선 키보드 마우스 세트,2026-06-13
27734216,퓨전에프앤씨 INOTE X-KEY 98RB 무선,2026-06-13
15673424,아이리버 Medic-WS3 항균 저소음 무선 키보드 마우스 세트 (핑크),2026-06-13
15673412,아이리버 Medic-WS3 항균 저소음 무선 키보드 마우스 세트 (화이트),2026-06-13
15673397,아이리버 Medic-WS3 항균 저소음 무선 키보드 마우스 세트 (블랙),2026-06-13
14321915,앱코 TOS100 무선 키보드,2026-06-13
122685448,프리플로우 archon M1 PRO 2 MAX (중고),2026-06-13
78712091,Keychron K15 PRO MAX 유무선 기계식 레트로 (바나나축),2026-06-12
43529879,레오폴드 FC630MBT MX2A 코랄 블루 한글 (저소음 적축),2026-06-12
43529531,레오폴드 FC630MBT MX2A 코랄 블루 한글 (청축),2026-06-12
16141688,몬스타 몬스타기어 PBT 한영정각 108 키캡 (화이트),2026-06-12
122697687,ROYCHE 베이비 잔망루피 무선,2026-06-12
122697672,MAXTILL GM-OKM100 무선 키보드 마우스 세트,2026-06-12
122697653,엔클롬 FOLDY1 무선,2026-06-12
122697557,프리플로우 archon AK45 BASIC 유무선 기계식 프레시민트 (저소음 디딤돌축),2026-06-12
122697555,프리플로우 archon AK45 BASIC 유무선 기계식 프레시민트 (에그스톤축),2026-06-12
122697553,프리플로우 archon AK45 BASIC 유무선 기계식 프레시민트 (저소음 소나기축),2026-06-12
122697549,프리플로우 archon AK45 BASIC 유무선 기계식 블루블랙 (저소음 디딤돌축),2026-06-12
122697547,프리플로우 archon AK45 BASIC 유무선 기계식 블루블랙 (에그스톤축),2026-06-12
122697545,프리플로우 archon AK45 BASIC 유무선 기계식 블루블랙 (저소음 소나기축),2026-06-12
122697539,프리플로우 archon AK45 BASIC 유무선 기계식 핑크블라썸 (저소음 디딤돌축),2026-06-12
122697537,프리플로우 archon AK45 BASIC 유무선 기계식 핑크블라썸 (에그스톤축),2026-06-12
122697526,프리플로우 archon AK45 BASIC 유무선 기계식 핑크블라썸 (저소음 소나기축),2026-06-12
122697482,프리플로우 archon AK55 BASIC 유무선 기계식 핑크블라썸 (저소음 소나기축),2026-06-12
122697481,프리플로우 archon AK55 BASIC 유무선 기계식 핑크블라썸 (저소음 크리미축),2026-06-12
122697479,프리플로우 archon AK55 BASIC 유무선 기계식 프레시민트 (저소음 소나기축),2026-06-12
122697478,프리플로우 archon AK55 BASIC 유무선 기계식 프레시민트 (저소음 크리미축),2026-06-12
122697477,프리플로우 archon AK55 BASIC 유무선 기계식 퍼플레인 (저소음 소나기축),2026-06-12
122697475,프리플로우 archon AK55 BASIC 유무선 기계식 퍼플레인 (저소음 크리미축),2026-06-12
122697252,주연테크 긱스타 GK03 PRO (핑크),2026-06-12
122697249,주연테크 긱스타 GK03 PRO (블랙),2026-06-12
122697026,로지텍 MK880 무선 키보드 마우스 세트 (정품) (오프화이트),2026-06-12
122697021,로지텍 MK880 무선 키보드 마우스 세트 (정품) (그라파이트),2026-06-12
122696026,80Retros GB65 기계식 커스텀 베어본,2026-06-11
122695957,웨이코스 씽크웨이 토체프 101 기계식 곰돌찡이랑 토끼찡 에디션,2026-06-11
122695514,포유디지탈 iMUZ IK-C401 컨버터 탭 14 프로 전용,2026-06-11
122693232,JXM (ACCENT 2),2026-06-11
122693225,JXM (ACCENT 6),2026-06-11
