product_code,product_name,first_collected_date
70255172,"QSENN MK128 사일런트 무선 키보드 마우스 세트 (화이트, 키스킨 포함)",2026-05-28
70101728,CHERRY MX BOARD 3.0S RGB MX2A 기계식 핑크 (적축),2026-05-28
70101725,CHERRY MX BOARD 3.0S RGB MX2A 기계식 화이트 (적축),2026-05-28
70101593,CHERRY MX BOARD 3.0S RGB MX2A 기계식 핑크 (저소음 적축),2026-05-28
70099166,LEOBOG Hi98 기계식 (황축),2026-05-28
70003742,필립스 SPT6338 무선 키보드 마우스 세트 (화이트),2026-05-28
70003739,필립스 SPT6338 무선 키보드 마우스 세트 (그린),2026-05-28
70003631,AULA F108 유무선 기계식 올리비아 화이트 한글 (세이야축),2026-05-28
70003628,AULA F108 유무선 기계식 올리비아 화이트 한글 (황축),2026-05-28
70003625,AULA F108 유무선 기계식 올리비아 화이트 한글 (저소음 바다축),2026-05-28
70003601,AULA F108 유무선 기계식 스카이 블랙 한글 (저소음 바다축),2026-05-28
70003592,AULA F108 유무선 기계식 스카이 블랙 한글 (황축),2026-05-28
70003532,AULA F108 유무선 기계식 스카이 블랙 한글 (세이야축),2026-05-28
70002578,퓨전에프앤씨 INOTE PK602B 무선 (피카츄),2026-05-28
70000838,몬스타 가츠 X21PRO 유무선 기계식 (화이트),2026-05-28
69694892,CHERRY KC200 MX2A 기계식 그레이 오렌지 (백축),2026-05-28
69694874,CHERRY KC200 MX2A 기계식 화이트 민트 (백축),2026-05-28
69656180,CORSAIR DROP 반지의 제왕 기계식 (RINGWRAITH),2026-05-28
6950794,CJ ENM N ENTUS OGN-WKM20 무선 키보드 마우스 세트 (핑크),2026-05-28
6950758,CJ ENM N ENTUS OGN-WKM20 무선 키보드 마우스 세트 (블랙),2026-05-28
69465242,CORSAIR Drop Expression Series 기계식 (Togekey),2026-05-28
69465236,CORSAIR Drop Expression Series 기계식 (Shinai),2026-05-28
69465230,CORSAIR Drop Expression Series 기계식 (Prism),2026-05-28
69465218,CORSAIR Drop Expression Series 기계식 (Mechtropolis),2026-05-28
69465200,CORSAIR Drop Expression Series 기계식 (Matcha Summer),2026-05-28
68788460,"그루브스톤 GV10 수제윤활 따뜻한크레용 GA (저소음 코랄축, 45g)",2026-05-28
68788439,"그루브스톤 GV10 수제윤활 따뜻한크레용 GA (저소음 밀키축, 45g)",2026-05-28
68788430,"그루브스톤 GV10 수제윤활 따뜻한크레용 GA (저소음 밀키축, 38g)",2026-05-28
68787902,COX CK88 유무선 기계식 민트화이트 (베이비 화이트축),2026-05-28
68787662,앱코 AK99 유무선 기계식 핑크 (저소음 피치축),2026-05-28
68688887,Keychron Q13 MAX 유무선 쉘화이트 (저소음 적축),2026-05-28
68687153,QSENN Q99 유무선 기계식 블루퍼플 (저소음 크림옐로우PRO),2026-05-28
68687036,QSENN Q99 유무선 기계식 크림치즈 (저소음 바다축),2026-05-28
68686733,QSENN Q99 유무선 기계식 화이트 (저소음 피치축),2026-05-28
68686694,QSENN Q99 유무선 기계식 블랙 (저소음 라임축),2026-05-28
68686661,QSENN Q99 유무선 기계식 블랙 (바다소금축 넌클릭),2026-05-28
68577281,CHERRY KC200 MX2A 기계식 화이트 민트 (적축),2026-05-28
68577212,CHERRY KC200 MX2A 기계식 블랙 브론즈 (저소음 적축),2026-05-28
68533424,앱코 K580 교체축 게이밍 기계식 스카이 (청축),2026-05-28
68533382,앱코 K580 교체축 게이밍 기계식 젠틀맨 (청축),2026-05-28
68440094,Keychron K8 PRO MAX 유무선 기계식 쉘화이트 (저소음 화이트축),2026-05-28
68440004,Keychron K10 PRO MAX 유무선 기계식 쉘화이트 (바나나축),2026-05-28
68439992,Keychron K10 PRO MAX 유무선 기계식 쉘화이트 (저소음 바나나축),2026-05-28
68439983,Keychron K10 PRO MAX 유무선 기계식 쉘화이트 (저소음 적축),2026-05-28
68439974,Keychron K10 PRO MAX 유무선 기계식 쉘화이트 (저소음 갈축),2026-05-28
68437058,NuPhy Halo75 V2 유무선 기계식 한글 (레몬축),2026-05-28
68300195,NuPhy Halo96 V2 유무선 기계식 영문 (민트축),2026-05-28
68300189,NuPhy Halo96 V2 유무선 기계식 영문 (레몬축),2026-05-28
68297291,로지텍 G915 X LIGHTSPEED TKL 블랙 (정품) (적축),2026-05-28
68244674,프리플로우 archon AK74 유무선 기계식 (메카닉),2026-05-28
68242169,지클릭커 슈퍼히어로 SPK104 컬러드 기계식 (화이트),2026-05-28
68242166,지클릭커 슈퍼히어로 SPK104 컬러드 기계식 (퍼플),2026-05-28
68242163,지클릭커 슈퍼히어로 SPK104 컬러드 기계식 (그린),2026-05-28
67975925,프리플로우 archon AK47 유무선 기계식 (이클립스),2026-05-28
67975883,프리플로우 archon AK47 유무선 기계식 (메카닉),2026-05-28
6795616,CJ ENM ENTUS KM10 유선 키보드 마우스 세트 (화이트),2026-05-28
67692167,CORSAIR K70 PRO TKL MGX 기계식 (화이트),2026-05-28
67683176,지클릭커 OFFICEPRO GMK-300 저소음 키보드 마우스 세트 (실버 화이트),2026-05-28
67683173,지클릭커 OFFICEPRO GMK-300 저소음 키보드 마우스 세트 (퍼플),2026-05-28
67625648,QSENN Q75 가스켓 유무선 기계식 블루퍼플 (저소음 크림옐로우PRO),2026-05-28
67625564,QSENN Q75 가스켓 유무선 기계식 크림치즈 (저소음 바다축),2026-05-28
67625453,QSENN Q75 가스켓 유무선 기계식 화이트 (저소음 피치축),2026-05-28
67625171,QSENN Q75 가스켓 유무선 기계식 블랙 (저소음 라임축),2026-05-28
67625153,QSENN Q75 가스켓 유무선 기계식 블랙 (바다소금축 넌클릭),2026-05-28
67624970,QSENN DT35 89 유무선 기계식 블랙 (저소음 바다소금축),2026-05-28
67581236,SPM NEKEY LUCK68 유무선 기계식 (크림민트),2026-05-28
67372100,"지클릭커 OFFICEPRO WK50 사일런스 M RGB 무소음 방수 무선 블루투스 98 (Gundam, RC2)",2026-05-28
67372097,"지클릭커 OFFICEPRO WK50 사일런스 M RGB 무소음 방수 무선 블루투스 98 (Gundam, RC1)",2026-05-28
67372094,"지클릭커 OFFICEPRO WK50 사일런스 M RGB 무소음 방수 무선 블루투스 98 (Sky City, RC2)",2026-05-28
67372091,"지클릭커 OFFICEPRO WK50 사일런스 M RGB 무소음 방수 무선 블루투스 98 (Sky City ,RC1)",2026-05-28
67372085,"지클릭커 OFFICEPRO WK50 사일런스 M RGB 무소음 방수 무선 블루투스 98 (Greenwich, RC2)",2026-05-28
67372007,"지클릭커 OFFICEPRO WK50 사일런스 M RGB 무소음 방수 무선 블루투스 108 (Gundam, RC2)",2026-05-28
67372004,"지클릭커 OFFICEPRO WK50 사일런스 M RGB 무소음 방수 무선 블루투스 108 (Gundam, RC1)",2026-05-28
67372001,"지클릭커 OFFICEPRO WK50 사일런스 M RGB 무소음 방수 무선 블루투스 108 (Sky City, RC2)",2026-05-28
67371995,"지클릭커 OFFICEPRO WK50 사일런스 M RGB 무소음 방수 무선 블루투스 108 (Sky City, RC1)",2026-05-28
67371992,"지클릭커 OFFICEPRO WK50 사일런스 M RGB 무소음 방수 무선 블루투스 108 (Greenwich, RC2)",2026-05-28
6680398,아이리버 EQwear-X30 무선 키보드 마우스 세트 (핑크),2026-05-28
66121424,앱코 K417 레트로 기계식 (적축),2026-05-28
6577905,아이리버 EQwear-K30 유선 키보드 (블루),2026-05-28
6577900,아이리버 EQwear-K30 유선 키보드 (민트),2026-05-28
6577896,아이리버 EQwear-K30 유선 키보드 (퍼플),2026-05-28
6577893,아이리버 EQwear-K30 유선 키보드 (핫핑크),2026-05-28
6577891,아이리버 EQwear-K30 유선 키보드 (베이비핑크),2026-05-28
6577888,아이리버 EQwear-K30 유선 키보드 (화이트),2026-05-28
6577768,아이리버 EQwear-WMK30 무선 키보드 마우스 세트 (블루),2026-05-28
6577764,아이리버 EQwear-WMK30 무선 키보드 마우스 세트 (민트),2026-05-28
6577763,아이리버 EQwear-WMK30 무선 키보드 마우스 세트 (퍼플),2026-05-28
6577761,아이리버 EQwear-WMK30 무선 키보드 마우스 세트 (핫핑크),2026-05-28
6577759,아이리버 EQwear-WMK30 무선 키보드 마우스 세트 (베이비핑크),2026-05-28
6554391,데이비드테크 엔보우 블루투스 키보드 N패드 라이트 (실버),2026-05-28
6527468,핫라인게임즈 H2 키보드 받침 스탠드 (실버),2026-05-28
6527463,핫라인게임즈 H2 키보드 받침 스탠드 (블랙),2026-05-28
6513568,VORTEX Race3 영문 (백축),2026-05-28
6445218,플레오맥스 AVEC-WMK110 무선 키보드 마우스 세트 (화이트),2026-05-28
64390097,퓨전에프앤씨 INOTE X-KEY 38BT (버터옐로우),2026-05-28
6410666,티앤에스인터내셔널 NOX NX-MK1 METEL KEYCAP (골드),2026-05-28
6366534,데이비드테크 엔보우 접이식 블루투스 키보드 N패드 (블랙),2026-05-28
63478136,AULA M75 유무선 기계식 해외구매 (퍼플축),2026-05-28
63478103,AULA M75 유무선 기계식 해외구매 (신월축),2026-05-28
63467021,AULA F87 Pro 기계식 라이트 올리비아 한글 (저소음 바다축),2026-05-28
63466976,AULA F87 Pro 기계식 다크 올리비아 한글 (저소음 바다축),2026-05-28
63421031,COX SLC 시리즈 실리콘 팜레스트 베이지 (풀배열),2026-05-28
63418268,한성컴퓨터 TFG Cloud CL 유무선 기계식 퍼플하트 (핑크솔트 토독),2026-05-28
63418265,한성컴퓨터 TFG Cloud CL 유무선 기계식 퍼플하트 (브라운슈가 토독),2026-05-28
63418259,한성컴퓨터 TFG Cloud CL 유무선 기계식 퍼플하트 (스카이블루 뽀송),2026-05-28
63418220,한성컴퓨터 TFG Cloud CL 유무선 기계식 모카코코아 (브라운슈가 토독),2026-05-28
63418217,한성컴퓨터 TFG Cloud CL 유무선 기계식 모카코코아 (스카이블루 뽀송),2026-05-28
63418196,한성컴퓨터 TFG Cloud CL 유무선 기계식 비너스네이비 (핑크솔트 토독),2026-05-28
63418190,한성컴퓨터 TFG Cloud CL 유무선 기계식 비너스네이비 (스카이블루 뽀송),2026-05-28
63418178,한성컴퓨터 TFG Cloud CL 유무선 기계식 코튼캔디 (핑크솔트 토독),2026-05-28
63418175,한성컴퓨터 TFG Cloud CL 유무선 기계식 코튼캔디 (브라운슈가 토독),2026-05-28
63418154,한성컴퓨터 TFG Cloud CL 유무선 기계식 코튼캔디 (스카이블루 뽀송),2026-05-28
63143699,프리플로우 archon RE:AL HX 유무선 기계식 (마카롱),2026-05-28
63143570,앱코 MK87 저소음 텐키리스 멤브레인 (블루),2026-05-28
63143480,앱코 MK108 저소음 멤브레인 (블루),2026-05-28
63086696,QSENN DT35 106 가스켓 유무선 기계식 화이트 (저소음 바다소금축),2026-05-28
63086663,QSENN DT35 106 가스켓 유무선 기계식 블랙 (저소음 바다소금축),2026-05-28
63086615,QSENN DT35 106 가스켓 유무선 기계식 블랙 (애플민트축),2026-05-28
63028202,"한성컴퓨터 GK898B PRO 동그리 8K 유무선 무접점 (TOY BLOCK2, 45g)",2026-05-28
63028199,"한성컴퓨터 GK898B PRO 동그리 8K 유무선 무접점 (TOY BLOCK2, 35g)",2026-05-28
63028193,"한성컴퓨터 GK898B PRO 동그리 8K 유무선 무접점 (BLACK PINK, 45g)",2026-05-28
63028184,"한성컴퓨터 GK898B PRO 동그리 8K 유무선 무접점 (BLACK PINK, 35g)",2026-05-28
63028034,QSENN DT35 104 가스켓 유무선 기계식 블루퍼플 (저소음 피치축),2026-05-28
63027989,QSENN DT35 104 가스켓 유무선 기계식 블루퍼플 (저소음 톰축),2026-05-28
6302068,Bless ZIO KMW4030 무선 키보드 무선 무소음 마우스 세트 (핑크),2026-05-28
6302059,Bless ZIO KMW4030 무선 키보드 무선 무소음 마우스 세트 (그레이),2026-05-28
6302057,Bless ZIO KMW4030 무선 키보드 무선 무소음 마우스 세트 (화이트),2026-05-28
6302040,Bless ZIO KMW4030 무선 키보드 무선 무소음 마우스 세트 (블랙),2026-05-28
6290416,Razer Huntsman Elite US (클릭),2026-05-28
6278440,COX CK420 교체축 레인보우 LED 게이밍 기계식 화이트 (갈축),2026-05-28
6278433,COX CK420 교체축 레인보우 LED 게이밍 기계식 화이트 (적축),2026-05-28
6278417,COX CK420 교체축 레인보우 LED 게이밍 기계식 화이트 (청축),2026-05-28
6278316,COX CK420 교체축 레인보우 LED 게이밍 기계식 블랙 (갈축),2026-05-28
6278312,COX CK420 교체축 레인보우 LED 게이밍 기계식 블랙 (적축),2026-05-28
6278297,COX CK420 교체축 레인보우 LED 게이밍 기계식 블랙 (청축),2026-05-28
6235858,VORTEX Race3 영문 (적축),2026-05-28
6235798,VORTEX Race3 영문 (청축),2026-05-28
6230188,HP KM100 Combo (키스킨 포함),2026-05-28
62273783,디프레오 아크릴 팜레스트 (풀배열),2026-05-28
6197601,CJ ENM ENTUS K330G GENESIS ED CJ광축 게이밍 (블랙),2026-05-28
6051833,Mistel Sleeker 텐키리스 실버 영문 (흑축),2026-05-28
6051830,Mistel Sleeker 텐키리스 실버 영문 (적축),2026-05-28
60321863,이킵먼트 아크릴 팜레스트 (텐키리스),2026-05-28
60321839,이킵먼트 아크릴 팜레스트 (풀사이즈),2026-05-28
60231563,Keychron Q0 MAX 유무선 기계식 (바나나축),2026-05-28
60231383,Keychron Q0 MAX 유무선 기계식 (갈축),2026-05-28
60231158,Keychron Q0 MAX 유무선 기계식 (적축),2026-05-28
60170873,쿠슝 키보드 손목받침대 (L),2026-05-28
60170864,쿠슝 키보드 손목받침대 (M),2026-05-28
60166250,다얼유 A87 PRO 8K 기계식 레트로베이지 (저소음 머스타드축),2026-05-28
60150761,레오폴드 FC730MBT MX2A 코랄 블루 영문 (은축),2026-05-28
60150746,레오폴드 FC730MBT MX2A 코랄 블루 영문 (저소음 적축),2026-05-28
60150728,레오폴드 FC730MBT MX2A 코랄 블루 영문 (갈축),2026-05-28
60150716,레오폴드 FC730MBT MX2A 코랄 블루 영문 (청축),2026-05-28
60150695,레오폴드 FC730MBT MX2A 코랄 블루 한글 (은축),2026-05-28
60150686,레오폴드 FC730MBT MX2A 코랄 블루 한글 (흑축),2026-05-28
60150671,레오폴드 FC730MBT MX2A 코랄 블루 한글 (저소음 적축),2026-05-28
60150665,레오폴드 FC730MBT MX2A 코랄 블루 한글 (적축),2026-05-28
60150620,레오폴드 FC730MBT MX2A 코랄 블루 한글 (청축),2026-05-28
60144911,Keychron 슈퍼 스위치 110Pcs (바나나축),2026-05-28
60144908,Keychron 슈퍼 스위치 110Pcs (갈축),2026-05-28
60064484,ASUS ROG AZOTH WHITE PBT 유무선 한글 (RED축),2026-05-28
60064412,ASUS ROG FALCHION RX Low Profile 유무선 기계식 한글 (적축),2026-05-28
60064367,ASUS ROG STRIX SCOPE II 96 유무선 기계식 WHITE (STORM축),2026-05-28
59928845,로지텍 G515 LIGHTSPEED TKL (정품) (화이트),2026-05-28
59928836,로지텍 G515 LIGHTSPEED TKL (정품) (블랙),2026-05-28
59927141,아이노트 아크릴 팜레스트 (텐키리스),2026-05-28
59927036,아이노트 아크릴 팜레스트 (풀타입),2026-05-28
59921018,필립스 SPT6318 무선 키보드 마우스 세트 (블랙),2026-05-28
59759054,지클릭커 OFFICEPRO WMK20 인체공학 펜타 무선 키보드 마우스 세트 (화이트),2026-05-28
59759024,지클릭커 OFFICEPRO WMK20 인체공학 펜타 무선 키보드 마우스 세트 (블랙),2026-05-28
5967481,로지텍 MK850 (병행수입),2026-05-28
59523347,지클릭커 OFFICEPRO EMK100 인체공학 무선 키보드 마우스 세트 (블랙),2026-05-28
59088428,프리플로우 archon E1 PRO MAX 유무선 무접점 (SEOLBIM),2026-05-28
58794377,QSENN DT35 89 유무선 기계식 화이트 (바다소금축),2026-05-28
58792526,QSENN DT35 89 유무선 기계식 블랙 (애플민트축 V1),2026-05-28
5828061,"COX 카일 정품 광축 스위치 (5+5개, 클릭/리니어)",2026-05-28
5828059,"COX 카일 정품 광축 스위치 (10개, 리니어)",2026-05-28
58113596,VARMILO SWORD68 유무선 (아리엘),2026-05-28
58100786,QSENN SEM-DT35S LED Stella (화이트),2026-05-28
58100684,한성컴퓨터 TFG Magnetox XF (SURFYY),2026-05-28
57943676,QSENN DT35 87 유무선 기계식 화이트 (저소음 크림옐로우PRO),2026-05-28
57940025,QSENN DT35 87 유무선 기계식 화이트 (저소음 피치축),2026-05-28
57933890,QSENN DT35 87 유무선 기계식 화이트 (저소음 라임축 V3),2026-05-28
57933281,QSENN DT35 87 유무선 기계식 화이트 (민트축 V1),2026-05-28
57505373,이킵먼트 블랙 웬지 팜레스트 (풀사이즈),2026-05-28
57293300,레오폴드 FC750RBT PD 에버 그린 영문 (적축),2026-05-28
57293261,레오폴드 FC750RBT PD 에버 그린 한글 (적축),2026-05-28
57293252,레오폴드 FC750RBT PD 에버 그린 한글 (갈축),2026-05-28
57293234,레오폴드 FC750RBT PD 에버 그린 한글 (청축),2026-05-28
57293048,레오폴드 NP750RBT PD 그레이 블루 (저소음 적축),2026-05-28
57293042,레오폴드 NP750RBT PD 그레이 블루 (적축),2026-05-28
57292925,레오폴드 FC650MDSBT PD 그레이 블루 영문 (저소음 적축),2026-05-28
57292916,레오폴드 FC650MDSBT PD 그레이 블루 영문 (적축),2026-05-28
57292907,레오폴드 FC650MDSBT PD 유무선 그레이 블루 한글 (적축),2026-05-28
57292553,ASUS ROG AZOTH WHITE PBT 유무선 한글 (STORM축),2026-05-28
5697549,Actto KBD-48 레트로 무선 (블랙),2026-05-28
56502554,레오폴드 FC650MDS PD 그레이 블루 한글 (은축),2026-05-28
56502473,레오폴드 FC650MDS PD 그레이 블루 영문 (백축),2026-05-28
56502470,레오폴드 FC650MDS PD 그레이 블루 영문 (은축),2026-05-28
5638241,삼성전자 SKP-900B 키보드 마우스 세트 (키스킨 미포함),2026-05-28
56060864,MCHOSE GX87 유무선 기계식 해외구매 (오렌지축),2026-05-28
56060858,MCHOSE GX87 유무선 기계식 해외구매 (말차라떼축),2026-05-28
56059454,지클릭커 OFFICEPRO WK10 저소음 무선 블루투스 (퍼플),2026-05-28
56059439,지클릭커 OFFICEPRO WMK10 무소음 무선 키보드 마우스 세트 (퍼플),2026-05-28
5605337,라이트컴 COMS 아랍어 키보드 스티커 (IB712),2026-05-28
55388669,플레오맥스 PBC-300 무선 키보드 마우스 세트 (블랙),2026-05-28
55388462,레오폴드 키보드 러그 (L),2026-05-28
55388435,레오폴드 키보드 러그 (S),2026-05-28
54814406,Pulsar XBOARD QS 기계식 (화이트),2026-05-28
54697745,Keychron K10 PRO SE 쉘 화이트 유무선 기계식 (바나나축),2026-05-28
54697733,Keychron K10 PRO SE 레트로 유무선 기계식 (바나나축),2026-05-28
54697727,Keychron K10 PRO SE 레트로 유무선 기계식 (저소음 적축),2026-05-28
5454375,제닉스 XPAM 대나무 손목 받침대 (풀배열용),2026-05-28
5454370,제닉스 XPAM 대나무 손목 받침대 (텐키리스용),2026-05-28
54482933,Keychron K2 PRO 커스텀 보강판 (황동),2026-05-28
54482930,Keychron K2 PRO 커스텀 보강판 (폴리카보네이트),2026-05-28
54314789,darkFlash GD87 유무선 기계식 (밀크 브라운),2026-05-28
54314693,아이노비아 YUNZII AL71 유무선 기계식 (퍼플),2026-05-28
54314690,아이노비아 YUNZII AL71 유무선 기계식 (그린),2026-05-28
54314684,아이노비아 YUNZII AL71 유무선 기계식 (레드),2026-05-28
54314678,아이노비아 YUNZII AL71 유무선 기계식 (블루),2026-05-28
54314675,아이노비아 YUNZII AL71 유무선 기계식 (핑크),2026-05-28
5418467,로지텍 K380 (병행수입),2026-05-28
54099740,CHERRY KC200 MX2A 기계식 그레이 오렌지 (저소음 적축),2026-05-28
53520383,지클릭커 윙 코튼 키보드 쿠션 손목 받침대 (그린),2026-05-28
53520380,지클릭커 윙 코튼 키보드 쿠션 손목 받침대 (핑크),2026-05-28
53520374,지클릭커 윙 코튼 키보드 쿠션 손목 받침대 (화이트),2026-05-28
5346096,i-rocks K23W 브릭 키보드 (핑크),2026-05-28
5346093,i-rocks K23W 브릭 키보드 (화이트),2026-05-28
5319001,로지텍 MK235 (병행수입),2026-05-28
5242458,Aidata DMK-1300M (화이트),2026-05-28
5237487,MAXTILL 한/영 이중사출 104키 가디언 컬러키캡 (오렌지),2026-05-28
5228638,"앱코 HACKER QUICK SWAP용 OUTEMU 스위치 (8개, 청축)",2026-05-28
5143978,MAXTILL 한/영 이중사출 104키 가디언 컬러키캡 (레드),2026-05-28
49735388,TKD Cycle 7 풀알루미늄 기계식 커스텀 베어본 (Cream),2026-05-28
49137698,로지텍 G PRO X 60 LIGHTSPEED 블랙 (정품) (리니어),2026-05-28
49125629,지클릭커 OFFICEPRO WK40 패드폰 무선 (딥그레이블랙),2026-05-28
4911167,HP N3R87AA,2026-05-28
48645020,지클릭커 OFFICEPRO 움직이는 마카롱 슬림 라이트 무선 블루투스 (그린),2026-05-28
48645014,지클릭커 OFFICEPRO 움직이는 마카롱 슬림 라이트 무선 블루투스 (핑크),2026-05-28
48645005,지클릭커 OFFICEPRO 움직이는 마카롱 슬림 라이트 무선 블루투스 (실버화이트),2026-05-28
48644972,지클릭커 OFFICEPRO 움직이는 마카롱 슬림 라이트 무선 블루투스 (딥그레이블랙),2026-05-28
4841620,아이온코리아 BOSSWIZ K80 (블랙),2026-05-28
4840929,CORSAIR K70 LUX (청축),2026-05-28
48395315,프리플로우 archon E1 PRO 동그리 8K 유무선 무접점 (URANUS BLACK),2026-05-28
48395258,프리플로우 archon E1 PRO MAX 동그리 8K 유무선 무접점 (URANUS BLACK),2026-05-28
4821161,Deck CBL-108S 만텔라 RGB 기계식 키보드 (적축),2026-05-28
4821157,Deck CBL-108S 만텔라 RGB 기계식 키보드 (갈축),2026-05-28
4820994,Deck CBL-108S 만텔라 RGB 기계식 키보드 (청축),2026-05-28
4820140,아이리버 IR-K2000 (코발트블루),2026-05-28
4820136,아이리버 IR-K2000 (로즈골드),2026-05-28
4820131,아이리버 IR-K2000 (화이트),2026-05-28
4810312,아이리버 IR-WMK5000 (코발트블루),2026-05-28
4810266,아이리버 IR-WMK5000 (블랙),2026-05-28
47952884,SP STAR D82 PRO 유무선 기계식 해외구매 (파우더축),2026-05-28
47951717,SP STAR D82 PRO 유무선 기계식 해외구매 (주황축),2026-05-28
47950622,SP STAR D82 PRO 유무선 기계식 해외구매 (화이트축),2026-05-28
47844701,darkFlash GD87 유무선 기계식 (히아신스),2026-05-28
47607479,"한성컴퓨터 GK868B PRO 동그리 8K 유무선 무접점 (VENUS NAVY, 35g)",2026-05-28
47607005,"한성컴퓨터 GK868B PRO 동그리 8K 유무선 무접점 (MERINGUE, 35g)",2026-05-28
47600630,"한성컴퓨터 GK893B PRO 동그리 8K 유무선 무접점 (VENUS NAVY, 45g)",2026-05-28
47600318,"한성컴퓨터 GK893B PRO 동그리 8K 유무선 무접점 (VENUS NAVY, 35g)",2026-05-28
47599946,"한성컴퓨터 GK893B PRO 동그리 8K 유무선 무접점 (MERINGUE, 35g)",2026-05-28
47599628,"한성컴퓨터 GK893B PRO 동그리 8K 유무선 무접점 (MERINGUE, 45g)",2026-05-28
47599223,"한성컴퓨터 GK893B PRO 동그리 8K 유무선 무접점 (RETRO POINT, 45g)",2026-05-28
47598800,"한성컴퓨터 GK893B PRO 동그리 8K 유무선 무접점 (RETRO POINT, 35g)",2026-05-28
47592110,"한성컴퓨터 GK898B PRO 동그리 8K 유무선 무접점 (RETRO POINT, 35g)",2026-05-28
47591774,"한성컴퓨터 GK898B PRO 동그리 8K 유무선 무접점 (RETRO POINT, 45g)",2026-05-28
47591444,"한성컴퓨터 GK898B PRO 동그리 8K 유무선 무접점 (VENUS NAVY, 45g)",2026-05-28
47591141,"한성컴퓨터 GK898B PRO 동그리 8K 유무선 무접점 (VENUS NAVY, 35g)",2026-05-28
47590526,"한성컴퓨터 GK898B PRO 동그리 8K 유무선 무접점 (MERINGUE, 45g)",2026-05-28
4757546,i-rocks IRK01W X-Slim (화이트),2026-05-28
4743593,ROYCHE RX-3100 (화이트),2026-05-28
4720461,로지텍 MK235 (정품) (키스킨 포함),2026-05-28
45316991,로지텍 Wave Keys + LIFT VERTICAL Combo 무선 키보드 마우스 세트 (그래파이트),2026-05-28
45239135,CHERRY XTRFY MX 3.1 RGB MX2A 화이트 (저소음 적축),2026-05-28
45237683,CHERRY XTRFY MX 3.1 RGB MX2A 화이트 (갈축),2026-05-28
45237089,CHERRY XTRFY MX 3.1 RGB MX2A 화이트 (청축),2026-05-28
45232856,CHERRY XTRFY MX 3.1 RGB MX2A 블랙 (저소음 적축),2026-05-28
45220739,CHERRY XTRFY MX 3.1 RGB MX2A 블랙 (갈축),2026-05-28
45217049,CHERRY XTRFY MX 3.1 RGB MX2A 블랙 (청축),2026-05-28
45030800,레오폴드 FC630MBT MX2A 코랄 블루 영문 (적축),2026-05-28
45029837,레오폴드 FC630MBT MX2A 코랄 블루 영문 (갈축),2026-05-28
44409269,Keychron K10 화이트 알루미늄 RGB 핫스왑 기계식 (바나나축),2026-05-28
44408405,Keychron 카일 스위치 보관함 (Box Summer),2026-05-28
44407190,Keychron K PRO 스위치 110Pcs (저소음 갈축),2026-05-28
44407001,Keychron K10 PRO 화이트 유무선 기계식 (바나나축),2026-05-28
43529756,레오폴드 FC630MBT MX2A 코랄 블루 한글 (갈축),2026-05-28
43528763,레오폴드 FC630MBT MX2A 그레이 블루 영문 (청축),2026-05-28
43528610,레오폴드 FC630MBT MX2A 그레이 블루 한글 (갈축),2026-05-28
43528574,레오폴드 FC630MBT MX2A 그레이 블루 한글 (청축),2026-05-28
4291198,앱코 레트로 써클 키캡 (104키),2026-05-28
4291186,앱코 레트로 써클 키캡 (87키),2026-05-28
42862499,포트리스 플레이기어 PKM402 무선 키보드 마우스 세트 (화이트),2026-05-28
42382316,GDEVIL K100B 무선 (퍼플 화이트),2026-05-28
42381968,GDEVIL K100B 무선 (민트 퍼플),2026-05-28
42381539,GDEVIL K100B 무선 (블랙 옐로우),2026-05-28
41499476,지클릭커 슈퍼히어로 GK-K530 기계식 화이트 (갈축),2026-05-28
41499467,지클릭커 슈퍼히어로 GK-K530 기계식 블랙 (갈축),2026-05-28
40713770,NuPhy Field75 유무선 기계식 해외구매 (바이올렛),2026-05-28
40713746,NuPhy Field75 유무선 기계식 해외구매 (핑크),2026-05-28
40713716,NuPhy Field75 유무선 기계식 해외구매 (그린),2026-05-28
4064774,무영테크 ROOKY PBT DoubleShot 104 KeyCap (Acid Green),2026-05-28
4064764,무영테크 ROOKY PBT DoubleShot 104 KeyCap (Aqua Blue),2026-05-28
40579742,FL-ESPORTS FL-CMMK 월넛 팜레스트 (텐키리스),2026-05-28
3999624,아이온코리아 비트아이티뮤즈 BT1000 (화이트),2026-05-28
39102560,앱코 KN35BT DRT 8K 염료승화 블루투스 유무선 무접점 (베른),2026-05-28
39102503,앱코 KN35BT DRT 8K 염료승화 블루투스 유무선 무접점 (서울),2026-05-28
38347046,앱코 MK87 저소음 텐키리스 멤브레인 (오트밀),2026-05-28
38347028,앱코 MK87 저소음 텐키리스 멤브레인 (블랙),2026-05-28
38346935,앱코 MK108 저소음 멤브레인 (오트밀),2026-05-28
