product_code,product_name,first_collected_date
100620209,지클릭커 OFFICEPRO WK70 사일런스 L 무선 (핑크),2026-05-28
100620203,지클릭커 OFFICEPRO WK70 사일런스 L 무선 (블루),2026-05-28
100620194,지클릭커 OFFICEPRO WK70 사일런스 L 무선 (블랙),2026-05-28
100619753,EPOMAKER TH108 유무선 기계식 (지브라축),2026-05-28
100618142,MAXTILL GM-KM1U (PINK),2026-05-28
100452368,로지텍 G PRO 2 LIGHTSPEED + PRO X TKL RAPID 키보드 마우스 세트 (화이트),2026-05-28
100452218,로지텍 G PRO X SUPERLIGHT 2 + PRO X TKL RAPID 키보드 마우스 세트 (핑크),2026-05-28
100452140,로지텍 G PRO X SUPERLIGHT 2 + PRO X TKL RAPID 키보드 마우스 세트 (화이트),2026-05-28
100451915,로지텍 G PRO X SUPERLIGHT 2 DEX + PRO X TKL RAPID 키보드 마우스 세트 (화이트),2026-05-28
100451912,로지텍 G PRO X SUPERLIGHT 2 DEX + PRO X TKL RAPID 키보드 마우스 세트 (핑크),2026-05-28
100450025,로지텍 G PRO X SUPERLIGHT 2c + PRO X TKL RAPID 키보드 마우스 세트 (화이트),2026-05-28
100449998,로지텍 G PRO X SUPERLIGHT 2c + PRO X TKL RAPID 키보드 마우스 세트 (핑크),2026-05-28
100382828,지클릭커 슈퍼히어로 GK-510X 87 기계식 화이트 (청축),2026-05-28
100382822,지클릭커 슈퍼히어로 GK-510X 87 기계식 화이트 (적축),2026-05-28
100382819,지클릭커 슈퍼히어로 GK-510X 87 기계식 블랙 (적축),2026-05-28
100382810,지클릭커 슈퍼히어로 GK-510X 87 기계식 블랙 (청축),2026-05-28
100268285,CHERRY XTRFY MX 10.1 LP 8K 유무선 기계식 블랙 (적축),2026-05-28
100191755,QSENN K7314 저소음 무선 (벚꽃),2026-05-28
100191752,QSENN K7314 저소음 무선 (슈팅스타),2026-05-28
100191581,지클릭커 OFFICEPRO WMK10 무소음 무선 키보드 마우스 세트 (스카이 블루),2026-05-28
100191575,지클릭커 OFFICEPRO WMK10 무소음 무선 키보드 마우스 세트 (옐로우),2026-05-28
100190810,QSENN MK314 저소음 무선 키보드 마우스 세트 (벚꽃),2026-05-28
100190801,QSENN MK314 저소음 무선 키보드 마우스 세트 (슈팅스타),2026-05-28
10002555,웨이코스 씽크웨이 CROAD K20 매크로 숫자 키패드 (적축),2026-05-28
10002534,웨이코스 씽크웨이 CROAD K20 매크로 숫자 키패드 (갈축),2026-05-28
10002504,웨이코스 씽크웨이 CROAD K20 매크로 숫자 키패드 (청축),2026-05-28
99915557,지클릭커 OFFICEPRO OSP98K (Retro),2026-05-27
99478319,지클릭커 OFFICEPRO WMK700 사일런스 M 108 무선 키보드 마우스 세트 (Sky City),2026-05-27
99054092,지클릭커 WMK800B 더블 8K 무선 기계식 키보드 마우스 세트 그린라이트 (보글보글),2026-05-27
98777270,지클릭커 OFFICEPRO WMK50 사일런스 M LCD 98 무선 키보드 마우스 세트 (Navy Blue),2026-05-27
98225846,TGIC TGC-MK1300S 중고,2026-05-27
98183141,"지클릭커 WK107 1K 무선 기계식 머큐리 핑크 (용암빨강축, 45g)",2026-05-27
97838804,Razer Huntsman V2 KR (중고),2026-05-27
97222457,Razer BlackWidow V4 Low profile HyperSpeed KR (오렌지축),2026-05-27
96984917,한성컴퓨터 GK104 유무선 (말차크림),2026-05-27
95201528,지클릭커 WMK800B 무선 기계식 키보드 마우스 세트 머큐리핑크 RC2 (보글보글),2026-05-27
94081073,다얼유 EK87 RT 8K (스모키그레이),2026-05-27
93442778,MCHOSE G98 V2 유무선 기계식 해외구매 (옵션선택구성),2026-05-27
8345913,COX 엔데버 텐키리스 RGB PBT 완전방수 무접점 블랙 (35g),2026-05-27
79407806,Keychron K5 MAX 유무선 기계식 쉘화이트 (바나나축),2026-05-27
77965988,컴튜 치즈 포인트 키캡 (R4),2026-05-27
74810426,QSENN Q87 PBT 유무선 기계식 블루퍼플 (퍼플축),2026-05-27
73560311,QSENN Q104 PBT 풀윤활 가스켓 유무선 기계식 크림치즈 (크림치즈축),2026-05-27
71220452,SPM PL87B PBT 미드나잇 기계식 (화이트),2026-05-27
7040395,퓨전에프앤씨 INOTE X-KEY 38BT (블랙),2026-05-27
6197597,CJ ENM ENTUS K330G GENESIS ED CJ광축 게이밍 (옐로우),2026-05-27
60150752,레오폴드 FC730MBT MX2A 코랄 블루 영문 (흑축),2026-05-27
59828690,플레이고 KB10 무선 (블랙),2026-05-27
58794158,QSENN DT35 89 유무선 기계식 화이트 (민트축 V1),2026-05-27
40895999,지클릭커 슈퍼히어로 GK-K530 기계식 화이트 (적축),2026-05-27
36835325,지클릭커 슈퍼히어로 SPK100 저소음 무선 블루투스 기계식 (밀키 블루),2026-05-27
34388165,ROYCHE RMK-4000 무선 키보드 마우스 세트 (애쉬 그레이),2026-05-27
32890730,지클릭커 OFFICEPRO WMK10 무소음 무선 키보드 마우스 세트 (그린),2026-05-27
28449845,darkFlash GD100 유무선 기계식 (별빛 파랑),2026-05-27
28396940,Keychron V1 커스텀 보강판 (폴리카보네이트),2026-05-27
19401980,CHERRY MX LP 6.1 유무선 기계식 (샴페인골드),2026-05-27
18490880,한성컴퓨터 GK893B 염료승화 EDITION 유무선 무접점 (TOY BLOCK),2026-05-27
18091124,앱코 AN04F PBT 특주축 게이밍 기계식 키보드 (넌클릭),2026-05-27
16795421,CORSAIR K70 RGB TKL OPX 광적축 게이밍 기계식 키보드 (정품),2026-05-27
16727687,레오폴드 FC980MBT PD 화이트 투톤 한글 (적축),2026-05-27
16632926,레오폴드 FC750RBT PD 애쉬 옐로우 한글 (청축),2026-05-27
16574840,레오폴드 FC980MBT PD 화이트 블루스타 영문 (청축),2026-05-27
16363244,TGIC TGC-BK380 + BT102 블루투스 키보드 마우스 세트 (레드),2026-05-27
15115421,엠스톤글로벌 mStone Unicolor 119Key (핑크 키릴),2026-05-27
14823899,코시 KBM3409WL 파스텔 무선 키보드 마우스 세트 (민트),2026-05-27
14731634,Razer Ergonomic Wrist Rest (MINI),2026-05-27
13729361,로지텍 K120 New (병행수입),2026-05-27
122637009,지클릭커 Magneon 듀얼 8K GRP169 키보드 마우스 세트 화이트마린 (핑크소닉축),2026-05-27
122622077,한성컴퓨터 TFG Magnetox 2XL 저소음 (픽셀),2026-05-27
122622045,한성컴퓨터 TFG Magnetox 2XF 저소음 (멀티파스텔),2026-05-27
12256646,QSENN GP-KM2200 Plus (USB),2026-05-27
109679519,Keychron K PRO 스위치 45Pcs (헤비 저소음 바나나축),2026-05-27
106781075,Keychron V10 PRO SE ZMK 유무선 기계식 레트로 (저소음 바나나축),2026-05-27
106780307,Keychron K15 PRO SE ZMK 유무선 기계식 블랙 (저소음 적축),2026-05-27
106736498,Keychron K10 PRO MAX WOOD 유무선 블랙 (저소음 바나나축),2026-05-27
106457696,Keychron V1 Ultra 8K 유무선 기계식 레트로 (저소음 적축),2026-05-27
106222205,AULA S102 (그레이),2026-05-27
104948624,지클릭커 오피스프로 OPS529 사일런스 M 무소음 키보드 무선 마우스 세트 104 (Poker Green),2026-05-27
10281819,RIZUM RWS-101 무선 키보드 마우스 세트 (민트),2026-05-27
102001982,지클릭커 GMK-587 키보드 마우스 세트 화이트 (청축),2026-05-27
102001931,지클릭커 GMK-587 키보드 마우스 세트 블랙 (청축),2026-05-27
102001781,지클릭커 GMK-514 키보드 마우스 세트 화이트 (적축),2026-05-27
99944495,WOBKEY WOB ZEN65 Ultra 유무선 기계식 (핑크),2026-05-26
99480110,"지클릭커 WK107 8K 무선 기계식 크레용 옐로우 (용암빨강축, 45g)",2026-05-26
99049745,EWEADN GX30 기계식,2026-05-26
98780243,NuPhy AIR96 V2 유무선 기계식 (중고),2026-05-26
98486573,몬스타기어 크라이톡스 107 오일 윤활제 (40g),2026-05-26
97357034,지클릭커 OFFICEPRO 사일런스M 멀티포지션 OPK50 87+NK21 (Sky City),2026-05-26
9668085,Razer Huntsman Tournament US,2026-05-26
95206970,Keychron Q13 MAX 유무선 쉘화이트 (저소음 바나나축),2026-05-26
93319241,darkFlash DKM200 키보드 마우스 세트 (프로스트 화이트),2026-05-26
92888354,"지클릭커 WK107 8K 무선 기계식 화이트 마린 (용암빨강축, 45g)",2026-05-26
91635566,SPM PL108W 아라 유무선 기계식 베이지 (화이트 몽돌),2026-05-26
90115391,현대하이테크 AOC GK180 블랙앤그레이 (G2),2026-05-26
79384547,"지클릭커 OFFICEPRO WMK50 사일런스 M 87 무선 키보드 마우스 세트 (Sky City, RC1)",2026-05-26
78989903,한성컴퓨터 GK797PRO 유무선 기계식 메탈 화이트 (라벤더 또각),2026-05-26
78845366,지클릭커 OFFICEPRO WMK80 사일런스 M 108 무선 키보드 마우스 세트 (Poker Green),2026-05-26
78238352,Actto BTK-12 무선 키보드 (네이비),2026-05-26
76332779,Riccks RS8 유무선 기계식 해외구매 (목설축),2026-05-26
75854177,"지클릭커 OFFICEPRO OPS60 사일런스 M 다쿠아즈 108 키보드 마우스 세트 (Gun Dam, CR1)",2026-05-26
74481521,ATTACK SHARK M87 유무선 기계식 (해외구매),2026-05-26
73951778,COX CA75 3모드 CNC 알루미늄 유무선 기계식 블루 (코코아 크림 V2축),2026-05-26
73428215,Keychron Q0 MAX 유무선 기계식 (저소음 적축),2026-05-26
73121453,HK엔터프라이즈 산리오 키보드 손목패드 (폼폼푸린),2026-05-26
72752519,한성컴퓨터 GK698 OfficeMaster 유무선 (RETRO POINT),2026-05-26
70252418,VGN S99 Pro 유무선 기계식 (해외구매),2026-05-26
70101485,CHERRY MX BOARD 3.0S RGB MX2A 기계식 블랙 (저소음 적축),2026-05-26
68533403,앱코 K580 교체축 게이밍 기계식 젠틀맨 (갈축),2026-05-26
67683158,지클릭커 OFFICEPRO GMK-300 저소음 키보드 마우스 세트 (다크그레이 블랙),2026-05-26
67624988,QSENN DT35 89 유무선 기계식 화이트 (저소음 바다소금축),2026-05-26
6680386,아이리버 EQwear-X30 무선 키보드 마우스 세트 (블루),2026-05-26
59927240,아이노트 아크릴 팜레스트 (미니),2026-05-26
59750045,사오파오 그리너리 그라디언트,2026-05-26
58793597,QSENN DT35 89 유무선 기계식 블랙 (바다소금축),2026-05-26
58791134,QSENN DT35 89 유무선 기계식 블랙 (민트축 V1),2026-05-26
58096223,ASUS ROG STRIX SCOPE II 96 유무선 기계식 WHITE (SNOW축),2026-05-26
5703735,삼성전자 SKP-900B 키보드 마우스 세트 (키스킨 포함),2026-05-26
56502548,레오폴드 FC650MDS PD 그레이 블루 한글 (흑축),2026-05-26
56141297,Keychron 알루미늄 노브 (블랙),2026-05-26
55451420,한성컴퓨터 TFG Cloud CF 유무선 기계식 퍼플하트 (브라운슈가 토독),2026-05-26
55385513,사오파오 키티 고양이,2026-05-26
5154432,i-rocks K23W 브릭 키보드 (블랙),2026-05-26
49832561,ENDGAME GEAR KB65HE,2026-05-26
45318806,AULA S99 유무선 기계식 해외구매 (그린),2026-05-26
45243263,CHERRY XTRFY MX 3.1 RGB MX2A 핑크 (저소음 적축),2026-05-26
45031400,레오폴드 FC630MBT MX2A 코랄 블루 영문 (흑축),2026-05-26
43528844,레오폴드 FC630MBT MX2A 그레이 블루 영문 (갈축),2026-05-26
43528661,레오폴드 FC630MBT MX2A 그레이 블루 한글 (저소음 적축),2026-05-26
38346095,MCHOSE G98 유무선 기계식 해외구매 (옵션선택구성),2026-05-26
31959170,Mistel AIRONE 기계식 블랙 영문 (택타일),2026-05-26
29369786,DrunkDeer A75 해외구매,2026-05-26
28649996,darkFlash GD87 유무선 기계식 (별빛 파랑),2026-05-26
28474961,몬스타 몬스타기어 닌자84PRO 유무선 커스텀 기계식 블랙 (갈축),2026-05-26
2826262,Deck CBL-108N Deck Hassium Lite (흑축),2026-05-26
2645759,스카이디지탈 NKEYBOARD NKEY-1 (브라운),2026-05-26
20299718,Keydous NJ80-AP 유무선 핫스왑 풀윤활 기계식 차콜블랙 (Blueberry Icecream Pro),2026-05-26
19184573,글로리어스 GMMK NUMPAD 슬라이더 (NAVY BLUE),2026-05-26
19167788,퓨전에프앤씨 INOTE KM680RB 무선 키보드 마우스 세트 (화이트),2026-05-26
19006130,앱코 AN06F TKL PBT 게이밍 기계식 (리니어),2026-05-26
18882278,아이리버 PROP 거치형 (화이트),2026-05-26
18168116,한성컴퓨터 TFG ART Wireless V2 듀얼무선 기계식 키보드 블랙 (갈축),2026-05-26
17822339,CORSAIR K70 RGB PRO OPX 게이밍 기계식 키보드 (화이트),2026-05-26
17465078,COX CK87 SLIM LP PBT 화이트 (청축),2026-05-26
17399669,MOUNTAIN EVEREST 60 (리니어 스피드),2026-05-26
17346152,앱코 K660M-L68 무선 블루투스 기계식 미니 키보드 (화이트),2026-05-26
17180996,글로리어스 GMMK2 65% Prebuilt 기계식 키보드 (블랙),2026-05-26
17091389,TGIC TGC-BMK520 무선 키보드 마우스 세트 (핑크),2026-05-26
16574477,레오폴드 FC750RBT PD 화이트 블루스타 한글 (청축),2026-05-26
16573085,레오폴드 FC660MBT PD 스웨디시 화이트 한글 (흑축),2026-05-26
16350644,레오폴드 FC750RBT PD 라이트 핑크 한글 (저소음 적축),2026-05-26
16335257,마이크로닉스 워프 WK4 마닉축 RGB 텐키리스 게이밍 기계식 키보드 (적축),2026-05-26
16093517,레오폴드 FC750RBT PD 화이트 그레이 영문 (청축),2026-05-26
15905126,로지텍 G PRO LoL 에디션 기계식 키보드,2026-05-26
15794627,머레이 MBK-1000 블루투스 스마트폰 키보드 태블릿형 (블랙),2026-05-26
13955495,"CHERRY MX Switch (1개, 청축)",2026-05-26
13780607,HyperX Alloy Origins (청축),2026-05-26
122640342,지클릭커 Magneon 듀얼 8K GRP799 키보드 마우스 세트 머큐리핑크 (핑크소닉축),2026-05-26
11395677,"타이폰 Mars Pro VESTA 기계식 키보드 영문 (블랙, 갈축)",2026-05-26
108457934,SPM AL21W 기계식 (블랙),2026-05-26
106457156,Keychron V1 Ultra 8K 유무선 기계식 블랙 (저소음 적축),2026-05-26
105968150,프리플로우 F1 PRO MAX ART 유무선 기계식 (푸댕이),2026-05-26
104625443,지클릭커 WK100B 무선 (크레용 옐로우),2026-05-26
102907457,앱코 MK108 저소음 멤브레인 (베이비 블루),2026-05-26
100696385,다얼유 A87 MASTER 8K 유무선 기계식 망고캣 (저소음 머스타드축),2026-05-26
98185208,포팩트 QN108 (화이트),2026-05-25
98087915,"지클릭커 WK98 8K 풀윤활 무선 블루투스 기계식 화이트 마린 (용암빨강축, 45g)",2026-05-25
97904081,맥컬리 RFACEKEY 무선 중고,2026-05-25
97778294,아이리버 K601U (화이트),2026-05-25
94449344,AULA F65 유무선 기계식 스카이 블랙 (중고),2026-05-25
90500198,"지클릭커 WK98 타란튤라 유무선 기계식 그린 라이트 (유채꽃노랑축, 37g)",2026-05-25
90437840,COX CQK81 VIA 엣지 LED & 노브 3MODE 유무선 기계식 (Deep Oil축),2026-05-25
90433757,지클릭커 슈퍼히어로 MK100 무선 기계식 (팝핑 블랙),2026-05-25
89533802,필립스 SPK6407 무선 (화이트),2026-05-25
74894936,주연테크 긱스타 GK01 (핑크),2026-05-25
72974504,지클릭커 슈퍼히어로 SPMK104 컬러드 기계식 키보드 마우스 세트 (화이트),2026-05-25
70003886,필립스 SPT6407 무선 키보드 마우스 세트 (화이트),2026-05-25
54326024,몬스타 몬스타기어 아쿠아67 유무선 기계식 (스카이블루),2026-05-25
54099737,CHERRY KC200 MX2A 기계식 블랙 브론즈 (적축),2026-05-25
48395312,프리플로우 archon E1 PRO 동그리 8K 유무선 무접점 (MACARON),2026-05-25
48395252,프리플로우 archon E1 PRO MAX 동그리 8K 유무선 무접점 (MACARON),2026-05-25
4452194,로지텍 MK235 (해외구매),2026-05-25
42862481,포트리스 플레이기어 PKM402 무선 키보드 마우스 세트 (그레이),2026-05-25
35223182,지클릭커 클라우드 코튼 팜레스트 키보드 쿠션 손목 받침대 (눈설탕),2026-05-25
32889251,로지텍 K380S (정품) (더스티로즈),2026-05-25
28417475,Keychron K PRO 스위치 110Pcs (갈축),2026-05-25
28415990,Keychron 카일 스위치 110Pcs (청축),2026-05-25
20188898,이메이크 KC1,2026-05-25
17466686,레오폴드 FC900RBT PD 다크블루 영문 (청축),2026-05-25
17171387,로지텍 MX Mechanical (정품) (갈축),2026-05-25
17079878,레오폴드 FC750RBT PD 화이트민트 영문 (갈축),2026-05-25
16574636,레오폴드 FC900RBT PD 화이트 블루스타 한글 (청축),2026-05-25
16574441,레오폴드 FC750RBT PD 화이트 블루스타 영문 (적축),2026-05-25
16573391,레오폴드 FC750RBT PD 스웨디시 화이트 영문 (갈축),2026-05-25
15442514,Keychron K12 전용 키캡세트 영문 (다크 그레이),2026-05-25
14643884,레오폴드 FC660MBT PD 그레이 블루 한글 (갈축),2026-05-25
122667963,크로셀 C-Flip Gravel 무선,2026-05-25
101079635,지클릭커 슈퍼히어로 GNK521 기계식 넘버키패드 세트 블랙 (청축),2026-05-25
94028474,플레이고 KB10 무선 (중고),2026-05-24
92621372,NuPhy KICK75 유무선 기계식 나노 (실버축),2026-05-24
92186090,스포트라이트 조약돌 세트 (페블그레이),2026-05-24
78782339,시이닷 한국의 미 키캡 (단청),2026-05-24
75720785,지클릭커 OFFICEPRO WMK50 사일런스 M 98 무선 키보드 마우스 세트 (Greenwich),2026-05-24
71901980,지클릭커 OFFICEPRO GMK-500 스탠다드 M 무소음 키보드 마우스 세트 (블랙),2026-05-24
7040422,퓨전에프앤씨 INOTE X-KEY 38BT (핑크),2026-05-24
67509767,앱코 K417 레트로 기계식 (청축),2026-05-24
63418250,한성컴퓨터 TFG Cloud CL 유무선 기계식 모카코코아 (핑크솔트 토독),2026-05-24
54314681,아이노비아 YUNZII AL71 유무선 기계식 (블랙),2026-05-24
5339279,QSENN SEM-DT35S LED Stella (블랙),2026-05-24
33386177,darkFlash GD100 유무선 기계식 (히아신스),2026-05-24
30270884,"한성컴퓨터 GK777SE OfficeMaster 기계식 뽀송 (블루베리 스무디, 45g)",2026-05-24
29664911,FL-ESPORTS CMK99 유무선 핫스왑 풀윤활 기계식 화이트 그레이 한글 (갈축),2026-05-24
28366412,GDEVIL MK700W 무선 키보드 마우스 세트 (옐로우),2026-05-24
28187555,아이콘스 카카오프렌즈 KFW-100 (춘식이),2026-05-24
18713207,플레오맥스 AVEC-50M 무선 키보드 마우스 세트 (블랙),2026-05-24
16331441,마이크로닉스 워프 WK2 마닉축 RGB 게이밍 기계식 키보드 (청축),2026-05-24
14209391,Keychron 교체용 Cherry MX Switch Set (청축),2026-05-24
104936651,지클릭커 오피스프로 WMK515 사일런스 M 무소음 무선 키보드 마우스 세트 (Poker Green),2026-05-24
99711164,지클릭커 OPS800B 기계식 키보드 마우스 세트 머큐리핑크 RC2 (보글보글),2026-05-23
99639533,"그루브스톤 GV8M 8K 유무선 기계식 퍼플러 (저소음 코랄축, 38g)",2026-05-23
99639314,"그루브스톤 GV8M 8K 유무선 기계식 애플라떼 (코랄V2축, 38g)",2026-05-23
99054128,지클릭커 WMK800B 더블 8K 무선 기계식 키보드 마우스 세트 화이트마린 (보글보글),2026-05-23
98184716,쓰리윈즈 인터픽셀 IPK104 PRO 유무선 기계식 (저소음 피치축),2026-05-23
98183069,"지클릭커 WK107 1K 무선 기계식 화이트 마린 (용암빨강축, 45g)",2026-05-23
98073080,NuPhy AIR75 V3 유무선 기계식 네뷸라 다크 (적축),2026-05-23
97904195,NuPhy AIR75 HE 중고,2026-05-23
97842734,지클릭커 슈퍼히어로 GK-580X 기계식 게이밍 화이트 (청축),2026-05-23
96776321,레오폴드 FC660MBT PD 라이트 핑크 영문 (흑축),2026-05-23
96775946,레오폴드 FC750RBT PD 차콜 블루 영문 (청축),2026-05-23
94635086,EPOMAKER TH99 유무선 기계식 (화이트블루),2026-05-23
94096166,CORSAIR K70 RGB PRO OPX 게이밍 기계식 키보드 (중고),2026-05-23
93068657,지클릭커 OFFICEPRO WMK90 사일런스 M 98 무선 키보드 마우스 세트 (Poker),2026-05-23
92964083,웨이코스 씽크웨이 TAUCHE S501 유무선 기계식 (카밍 베이지),2026-05-23
91563392,몬스타 가츠 아쿠아67 유무선 기계식 + 젤리푸딩 키캡 (핑크),2026-05-23
91346714,몬스타 가츠 말랑말랑 젤리푸딩 (핑크),2026-05-23
91113503,COX CK480 교체축 게이밍 기계식 화이트 (적축),2026-05-23
89525381,Actto BTK-03 (핑크),2026-05-23
79410134,Womier RD75 Pro 유무선 (실버),2026-05-23
78989267,CHERRY XTRFY PIXIU 75 유무선 기계식 (화이트),2026-05-23
78986861,GDEVIL G918 PRO HyperTrack (핑크),2026-05-23
77382512,NZXT Function Elite MiniTKL (화이트),2026-05-23
7629067,로지텍 K400 PLUS (해외구매),2026-05-23
7127755,COX 엔데버 텐키리스 RGB PBT 완전방수 무접점 화이트 (50g),2026-05-23
71060540,Keychron K8 PRO MAX 유무선 기계식 카본블랙 (저소음 적축),2026-05-23
7053238,Ducky ONE 2 TKL RGB SEAMLESS PBT 이중사출 한글 (갈축),2026-05-23
68363555,PROJECT511 코르크 팜레스트 (풀 사이즈),2026-05-23
6680404,아이리버 EQwear-X30 무선 키보드 마우스 세트 (파스텔),2026-05-23
6579358,아이리버 EQwear-T30 무선 키보드 마우스 세트 (화이트),2026-05-23
65306738,NuPhy Halo75 V2 유무선 기계식 영문 (민트축),2026-05-23
63421151,COX SLC 시리즈 실리콘 팜레스트 베이지 (텐키배열),2026-05-23
63086702,QSENN DT35 106 가스켓 유무선 기계식 화이트 (애플민트축),2026-05-23
6150418,마이크로닉스 MANIC K160 키보드 마우스 무선 합본 (스카이 블루),2026-05-23
58836293,MAXTILL 한/영 이중사출 104키 가디언 컬러키캡 (블루),2026-05-23
5828052,"COX 카일 정품 광축 스위치 (10개, 클릭)",2026-05-23
57933380,QSENN DT35 87 유무선 기계식 화이트 (애플민트축 V1),2026-05-23
57293036,레오폴드 NP750RBT PD 그레이 블루 (갈축),2026-05-23
4810292,아이리버 IR-WMK5000 (로즈골드),2026-05-23
4743655,ROYCHE RX-3300 (화이트),2026-05-23
45030449,레오폴드 FC630MBT MX2A 코랄 블루 영문 (저소음 적축),2026-05-23
44409245,Keychron K10 화이트 알루미늄 RGB 핫스왑 기계식 (저소음 적축),2026-05-23
36706859,AULA F87 Pro 유무선 기계식 해외구매 (옐로우축),2026-05-23
31473689,WOBKEY WOB RAINY75 유무선 기계식 해외구매 (옵션선택구성),2026-05-23
30217103,SPM OSHID 크리스마스 투명 레진 아티산 포인트 키캡 (눈사람),2026-05-23
29664815,FL-ESPORTS CMK99 유무선 핫스왑 풀윤활 기계식 폴라 나이트 블랙 한글 (백축),2026-05-23
29337680,GDEVIL G915 PRINCE 기계식 (WHITE),2026-05-23
28772471,FL-ESPORTS CMK87 유무선 핫스왑 풀윤활 기계식 화이트 그레이 한글 (저소음 크림축),2026-05-23
28772345,FL-ESPORTS CMK87 유무선 핫스왑 풀윤활 기계식 폴라 나이트 블랙 한글 (저소음 크림축),2026-05-23
17111399,레오폴드 FC750RBT PD 그레이 블루 영문 (저소음 적축),2026-05-23
16574879,레오폴드 FC980MBT PD 화이트 블루스타 한글 (청축),2026-05-23
16574861,레오폴드 FC980MBT PD 화이트 블루스타 영문 (저소음 적축),2026-05-23
16574369,레오폴드 FC750RBT PD 화이트 블루스타 영문 (청축),2026-05-23
16573226,레오폴드 FC660MBT PD 스웨디시 화이트 영문 (저소음 적축),2026-05-23
16573220,레오폴드 FC660MBT PD 스웨디시 화이트 영문 (적축),2026-05-23
16573052,레오폴드 FC660MBT PD 스웨디시 화이트 한글 (갈축),2026-05-23
16350758,레오폴드 FC750RBT PD 차콜 블루 한글 (청축),2026-05-23
16350584,레오폴드 FC660MBT PD 라이트 핑크 한글 (갈축),2026-05-23
16332077,마이크로닉스 워프 WK3 마닉축 블루투스 RGB 텐키리스 게이밍 기계식 키보드 (적축),2026-05-23
16093634,레오폴드 FC750RBT PD 화이트 투톤 한글 (적축),2026-05-23
16093529,레오폴드 FC750RBT PD 화이트 그레이 영문 (갈축),2026-05-23
15889979,레오폴드 FC750RBT PD 블랙 한글 (갈축),2026-05-23
15709904,이음전산 스마텍 STBK-F1000 접이식 블루투스 키보드 (블랙),2026-05-23
15446855,앱코 HACKER K660M TKL 이색사출 PBT 체리 키보드 딥로얄 (갈축),2026-05-23
14958920,로지텍 MK345 (비공식유통),2026-05-23
14644850,레오폴드 FC660MBT PD 화이트 그레이 한글 (갈축),2026-05-23
14209631,Keychron 교체용 Cherry MX RGB Switch Set (은축),2026-05-23
14075690,써멀테이크 ARGENT K5 RGB 게이밍 키보드 (은축),2026-05-23
13956101,WEZEL WZ-K2100,2026-05-23
12752141,CHERRY MX BOARD 3.0S RGB 핑크 (적축),2026-05-23
122666802,로지텍 G512 X 75 화이트 (정품) (적축),2026-05-23
11356074,CHERRY MX BOARD 3.0S RGB 블랙 (청축),2026-05-23
11063505,COX CK87 크림블루 게이트론 LED 게이밍 기계식 (갈축),2026-05-23
106780091,Keychron K8 PRO SE ZMK 유무선 기계식 카본 블랙 (저소음 적축),2026-05-23
102549983,스카이디지탈 NKEYBOARD NK21 (적축),2026-05-23
102002324,지클릭커 GMK-387 키보드 마우스 세트 (화이트),2026-05-23
102002048,지클릭커 GMK-3000 키보드 마우스 세트 (블랙),2026-05-23
99946520,CHERRY XTRFY MX 8.2 PRO TMR 8K 유무선,2026-05-21
99944504,WOBKEY WOB ZEN65 Ultra 유무선 기계식 (웜실버),2026-05-21
99943952,지클릭커 OFFICEPRO WK60 스탠다드 M 무선 (그린),2026-05-21
9992988,상도아이앤티 ANYZONE ATK-100 유선 트랙볼 키보드,2026-05-21
99916463,아이리버 K101 (블랙),2026-05-21
99916187,로지텍 Wave Keys + LIFT VERTICAL Combo 무선 키보드 마우스 세트 (오프화이트),2026-05-21
99915608,지클릭커 OFFICEPRO OSP108K (Coral),2026-05-21
99915536,지클릭커 OFFICEPRO OSP98K (Coral),2026-05-21
99915458,지클릭커 OFFICEPRO OSP87K (Coral),2026-05-21
99915086,지클릭커 OFFICEPRO OPS70 사일런스 M 마들렌 키보드 마우스 세트 98 (Coral),2026-05-21
99915038,지클릭커 OFFICEPRO OPS70 사일런스 M 마들렌 키보드 마우스 세트 87 (Coral),2026-05-21
99915032,지클릭커 OFFICEPRO OPS70 사일런스 M 마들렌 키보드 마우스 세트 87 (Greenwich),2026-05-21
99914822,지클릭커 OFFICEPRO 펜타 WK20 무선 (블랙),2026-05-21
99914753,지클릭커 OFFICEPRO WK90B 무선 (베이지),2026-05-21
99914738,지클릭커 OFFICEPRO WK90B 무선 (블랙),2026-05-21
99914645,지클릭커 오피스 WMK55 움직이는 마카롱 무선 키보드 마우스 세트 (블랙),2026-05-21
99912422,Razer BlackWidow V4 X Zenless Zone Zero Edition,2026-05-21
99912332,한성컴퓨터 TFG Cloud Max CF 염료승화 유무선 기계식 키즈 (KTT블루 포각),2026-05-21
99751124,"그루브스톤 GV10M 8K 유무선 기계식 우리의 것 훈민정음 담 (저소음 밀키축, 38g)",2026-05-21
99746975,MCHOSE Ace 68 Turbo (해외구매),2026-05-21
