product_code,product_name,first_collected_date
64376096,긱쉐어 러블리몽몽 팜레스트,2026-05-21
64376069,긱쉐어 스타윙 팜레스트,2026-05-21
64376054,긱쉐어 게이밍냥 팜레스트,2026-05-21
64375241,DOXX DX-WMK100 무선 키보드 마우스 세트,2026-05-21
6436163,삼성전자 SPA-KKA1BUW 유선 키보드,2026-05-21
64300079,GDEVIL V1 무선,2026-05-21
64299638,GDEVIL MK300 키보드 마우스 세트,2026-05-21
64299431,GDEVIL K300,2026-05-21
64297625,EPOMAKER P75 유무선 기계식 (해외구매),2026-05-21
6427079,코시 KB1405CSBT 멀티 스탠드 블루투스 키보드,2026-05-21
64269092,카카오프렌즈 열공 춘식이 무선,2026-05-21
64268747,카카오프렌즈 멀티페어링 DJ라이언 무선,2026-05-21
6423252,갤럭시 XANOVA 한영 ABS 104 키캡,2026-05-21
6412513,에이데이타코리아 DDZONE DMK-520M 유선 미니 키보드 마우스 세트 (블랙),2026-05-21
6400873,라이트컴 COMS BB623 실리콘 롤 키보드,2026-05-21
6396595,로지텍 K240 NANO 카카오 에디션 (정품),2026-05-21
63944192,MAXTILL TRON GMK330 키보드 마우스 세트,2026-05-21
63873665,스포트라이트 스티치오피스 팜레스트 세트,2026-05-21
63871880,스포트라이트 스티치오피스 키보드 손목받침대,2026-05-21
63853943,스포트라이트 댕댕이발바닥 시즌2 팜레스트 세트,2026-05-21
63847514,스포트라이트 캔디 컬렉션 플러스 팜레스트 세트,2026-05-21
63845873,스포트라이트 캔디 컬렉션 팜레스트 세트,2026-05-21
6383542,ANYZEN AMK-250 키보드 마우스 세트 with PAD,2026-05-21
6376832,라이트컴 COMS KB908 블루투스 키보드,2026-05-21
6372853,라이트컴 COMS BB624 실리콘 롤 키보드,2026-05-21
63481892,로지텍 Wave Keys for Mac (정품),2026-05-21
63481850,로지텍 MX Keys S for Mac (정품) (그라파이트),2026-05-21
63478076,AULA M75 유무선 기계식 해외구매 (옵션선택구성),2026-05-21
63477974,다얼유 EK87 PRO 유무선 기계식 해외구매,2026-05-21
63470735,몬스타 가츠 몬스타덱 TS183,2026-05-21
63467006,AULA F87 Pro 기계식 라이트 올리비아 한글 (세이야축),2026-05-21
63466952,AULA F87 Pro 기계식 다크 올리비아 한글 (세이야축),2026-05-21
63466358,AULA F99 기계식 라이트 올리비아 한글 (세이야축),2026-05-21
63464114,디지털벤투스 마이멜로디 팜레스트 무선 키보드 마우스 세트,2026-05-21
63423812,디지털벤투스 헬로키티 팜레스트 무선 키보드 마우스 세트,2026-05-21
63423809,디지털벤투스 쿠로미 팜레스트 무선 키보드 마우스 세트,2026-05-21
63421427,앱코 올인원 키캡 스위치 리무버,2026-05-21
63421280,COX 올인원 키캡 스위치 리무버,2026-05-21
63421169,COX SLC 시리즈 실리콘 팜레스트 베이지 (미니배열),2026-05-21
63418253,한성컴퓨터 TFG Cloud CL 유무선 기계식 퍼플하트 (딥블루 뽀송),2026-05-21
63418214,한성컴퓨터 TFG Cloud CL 유무선 기계식 모카코코아 (딥블루 뽀송),2026-05-21
63418193,한성컴퓨터 TFG Cloud CL 유무선 기계식 비너스네이비 (브라운슈가 토독),2026-05-21
63418184,한성컴퓨터 TFG Cloud CL 유무선 기계식 비너스네이비 (딥블루 뽀송),2026-05-21
6318976,WEZEL oranwell HR445 기계식 키보드 루프/손목받침대,2026-05-21
63143933,한성컴퓨터 TFG Cloud CL 유무선 기계식 코튼캔디 (딥블루 뽀송),2026-05-21
63143168,CIDOO C75 (해외구매),2026-05-21
63086717,QSENN DT35 106 가스켓 유무선 기계식 화이트 (민트축),2026-05-21
63086582,QSENN DT35 106 가스켓 유무선 기계식 블랙 (민트축),2026-05-21
63056525,지클릭커 슈퍼히어로 SPK87 유선 기계식 게이밍 + 레트로 PBT 염료 승화 키캡,2026-05-21
63035132,디클 DW03 무선 키보드 마우스 세트,2026-05-21
63034505,퓨전에프앤씨 INOTE NK907RB 무선 (블랙),2026-05-21
63030257,다얼유 EK87 PRO 유무선 기계식 화이트 (클라우드축),2026-05-21
63028019,QSENN DT35 104 가스켓 유무선 기계식 블루퍼플 (저소음 바다축),2026-05-21
62794472,ANYZEN KM4000 키보드 마우스 세트,2026-05-21
62792381,HP 225 키보드 마우스 세트,2026-05-21
62789729,HP 455 무선,2026-05-21
62650448,AULA AC210 무선 키보드 마우스 세트 (해외구매),2026-05-21
62649704,지클릭커 OFFICEPRO EK100 인체공학 무선 (블랙),2026-05-21
62649425,Actto KSK-02 레트로 미니 키보드 전용,2026-05-21
62648789,Actto WRS-09,2026-05-21
62648714,LEOBOG K21 유무선 (해외구매),2026-05-21
62648690,Actto KSK-09 B605 전용,2026-05-21
62647625,AULA F2088 기계식 (해외구매),2026-05-21
62647007,액티브키 AK-C8100,2026-05-21
62641859,ANYZEN KM3000 With Pad 키보드 마우스 세트,2026-05-21
62641856,앱코 SEOUL 서울 염료승화 PBT 키캡,2026-05-21
62641841,ANYZEN KM3000 키보드 마우스 세트,2026-05-21
62641694,지클릭커 슈퍼히어로 SPK87 무선 블루투스 기계식 + 레트로 PBT 염료 승화 키캡 세트,2026-05-21
62639318,darkFlash DFS99 유무선 기계식 (SKY REALM),2026-05-21
62639243,darkFlash DFS99 유무선 기계식 (MISTY FOREST),2026-05-21
62635997,MOUNTAIN EVEREST MAX FE,2026-05-21
62635547,Keychron B6 전용 키스킨,2026-05-21
62635535,Keychron B1 전용 키스킨,2026-05-21
62635316,노마지니 키캡 리무버 양면형,2026-05-21
62635313,노마지니 키캡 리무버 일반형,2026-05-21
62635232,필립스 SPT6338 무선 키보드 마우스 세트 (그레이),2026-05-21
62565641,주연테크 긱스타 GK01 (레트로),2026-05-21
6255013,플레오맥스 M2 PLUS 미니키보드,2026-05-21
6254095,써멀테이크 X1 RGB 체리 MX 게이밍 키보드 (청축),2026-05-21
62319074,앱코 AK87H 텐키리스 홀리판다 V2 기계식,2026-05-21
62273822,디프레오 아크릴 팜레스트 (텐키리스),2026-05-21
62175599,코시 KB2250BT 무선,2026-05-21
62175581,코시 KB2251BT 무선,2026-05-21
62175563,코시 KB4121BT 무선,2026-05-21
62175347,키밍 KM5017-347 104 키캡,2026-05-21
62159453,몬스타 몬스타기어 MOK100 키보드 마우스 세트,2026-05-21
62159243,몬스타 가츠 X108 워크마스터 (다크나이트),2026-05-21
62159225,몬스타 가츠 X187 워크마스터 (다크나이트),2026-05-21
6214607,CORSAIR K70 RGB MK.2 SE (은축),2026-05-21
62069597,SPM AL87B 기계식 커스텀 베어본 (블랙),2026-05-21
61842188,Topre REALFORCE R3S R3SA31 (해외구매),2026-05-21
6171887,에즈윈아이피씨 KBD-82M (키스킨 미포함),2026-05-21
61703054,지클릭커 OFFICEPRO WK20 인체공학 펜타 무선,2026-05-21
61673843,ROYCHE RMK-3800 무선 키보드 마우스 세트 (그레이),2026-05-21
61543418,Topre REALFORCE R3S R3SD31 (해외구매),2026-05-21
61543415,Topre REALFORCE R3S R3SD13 (해외구매),2026-05-21
61543406,Topre REALFORCE R3S R3SD11 (해외구매),2026-05-21
61543241,Topre REALFORCE R3S R3SB13 (해외구매),2026-05-21
61543232,Topre REALFORCE R3S R3SB11 (해외구매),2026-05-21
61542986,Topre REALFORCE R3 R3HB13 (해외구매),2026-05-21
61542056,WOBKEY WOB CRUSH80 유무선 해외구매 (극지해축),2026-05-21
6150422,마이크로닉스 MANIC K160 키보드 마우스 무선 합본 (인디 핑크),2026-05-21
61436396,지클릭커 레트로 PBT 키캡,2026-05-21
61421708,GDEVIL G819MT TCOM,2026-05-21
61418717,코시 KB4120BT 무선,2026-05-21
61418027,ANYZEN MK310 키보드 마우스 세트,2026-05-21
61418018,ANYZEN MK310 With Pad 키보드 마우스 세트,2026-05-21
6121808,에이데이타코리아 DDZONE DMK-900M,2026-05-21
6051828,Mistel Sleeker 텐키리스 실버 영문 (갈축),2026-05-21
60420653,ANYZEN MK210 키보드 마우스 세트,2026-05-21
60420617,ANYZEN MK210 With Pad 키보드 마우스 세트,2026-05-21
60326543,ASUS ROG AZOTH EXTREME 유무선,2026-05-21
60325658,Billionton 키보드 손목받침대,2026-05-21
60323006,X5 무선,2026-05-21
60321857,이킵먼트 아크릴 팜레스트 (60% 배열),2026-05-21
60321713,해브잇올 morac 모쿠 수납형 손목받침대,2026-05-21
6032018,쿨러마스터 MASTERKEYS MECHANICAL KEYCAP,2026-05-21
60308438,HAGIBIS JPT01 수납형,2026-05-21
60307940,ANYZEN PKC-K30 With Pad 키보드 마우스 세트,2026-05-21
60307937,ANYZEN PKC-K30 키보드 마우스 세트,2026-05-21
60247103,지클릭커 슈퍼히어로 SPK87 유선 기계식 게이밍,2026-05-21
60246542,지클릭커 슈퍼히어로 SPK87 무선 블루투스 기계식,2026-05-21
60226472,Keychron V3 MAX 레트로 유무선 기계식 (저소음 적축),2026-05-21
60226319,Keychron K5 SE2 유무선 기계식 (저소음 적축),2026-05-21
60170852,쿠슝 키보드 손목받침대 (S),2026-05-21
60150647,레오폴드 FC730MBT MX2A 코랄 블루 한글 (갈축),2026-05-21
60147638,ROYCHE 디즈니 티거 무선 키보드 마우스 세트,2026-05-21
60144902,Keychron 슈퍼 스위치 110Pcs (적축),2026-05-21
60144647,지클릭커 OFFICEPRO EMK100 인체공학 무선 키보드 마우스 세트 (화이트),2026-05-21
60064472,ASUS ROG AZOTH WHITE PBT 유무선 한글 (SNOW축),2026-05-21
60009623,SEEPAK 로지텍 K380S 한영컬러 키스킨,2026-05-21
59925041,SPM 3색조합 PBT 이중사출 영문 키캡 168키 피치블루,2026-05-21
59924417,서진네트웍스 UNICORN BK-1000SB 무선 키보드 마우스 세트,2026-05-21
59825876,Deck Francium 키스킨,2026-05-21
59749952,SPM Soulcat 고함량 PBT 염료승화 영문 키캡 158키 인디고 로봇,2026-05-21
59749727,레노버 LEGION K310,2026-05-21
59749631,HyperX Alloy Rise 기계식,2026-05-21
59749613,HyperX Alloy Rise 75 기계식,2026-05-21
5971435,RIZUM M10 무선 키보드 무소음 마우스 세트 (실버),2026-05-21
5971430,RIZUM M10 무선 키보드 무소음 마우스 세트 (블랙),2026-05-21
5950813,상도아이앤티 ANYZONE KM-5300U,2026-05-21
5950774,상도아이앤티 ANYZONE K-5500C,2026-05-21
5950745,상도아이앤티 ANYZONE K-5300C PU,2026-05-21
5942390,로지텍 K120 New + M100R 화이트 (정품),2026-05-21
5942386,로지텍 K120 New + M100R 블랙 (정품),2026-05-21
5939339,Actto KBD-46,2026-05-21
5936673,건평정보통신 IPLEX NBK-100 숫자키패드,2026-05-21
5893611,라이트컴 COMS SE174,2026-05-21
5893579,라이트컴 COMS SE175,2026-05-21
5892571,코시 WP3094 비즈 키보드 손목받침대,2026-05-21
58847975,Topre REALFORCE R3TL BT 유무선 그레이 블루 한글 (30g),2026-05-21
5883284,우영커뮤니케이션 애니클리어 PDB-KWR01,2026-05-21
58794260,QSENN DT35 89 유무선 기계식 화이트 (애플민트축 V1),2026-05-21
5875831,TGIC TGC-MK1300S,2026-05-21
5874952,플레오맥스 PKB-N85,2026-05-21
5864240,VORTEX Race3 영문 (갈축),2026-05-21
5853828,Actto BTK-02,2026-05-21
58482437,잼몬스터 메모리폼 냥발 손목받침대 세트,2026-05-21
58478519,잼몬스터 메모리폼 하트 손목받침대 세트,2026-05-21
58471397,잼몬스터 메모리폼 구름 손목받침대 세트,2026-05-21
5843434,Actto KBD-43,2026-05-21
5840016,켄싱턴 K52801WW,2026-05-21
5839983,켄싱턴 K52799WW,2026-05-21
5839961,켄싱턴 K52798WW,2026-05-21
5839929,켄싱턴 K62397AM,2026-05-21
5839898,켄싱턴 K62682US,2026-05-21
58292306,HP 125,2026-05-21
5827146,"앱코 HACKER 카일 정품 광축 스위치 (5+5개, 클릭/리니어)",2026-05-21
5812290,청맥전자 For LG MKS-1000Plus Premium 세트,2026-05-21
58119977,대니하우스 로지텍 K380 키스킨,2026-05-21
58119953,바림 모우모우 손목받침대 세트,2026-05-21
58119923,바림 모우모우 키보드 손목받침대,2026-05-21
58113584,ANYZEN PKC-K20 with pad 키보드 마우스 세트,2026-05-21
58113449,ANYZEN PKC-K20 키보드 마우스 세트,2026-05-21
58096739,ANYZEN PKC-K1 With Pad 키보드 마우스 세트,2026-05-21
58026425,데스켓 아크릴 팜레스트 (풀 사이즈),2026-05-21
58025264,SPM AL Series 전용 보강판,2026-05-21
58017170,SPM HMX x Soulcat PORO Medium 리니어 스위치 (35Pcs),2026-05-21
58016999,SPM HMX x Soulcat PORO Light 리니어 스위치 (35Pcs),2026-05-21
58015973,SPM 하이무 아이스실버 리니어 스위치 (35Pcs),2026-05-21
58009313,ROCCAT REST,2026-05-21
58009157,ASUS ROG FALCHION RX Low Profile 유무선 기계식 한글 (청축),2026-05-21
58007762,80Retros GAME1989 기계식,2026-05-21
5793810,프레젠샵 PS-RK103,2026-05-21
57919337,ANYZEN PKC-K1 키보드 마우스 세트,2026-05-21
5782793,삼성전자 SPA-JKA1BUB,2026-05-21
5780163,에이데이타코리아 DDZONE MK-3000 LED 키보드 마우스 세트,2026-05-21
5775961,삼성전자 SRP-9400B,2026-05-21
5772737,Actto BTK-01 레트로 미니 블루투스,2026-05-21
5772703,Actto KBD-50 레트로 미니 무선,2026-05-21
57681461,플레오맥스 PBK-300 무선 (블랙),2026-05-21
5764076,OMT OMP-400 키보드 손목 보호쿠션,2026-05-21
5752754,MAXTILL 키보드 거치대,2026-05-21
57505382,이킵먼트 블랙 웬지 팜레스트 (60% 배열),2026-05-21
57452102,SPM PC 투명 실크인쇄 한영 키캡 165키 에프리콧,2026-05-21
57451289,SPM PC 투명 실크인쇄 한영 키캡 165키 블루,2026-05-21
57450251,SPM PC 투명 실크인쇄 한영 키캡 165키 베이비 핑크,2026-05-21
57308141,디모어 손목받침대 세트,2026-05-21
57306959,Keychron Q60 MAX 유무선 기계식 (바나나축),2026-05-21
57306560,Keychron Q2 MAX 유무선 기계식,2026-05-21
57306425,Keychron K1 MAX 유무선 기계식 (적축),2026-05-21
57305165,Razer Huntsman V3 Pro TKL WHITE US,2026-05-21
57304193,퓨전에프앤씨 니니즈 죠르디,2026-05-21
57293264,레오폴드 FC750RBT PD 에버 그린 한글 (저소음 적축),2026-05-21
57292934,레오폴드 FC650MDSBT PD 그레이 블루 영문 (갈축),2026-05-21
57292838,레오폴드 FC650MDSBT PD 유무선 그레이 블루 한글 (갈축),2026-05-21
5717631,Actto WRS-03,2026-05-21
5706845,펠로우즈 플러쉬터치 손목받침대,2026-05-21
5704406,앱코 AZIO 레트로 클래식 포쉬,2026-05-21
5697582,Actto KBD-47 레트로 유선,2026-05-21
5682266,앱코 레트로 써클 컬러 키캡 104키 (블랙),2026-05-21
5674183,건평정보통신 IPLEX KP-200WTP 터치 키보드,2026-05-21
5669363,상도아이앤티 ANYZONE K-7100C 키보드 마우스 세트,2026-05-21
5669114,상도아이앤티 ANYZONE KM-7000U 유선 키보드,2026-05-21
5646336,아이리버 BUBBLE IR-K10 유선 키보드 (화이트),2026-05-21
5645544,ANYZEN MK-100 USB 유선 세트,2026-05-21
56449808,사오파오 우주공간 한글,2026-05-21
5641826,로지텍 G413 (병행수입),2026-05-21
56344670,사오파오 클라우드,2026-05-21
5628718,HP KM100 Combo (키스킨 미포함),2026-05-21
56259215,RHINO GEAR RG-WM50M 무선 키보드 마우스 세트,2026-05-21
56248655,AKKO MU01 유무선 기계식 (해외구매),2026-05-21
5621677,APPLE Magic Keyboard 한글 MQ5L2KH/A (정품),2026-05-21
56154215,Keychron V1 MAX 유무선 기계식,2026-05-21
56153519,PYHO V87 유무선 기계식,2026-05-21
56151563,Keychron Q10 MAX 유무선 기계식,2026-05-21
56142515,타닥 푸딩,2026-05-21
56141669,아이친구 블루투스 키보드 마우스 세트,2026-05-21
56141648,아이친구 블루투스,2026-05-21
56141186,Keychron 더블샷 로우 프로파일 키캡,2026-05-21
56140700,컴튜 허니콤 젤리 손목받침대 세트,2026-05-21
56061617,Melgeek MADE68 기계식 (해외구매),2026-05-21
56059988,Wooting 80HE (해외구매),2026-05-21
56059748,Keychron K5 MAX 유무선 기계식 레트로 (바나나축),2026-05-21
5605427,라이트컴 COMS 러시아어 키보드 스티커 (BU155),2026-05-21
5605421,라이트컴 COMS 아랍어 키보드 스티커 (BU156),2026-05-21
5605411,라이트컴 COMS 스페인어 키보드 스티커 (BU157),2026-05-21
5605388,"라이트컴 COMS 한글 키보드 스티커 (화이트, IB710)",2026-05-21
5605354,라이트컴 COMS 일본어 키보드 스티커 (IB711),2026-05-21
5600346,에이데이타코리아 DDZONE DK-500M (키스킨 미포함),2026-05-21
55801313,HyperX Rubber,2026-05-21
55793948,엘디네트웍스 APL-KT52,2026-05-21
5558028,로지텍 CRAFT (정품),2026-05-21
5555499,Bless ZIO KP-1800 숫자키패드,2026-05-21
5550198,PowerFul KM701UU 키보드 마우스 콤보,2026-05-21
55388759,CAMAC CMK-200 키보드 마우스 세트,2026-05-21
55388639,플레오맥스 PKB-300 무선,2026-05-21
55388447,레오폴드 키보드 러그 (M),2026-05-21
55386242,사오파오 퍼플 그라디언트,2026-05-21
55386215,사오파오 핑크버거,2026-05-21
55385729,사오파오 퓨처펑크,2026-05-21
55385651,사오파오 스마일 페이스,2026-05-21
55385642,사오파오 미니멀블랙,2026-05-21
55385414,사오파오 베이비 (108Pcs),2026-05-21
55385375,사오파오 마리오 XDA,2026-05-21
55385186,사오파오 리나벨,2026-05-21
55385132,사오파오 아이스크림2,2026-05-21
55385111,사오파오 빅 사쿠라,2026-05-21
55384880,사오파오 냐옹이,2026-05-21
55384808,사오파오 파스텔분필,2026-05-21
55338092,퓨전에프앤씨 INOTE BPKM30 펭수 무선 키보드 마우스 세트,2026-05-21
54815033,맥킨토시 ESC+TAB,2026-05-21
54815015,올리민 IBM 맥킨토시 3in1,2026-05-21
54813983,사오파오 MOA 크레용 짱구,2026-05-21
54813869,사오파오 GMK 소야밀크st 체리,2026-05-21
54813470,사오파오 앵그리st 투명,2026-05-21
54813449,사오파오 GMK Style,2026-05-21
54812501,쿠팡 홈플래닛 무선 키보드 마우스 세트,2026-05-21
54812231,KDNC 오피스용 키보드 마우스 세트,2026-05-21
54811679,포트리스 플레이기어 PKM201 키보드 마우스 세트,2026-05-21
54811124,SPM 하이무 미드나잇 리니어 스위치 (35Pcs),2026-05-21
54811085,SPM 하이무 바다소금 리니어 스위치 35Pcs,2026-05-21
54698771,MONKA KG991W DS 유무선 기계식,2026-05-21
54697949,ATK RS7 (해외구매),2026-05-21
54697763,Keychron K10 PRO SE 화이트 유무선 기계식 (저소음 적축),2026-05-21
54697742,Keychron K10 PRO SE 쉘 화이트 유무선 기계식 (저소음 적축),2026-05-21
54696947,DrunkDeer A75 PRO 해외구매,2026-05-21
5453258,Aidata CGL006 젤 손목받침대,2026-05-21
5449191,Actto 젤리 키보드 손목 받침대 WRS-04,2026-05-21
5449056,우영커뮤니케이션 애니클리어 매직키보드2 키스킨,2026-05-21
54484085,사오파오 체리 시바 강아지2,2026-05-21
54484040,사오파오 토토로 XDA,2026-05-21
54484007,사오파오 체리 컬러 포인트 키캡,2026-05-21
54482969,Keychron Q6 노브 커스텀 보강판 (황동),2026-05-21
54482912,Keychron K2 PRO 커스텀 보강판 (알루미늄),2026-05-21
54482894,Keychron Q4 커스텀 보강판 (황동),2026-05-21
54482849,Keychron Q10 노브 커스텀 보강판 (알루미늄),2026-05-21
54482444,MATECH MT-BT045,2026-05-21
54481790,DOXX DX-GK50 기계식,2026-05-21
5446738,강원전자 NETmate NM-KMS01 USB 유선 키보드 마우스 세트,2026-05-21
54318062,디알고 로지텍 WAVE KEYS 키스킨,2026-05-21
54314654,CHERRY DW2300 무선 키보드 마우스 세트 (블랙),2026-05-21
54314603,Melgeek Cyber01 기계식 (해외구매),2026-05-21
54103415,SPM HMX PEBBLE 리니어 스위치 (35Pcs),2026-05-21
5385115,WEED W7-100,2026-05-21
5366501,건평정보통신 IPLEX KP-BK1000 (화이트),2026-05-21
5364172,라이트컴 COMS 키보드 손목보호대,2026-05-21
5355270,라이트컴 COMS CF451 실리콘 롤 키보드,2026-05-21
5355168,COX CKM500 게이밍 키보드 마우스 콤보,2026-05-21
53520386,지클릭커 윙 코튼 키보드 쿠션 손목 받침대 (그레이),2026-05-21
5323647,코시 KB3152,2026-05-21
5319431,로지텍 MK270r (병행수입),2026-05-21
5290103,디지클럽 Qnix QMK-3000U,2026-05-21
5242456,Aidata DMK-1300M (블랙),2026-05-21
5228671,"앱코 HACKER QUICK SWAP용 OUTEMU 스위치 (각2개, 청축/갈축/적축/흑축)",2026-05-21
52258145,EPOMAKER TH80 Pro V2 유무선 기계식 (해외구매),2026-05-21
5214875,Microsoft 서피스 블루투스 키보드 (정품),2026-05-21
5213605,"이메이크 EMK-GM30L 미리내 G3 샤이니 (블랙, 청축)",2026-05-21
5211477,에이데이타코리아 DDZONE AKplus AK-K450 LED 플런저 키보드,2026-05-21
52065158,Kzzi K20 (해외구매),2026-05-21
52064870,다얼유 A104 PRO FLEX 유무선 기계식 아이스블루 (저소음 머스타드축),2026-05-21
52062269,YUNZII AL75 유무선 기계식 (해외구매),2026-05-21
5182267,앱코 KM400 게이밍 콤보 (블랙),2026-05-21
5182172,디지털벤투스 가스파드앤리사 유선 키보드 GL-KB908,2026-05-21
5166675,청맥전자 For LG GK-3000,2026-05-21
5161915,에이데이타코리아 DDZONE DK-7100,2026-05-21
51553454,Magicforce MF34 (해외구매),2026-05-21
51553373,Magicforce MF17 (해외구매),2026-05-21
5147612,로지텍 MK850 (정품),2026-05-21
5145416,Bless ZIO DT70 레인보우LED 기계식 게이밍 키보드 (갈축),2026-05-21
5135254,라이트컴 COMS BW299 블루투스 키보드,2026-05-21
5134263,코시 CKS02G 만능 키스킨 (1개),2026-05-21
5113701,플레오맥스 PTK-150 트랙볼 키보드,2026-05-21
5113700,WEZEL 만능 키스킨,2026-05-21
5065159,CORSAIR K63 (적축),2026-05-21
5019857,건평정보통신 IPLEX RK-2000C 무선 키보드 마우스 세트,2026-05-21
5005354,라이트컴 COMS 젤형 키보드 손목보호대 BE895,2026-05-21
4998170,i-rocks KR-6170 / IRK25RP 전용 키스킨,2026-05-21
4998158,i-rocks IRK01W / IRK01B 전용 키스킨,2026-05-21
4977704,청맥전자 For LG MKS-3000 (블랙),2026-05-21
49735406,TKD Cycle 7 풀알루미늄 기계식 커스텀 베어본 (Rock),2026-05-21
4966556,이음전산 스마텍 STC-200,2026-05-21
4949043,멜로디 DRAGON 키보드 손목 보호대 MKP-01,2026-05-21
49142495,로지텍 G PRO X 60 LIGHTSPEED (해외구매),2026-05-21
49126514,지클릭커 OFFICEPRO WK40 패드폰 무선 (실버화이트),2026-05-21
4897041,HP GK1100 Gaming Combo,2026-05-21
48925247,KEYCOOL K19 유무선 (해외구매),2026-05-21
48925187,DrunkDeer G60 기계식,2026-05-21
48925172,TGIC TGC-K2000V,2026-05-21
4891580,에이데이타코리아 DDZONE DMK-1000M 무선 키보드 마우스세트,2026-05-21
4889271,로지텍 K480 전용 키스킨,2026-05-21
4889195,로지텍 K380 전용 키스킨,2026-05-21
4875087,아이온코리아 BOSSWIZ BK-7000,2026-05-21
4871374,건평정보통신 IPLEX KP-7300PU 키보드 마우스 세트,2026-05-21
4841627,아이온코리아 BOSSWIZ K80 (화이트),2026-05-21
4820122,아이리버 IR-K2000 (블랙),2026-05-21
4816588,서진네트웍스 BK-6000S,2026-05-21
4810284,아이리버 IR-WMK5000 (화이트),2026-05-21
4802894,Diatec FILCO 마제스터치 2S 영문 (저소음 적축),2026-05-21
47935550,SP STAR D82 PRO 유무선 기계식 해외구매 (옵션선택구성),2026-05-21
47911652,퓨전에프앤씨 INOTE X-Folding XK602B 블루투스 (블랙),2026-05-21
47843423,Wooting Two HE (해외구매),2026-05-21
47843303,aigo A18 유무선 (해외구매),2026-05-21
4767025,강원전자 NETmate NM-OM05,2026-05-21
4767002,강원전자 NETmate NM-OM04,2026-05-21
4766377,로지텍 K780 + M720 (정품),2026-05-21
47488499,몬스타 몬스타기어 스팅68,2026-05-21
4743644,ROYCHE RX-3300 (블랙),2026-05-21
4743580,ROYCHE RX-3100 (블랙),2026-05-21
4730335,DasKeyboard 다스키보드4 프로페셔널 한글 (청축),2026-05-21
4709368,청맥전자 For LG K-2000,2026-05-21
4709356,청맥전자 For LG K-2000 PS2,2026-05-21
4698525,ANYZEN MK-100 유선 세트,2026-05-21
4698449,ANYZEN K200 미니키보드,2026-05-21
4698428,ANYZEN K100U 유선키보드,2026-05-21
46887371,스틸시리즈 Apex 9 Mini US Faze Clan Edition,2026-05-21
4677213,한성컴퓨터 HKM1000K 키보드마우스 세트,2026-05-21
4669264,엠피보스 MS-K1000,2026-05-21
46583405,Topre REALFORCE R3S R3SB31 (해외구매),2026-05-21
46575023,Topre REALFORCE R3 R3HA12 (해외구매),2026-05-21
46102775,프라홈 XDA V2,2026-05-21
46102379,쿠슝 구름 키보드 손목받침대,2026-05-21
46101701,쿠슝 쌀 손목받침대 세트,2026-05-21
45997022,Keychron Q1 MAX 유무선 기계식,2026-05-21
4586522,라이트컴 COMS JD246 LED 게이밍 키보드,2026-05-21
4576905,ANYZEN K400 유선 미니키보드,2026-05-21
4574768,건평정보통신 IPLEX RK-3000C 무선 키보드 마우스 세트,2026-05-21
45742994,DrunkDeer A75 PRO,2026-05-21
45317738,Next Level Racing NLR-A012 프리 키보드 마우스 스탠드,2026-05-21
4528809,"VORTEX PBT 이중사출 29키캡 (화이트, 영문)",2026-05-21
45242399,CHERRY XTRFY MX 3.1 RGB MX2A 핑크 (적축),2026-05-21
45238370,CHERRY XTRFY MX 3.1 RGB MX2A 화이트 (적축),2026-05-21
45230189,CHERRY XTRFY MX 3.1 RGB MX2A 블랙 (적축),2026-05-21
44765408,사오파오 MOA 포차코,2026-05-21
44765306,사오파오 체리 블랙 그라디언트,2026-05-21
44764781,사오파오 OEM NEW 푸딩키캡,2026-05-21
44763560,사오파오 OEM LED 컬러 그라디언트,2026-05-21
44762093,레투스토 구름 손목받침대 세트,2026-05-21
44761736,키캡브로 발로란트,2026-05-21
44684162,BOHO 로지텍 K380 스웨이드 슬리브 파우치,2026-05-21
44674196,Keychron K5 사피아노 레더 트래블 파우치,2026-05-21
44662136,SAG 아크릴 키보드 거치대 (3단),2026-05-21
4466124,디지클럽 Qnix QMK-2000SU,2026-05-21
44623307,쿠슝 하트 손목받침대 세트,2026-05-21
4456775,로지텍 MK235 전용 키스킨,2026-05-21
44550,Actto WRS-01,2026-05-21
44470436,Actto 레트로2 풀배열 전용,2026-05-21
44468384,Actto 레트로2 미니 70키 전용,2026-05-21
444315,펠로우즈 크리스탈 젤 손목받침대,2026-05-21
44408411,Keychron 카일 스위치 보관함 (Night Fog),2026-05-21
4440774,QSENN GP-KM2200 USB,2026-05-21
44407403,Keychron 하이무 바다소금 리니어 스위치 110Pcs,2026-05-21
43529816,레오폴드 FC630MBT MX2A 코랄 블루 한글 (적축),2026-05-21
43528958,레오폴드 FC630MBT MX2A 그레이 블루 영문 (저소음 적축),2026-05-21
4351040,로지텍 K750r (해외구매),2026-05-21
4350573,로지텍 K400 PLUS (병행수입),2026-05-21
4350489,로지텍 K380 (해외구매),2026-05-21
43490999,VARO V21 유무선 기계식 화이트 (저소음 민트),2026-05-21
