93441722,PMO AURORA 80 유무선 기계식 해외구매 (청죽축),90490,90490,,90490,90490,90490,90490,90490
96650402,PMO AURORA 80 유무선 기계식 화이트 (청죽축),148000,148000,,148000,148000,148000,148000,148000
76333034,PMO WAVE75 유무선 기계식 해외구매 (그린축),83230,83230,,83230,83230,83230,83230,83230
73696058,PMO WAVE75 유무선 기계식 해외구매 (옵션선택구성),81810,81810,,81810,81810,81810,81810,81810
76333043,PMO WAVE75 유무선 기계식 해외구매 (퍼플축),115300,115300,,115300,115300,115300,115300,115300
68363558,PROJECT511 코르크 팜레스트 (텐키리스),8700,8700,,8700,8700,8700,8700,8700
68363555,PROJECT511 코르크 팜레스트 (풀 사이즈),8700,8700,,8700,8700,8700,8700,8700
29807342,PYHO BTMK6 무선 (해외구매),16250,16250,,16250,16250,16250,16250,16250
29807720,PYHO FVQ58 (해외구매),25700,25700,,25700,25700,25700,25700,25700
97903895,PYHO L98 유무선 중고,26570,26570,,26570,29570,29570,29570,29570
5550198,PowerFul KM701UU 키보드 마우스 콤보,6900,6900,,6900,6900,6900,6900,6900
64390187,Project R PJTR-0001 무선,12900,12900,,12900,12900,12900,12900,12900
76328951,Pulsar PCMK 2 HE TKL 마그네틱 (블랙),189000,189000,,189000,189000,187900,187900,187900
69562190,Pulsar PCMK 2 HE TKL 마그네틱 (화이트),189000,188000,,188000,179500,179600,179600,179600
92367110,Pulsar PCMK 3 HE 60,183040,183040,,173940,173940,173940,183040,173940
101187191,Pulsar PCMK 3 HE Bruce Lee 85th Edition,239000,239000,,239000,239000,239000,239000,239000
104355887,Pulsar PCMK 3 HE TKL (블랙),238000,238000,,238000,238000,238000,238000,238000
104355890,Pulsar PCMK 3 HE TKL (화이트),238000,238000,,238000,238000,238000,238000,238000
76462502,Pulsar XBOARD MS 기계식,59000,59000,,59000,59000,59000,59000,59000
122690518,Pulsar XPAD Mini (터콰이즈),53000,53000,,51400,51400,51400,50100,52700
122690517,Pulsar XPAD Mini (핑크),53000,53000,,51300,54000,52750,52750,52750
122690525,Pulsar XPAD Mini (화이트),52750,52750,,50100,50100,50250,50250,51400
96257720,Pulsar eS HE 70,267200,267200,,267400,267400,267400,267400,267600
15354383,Pulsar 로우 프로파일 영문 키캡 104키 (블랙),26690,26690,,26690,26690,26690,26690,26130
15354386,Pulsar 로우 프로파일 영문 키캡 104키 (화이트),26690,26690,,26690,26690,26690,26690,26130
15354230,Pulsar 베이직 영문 키캡 104키 (블랙),23000,23000,,22990,22990,22990,22990,22990
15354233,Pulsar 베이직 영문 키캡 104키 (화이트),23000,23000,,22990,22990,22990,22990,22990
15354179,Pulsar 베이직 한영 키캡 104키 (블랙),21850,21850,,21850,21850,21850,21850,21390
15354182,Pulsar 베이직 한영 키캡 104키 (화이트),23000,23000,,22990,22990,22990,22990,22990
28187009,Pulsar 슈퍼그립 유니버셜 Pre-cut,9390,9390,,9390,9390,9390,9390,9390
73948355,QSENN A75 유무선 기계식 커스텀 베어본,49800,49800,,49800,49800,49800,49800,49800
72723734,QSENN DT35 104 8K 풀윤활 가스켓 기계식 블루퍼플 (퍼플축),51890,51890,,51890,51890,51890,51890,51890
72723743,QSENN DT35 104 8K 풀윤활 가스켓 기계식 크림치즈 (크림치즈축),52900,52900,,52900,52900,52900,52900,52900
72723716,QSENN DT35 104 8K 풀윤활 가스켓 기계식 화이트 (애플민트축),51890,51890,,51890,51890,51890,51890,51890
63028019,QSENN DT35 104 가스켓 유무선 기계식 블루퍼플 (저소음 바다축),57820,57820,,57820,57820,57820,57820,57820
63027989,QSENN DT35 104 가스켓 유무선 기계식 블루퍼플 (저소음 톰축),58740,58740,,58740,58740,58740,58740,58740
63028034,QSENN DT35 104 가스켓 유무선 기계식 블루퍼플 (저소음 피치축),63400,63400,,63400,63400,63400,63400,63400
97843307,QSENN DT35 104 가스켓 유무선 기계식 블루퍼플 (중고),39940,39940,,39940,39940,39940,39940,39940
78095537,QSENN DT35 104 가스켓 유무선 기계식 크림치즈 (저소음 바다소금축),56300,51770,,51770,51770,51770,51770,51770
78095528,QSENN DT35 104 가스켓 유무선 기계식 크림치즈 (크림치즈축),52300,52300,,52300,52300,52300,52300,52300
63086582,QSENN DT35 106 가스켓 유무선 기계식 블랙 (민트축),48400,48400,,48400,48400,48400,48400,48400
63086615,QSENN DT35 106 가스켓 유무선 기계식 블랙 (애플민트축),48400,48400,,48400,48400,48400,48400,48400
63086663,QSENN DT35 106 가스켓 유무선 기계식 블랙 (저소음 바다소금축),52400,52400,,52400,52400,52400,52400,52400
97904258,QSENN DT35 106 가스켓 유무선 기계식 블랙 (중고),38720,38720,,38720,38720,38720,38720,38720
63086717,QSENN DT35 106 가스켓 유무선 기계식 화이트 (민트축),48400,48400,,48400,48400,48400,48400,48400
63086702,QSENN DT35 106 가스켓 유무선 기계식 화이트 (애플민트축),48400,48400,,48400,48400,48400,48400,48400
63086696,QSENN DT35 106 가스켓 유무선 기계식 화이트 (저소음 바다소금축),64900,64900,,64900,64900,64900,60500,60500
97904252,QSENN DT35 106 가스켓 유무선 기계식 화이트 (중고),36780,36780,,36780,36780,36780,36780,36780
71642537,QSENN DT35 89 TKL 멤브레인 (블랙),13400,13400,,13400,13400,13400,13400,13400
12213530,QSENN GP-K1200 (PS/2),11370,11370,,11370,11370,11370,11370,11370
12213509,QSENN GP-K1200 (USB),6900,6900,,6900,6900,6900,6900,6900
110571788,QSENN GP-K1200 키스킨,6040,6040,,6040,6040,6040,6040,6040
3369149,QSENN GP-K5000 실리콘 키스킨,3720,3590,,3610,3710,3720,3590,3670
3331744,QSENN GP-K7000 (블랙),15270,15270,,15270,15270,15270,15270,15270
15406733,QSENN GP-K7000 영문 (블랙),15300,15300,,15300,15300,15300,15300,15300
12213389,QSENN GP-KM2100 Plus (USB),10320,10320,,10320,10320,10320,10320,10320
12256694,QSENN GP-KM2200 Plus (PS/2),9600,9600,,9600,9600,9600,9600,9600
12256646,QSENN GP-KM2200 Plus (USB),9600,9600,,9600,9600,9600,9600,9600
4440774,QSENN GP-KM2200 USB,9600,9600,,9600,9600,9600,9600,9600
6691924,QSENN GP-KM2500 PS/2 + USB,8900,8900,,8900,8900,8900,8900,8900
18064787,QSENN GP-KM3100 Plus 버티컬 키보드 마우스 세트 (블랙),20530,20530,,20530,20530,20530,20530,20530
12149837,QSENN GP-KM4500 Plus (PS/2),13900,13900,,13900,13900,13900,13900,13900
12149873,"QSENN GP-KM4500 Plus (USB, 블랙)",13750,13750,,13750,13900,13900,13900,13900
18020636,"QSENN GP-KM4500 Plus (USB, 화이트)",13590,13590,,13590,13590,13590,13590,13590
12149993,QSENN GP-KM4500S LED Stella (USB),15900,15900,,15900,15900,15900,15900,15900
15283157,"QSENN K1000 무선키보드 (민트, 키스킨 포함)",9900,9900,,9900,9900,9900,9900,9900
15055466,"QSENN K1000 무선키보드 (블랙, 키스킨 포함)",9900,9900,,9900,9900,9900,9900,9900
94999592,QSENN K1000 무선키보드 (중고),8920,8920,,9700,8920,8920,10140,8920
15283163,"QSENN K1000 무선키보드 (핑크, 키스킨 포함)",9900,9900,,9900,9900,9900,9900,9900
15283115,"QSENN K1000 무선키보드 (화이트, 키스킨 포함)",9900,9900,,9900,9900,9900,9900,9900
7100656,QSENN K6000 미니 키보드 블랙,6900,6900,,6900,6900,6900,6900,6900
100191761,QSENN K7314 저소음 무선 (라벤더),13900,13900,,13900,13900,13900,13900,13900
100191755,QSENN K7314 저소음 무선 (벚꽃),13900,13900,,13900,13900,13900,13900,13900
100191752,QSENN K7314 저소음 무선 (슈팅스타),13900,13900,,13900,13900,13900,13900,13900
6691954,QSENN KM2500 Plus USB 키보드 마우스 세트,8900,8900,,8900,8900,8900,8900,8900
20169068,QSENN KM3500 Plus 키보드 마우스 세트 (민트),16800,16800,,16800,16800,16800,16800,16800
20165195,QSENN KM3500 Plus 키보드 마우스 세트 (블랙),16090,16090,,16090,16090,16090,16090,16090
98780282,QSENN KM3500 Plus 키보드 마우스 세트 (중고),14710,14710,,14710,14710,14710,14710,14710
20169056,QSENN KM3500 Plus 키보드 마우스 세트 (핑크),16800,16800,,16800,16800,16800,16800,16800
20169020,QSENN KM3500 Plus 키보드 마우스 세트 (화이트),16800,16800,,16800,16800,16800,16800,16800
18442208,QSENN KM6000 미니 키보드 마우스 세트,9800,9800,,9690,9800,9800,9800,9800
15055394,QSENN MK110 무선키보드 마우스 세트,16900,16900,,16900,16900,16900,16900,16900
70255139,"QSENN MK128 사일런트 무선 키보드 마우스 세트 (블랙, 키스킨 포함)",17400,17400,,17400,17400,17400,17400,17400
70255172,"QSENN MK128 사일런트 무선 키보드 마우스 세트 (화이트, 키스킨 포함)",17400,17400,,17400,17400,17400,17400,17400
15719942,"QSENN MK210 무선 키보드 마우스 세트 (민트, 키스킨 미포함)",14800,14800,,14800,14800,14800,14800,14800
15270272,"QSENN MK210 무선 키보드 마우스 세트 (민트, 키스킨 포함)",14800,14800,,14800,14800,14800,14800,14800
15719915,"QSENN MK210 무선 키보드 마우스 세트 (블랙, 키스킨 미포함)",14800,14800,,14800,14800,14800,14800,14800
15270242,"QSENN MK210 무선 키보드 마우스 세트 (블랙, 키스킨 포함)",14800,14800,,14800,14800,14800,14800,14800
15719930,"QSENN MK210 무선 키보드 마우스 세트 (핑크, 키스킨 미포함)",14800,14800,,14800,14800,14800,14800,14800
15719918,"QSENN MK210 무선 키보드 마우스 세트 (화이트, 키스킨 미포함)",15800,15800,,15800,15800,15800,14800,14800
15270260,"QSENN MK210 무선 키보드 마우스 세트 (화이트, 키스킨 포함)",14800,14800,,14800,14800,14800,14800,14800
29857562,QSENN MK280 무선 키보드 마우스 세트 (민트),18400,18400,,18400,18400,18400,18400,18400
29857550,QSENN MK280 무선 키보드 마우스 세트 (블랙),20870,20870,,21430,17800,17800,17800,17800
29857571,QSENN MK280 무선 키보드 마우스 세트 (핑크),17800,17800,,17800,17800,17800,17800,17800
29857556,QSENN MK280 무선 키보드 마우스 세트 (화이트),18400,18400,,18400,18400,18400,18400,18400
100190816,QSENN MK314 저소음 무선 키보드 마우스 세트 (라벤더),18780,18780,,18780,18780,18780,18780,18780
100190810,QSENN MK314 저소음 무선 키보드 마우스 세트 (벚꽃),18900,18900,,18900,18900,18900,18900,18900
100190801,QSENN MK314 저소음 무선 키보드 마우스 세트 (슈팅스타),18400,18400,,18400,18900,18900,18900,18900
20169236,QSENN MK350 무선 키보드 마우스 세트 (민트),19760,19760,,19760,19760,19760,19760,19760
20166155,QSENN MK350 무선 키보드 마우스 세트 (블랙),20400,20400,,20140,20140,20140,20140,20140
20169218,QSENN MK350 무선 키보드 마우스 세트 (핑크),20400,20400,,20140,20140,20140,20140,20140
20169182,QSENN MK350 무선 키보드 마우스 세트 (화이트),20400,20400,,20140,20140,20140,20140,20140
17459978,QSENN MK450 무선 키보드 마우스 세트 (민트),17870,17870,,17870,17870,17870,17870,17870
17459915,QSENN MK450 무선 키보드 마우스 세트 (블랙),18360,18360,,18000,18360,18360,18360,18360
97843100,QSENN MK450 무선 키보드 마우스 세트 (중고),17880,15720,,15720,15720,17880,17880,17090
17459969,QSENN MK450 무선 키보드 마우스 세트 (핑크),20930,20930,,20930,20930,20930,20930,20930
17459957,QSENN MK450 무선 키보드 마우스 세트 (화이트),17870,17870,,17870,17870,17870,17870,17870
6555974,QSENN PTS-GK1000 게이밍 한손 키보드,15900,15900,,15900,15900,15900,15900,15900
96650972,QSENN Q104 8K 풀윤활 유무선 기계식 라벤더 (딸기라떼축),69800,69800,,69800,69800,69800,69800,69800
96650984,QSENN Q104 8K 풀윤활 유무선 기계식 라벤더 (저소음 달고나라떼축),73530,73530,,73530,73530,73530,73530,73530
96651071,QSENN Q104 8K 풀윤활 유무선 기계식 벚꽃 (저소음 카라멜라떼축),73530,73530,,73530,73530,73530,73530,73530
96651038,QSENN Q104 8K 풀윤활 유무선 기계식 벚꽃 (흑당라떼축),68400,68400,,68400,68400,68400,68400,68400
96650921,QSENN Q104 8K 풀윤활 유무선 기계식 슈팅스타 (실론밀크축),60430,60430,,60430,60430,60430,60430,60430
96650885,QSENN Q104 8K 풀윤활 유무선 기계식 슈팅스타 (저소음 바다소금),67260,67260,,67260,67260,67260,67260,67260
92148767,QSENN Q104 LCD 풀윤활 가스켓 유무선 기계식 그라데이션 블루소다 (저소음 딥블루축),73880,73880,,73880,73880,73880,73880,73880
92148782,QSENN Q104 LCD 풀윤활 가스켓 유무선 기계식 그라데이션 블루소다 (저소음 위스퍼축),74560,74560,,74560,74560,74560,74560,74560
92147741,QSENN Q104 LCD 풀윤활 가스켓 유무선 기계식 그라데이션 핑크베리 (저소음 핑크솔트축),74800,74800,,73880,73880,73880,73880,73880
92147738,QSENN Q104 LCD 풀윤활 가스켓 유무선 기계식 그라데이션 핑크베리 (저소음 하트비트축),75400,75400,,75400,75400,75400,75400,75400
92147684,QSENN Q104 LCD 풀윤활 가스켓 유무선 기계식 슈팅스타 (민트축),67400,67400,,67400,67400,67400,67400,67400
92147624,QSENN Q104 LCD 풀윤활 가스켓 유무선 기계식 슈팅스타 (실론밀크축),64800,64800,,64800,64800,64800,64800,64800
92147693,QSENN Q104 LCD 풀윤활 가스켓 유무선 기계식 슈팅스타 (저소음 바다소금축),71800,71800,,71800,71800,71800,71800,71800
73560281,QSENN Q104 PBT 풀윤활 가스켓 유무선 기계식 블랙 (민트축),56400,56400,,56400,56400,56400,56400,56400
73560275,QSENN Q104 PBT 풀윤활 가스켓 유무선 기계식 블랙 (저소음 바다소금축),58600,58600,,58600,58600,58600,58600,58600
73560296,QSENN Q104 PBT 풀윤활 가스켓 유무선 기계식 블루퍼플 (저소음 바다소금축),59110,59110,,59110,59110,59110,59110,59110
73560302,QSENN Q104 PBT 풀윤활 가스켓 유무선 기계식 블루퍼플 (퍼플축),56400,56400,,56400,56400,56400,56400,56400
97777058,QSENN Q104 PBT 풀윤활 가스켓 유무선 기계식 슈팅스타 (실론밀크축),53800,53800,,53800,53800,53800,53800,53800
73560308,QSENN Q104 PBT 풀윤활 가스켓 유무선 기계식 크림치즈 (저소음 바다소금축),59800,59800,,59800,59800,59800,59800,59800
94027826,QSENN Q104 PBT 풀윤활 가스켓 유무선 기계식 크림치즈 (중고),47840,47840,,,,,,
73560311,QSENN Q104 PBT 풀윤활 가스켓 유무선 기계식 크림치즈 (크림치즈축),56400,56400,,56400,56400,56400,56400,56400
73560290,QSENN Q104 PBT 풀윤활 가스켓 유무선 기계식 화이트 (애플민트축),56400,56400,,56400,56400,56400,56400,56400
73560287,QSENN Q104 PBT 풀윤활 가스켓 유무선 기계식 화이트 (저소음 바다소금축),59250,59250,,59250,59250,59250,59250,59250
94027874,QSENN Q104 PBT 풀윤활 가스켓 유무선 기계식 화이트 (중고),52020,,,,,,,
106701851,QSENN Q104 스폰지밥 에디션 PBT 풀윤활 가스켓 유무선 기계식 (뚱이),79800,79800,,79800,79800,79800,79800,79800
106701848,QSENN Q104 스폰지밥 에디션 PBT 풀윤활 가스켓 유무선 기계식 (스폰지밥),79800,79800,,79800,79800,79800,79800,79800
94023830,QSENN Q104 유무선 기계식 커스텀 베어본,39900,39900,,39900,39900,39900,39900,39900
109482527,QSENN Q108 PBT 풀윤활 가스켓 유무선 기계식 (라벤더),64800,64800,,64800,64800,64800,64800,64800
109482533,QSENN Q108 PBT 풀윤활 가스켓 유무선 기계식 (모카무스),54800,54800,,54800,54800,54800,54800,54800
109482539,QSENN Q108 PBT 풀윤활 가스켓 유무선 기계식 (벚꽃),61220,61220,,61220,61220,61220,61220,61220
109482524,QSENN Q108 PBT 풀윤활 가스켓 유무선 기계식 (스모크드 펄 그레이),64790,64790,,64790,64790,64790,64790,64790
67624961,QSENN Q75 가스켓 유무선 기계식 블랙 (민트축),45800,45800,,45800,45800,45800,45800,45800
67625153,QSENN Q75 가스켓 유무선 기계식 블랙 (바다소금축 넌클릭),49800,49800,,49800,49800,49800,49800,49800
67625171,QSENN Q75 가스켓 유무선 기계식 블랙 (저소음 라임축),45800,45800,,45800,45800,45800,45800,45800
74052725,QSENN Q75 가스켓 유무선 기계식 블랙 (저소음 바다소금축),49790,49790,,49790,49790,49790,49790,49790
97840850,QSENN Q75 가스켓 유무선 기계식 블랙 (중고),38100,38100,,38100,38100,38100,38100,38100
67625609,QSENN Q75 가스켓 유무선 기계식 블루퍼플 (저소음 바다소금축),49790,49790,,49790,49790,49790,49790,49790
67625648,QSENN Q75 가스켓 유무선 기계식 블루퍼플 (저소음 크림옐로우PRO),56400,56400,,56400,56400,56400,56400,56400
67625579,QSENN Q75 가스켓 유무선 기계식 블루퍼플 (퍼플축),45800,45800,,45800,45800,45800,45800,45800
67625546,QSENN Q75 가스켓 유무선 기계식 크림치즈 (미드나잇축),52800,52800,,52800,52800,52800,52800,52800
74052740,QSENN Q75 가스켓 유무선 기계식 크림치즈 (저소음 바다소금축),49790,49790,,49790,49790,49790,49790,49790
67625564,QSENN Q75 가스켓 유무선 기계식 크림치즈 (저소음 바다축),56400,56400,,56400,56400,56400,56400,56400
67625522,QSENN Q75 가스켓 유무선 기계식 크림치즈 (크림치즈축),45800,45800,,45800,45800,45800,45800,45800
67625273,QSENN Q75 가스켓 유무선 기계식 화이트 (바다소금축 리니어),45800,45800,,45800,45800,45800,45800,45800
67625246,QSENN Q75 가스켓 유무선 기계식 화이트 (애플민트축),45800,45800,,45800,45800,45800,45800,45800
71720405,QSENN Q75 가스켓 유무선 기계식 화이트 (저소음 바다소금축),49790,49790,,49790,49790,49790,49790,49790
67625453,QSENN Q75 가스켓 유무선 기계식 화이트 (저소음 피치축),57800,57800,,57800,57800,57800,57800,57800
74810462,QSENN Q87 PBT 유무선 기계식 블랙 (민트축),45800,45800,,45800,45800,45800,45800,45800
74884790,QSENN Q87 PBT 유무선 기계식 블랙 (저소음 바다소금축),49790,49790,,49790,49790,49790,49790,49790
74810369,QSENN Q87 PBT 유무선 기계식 블루퍼플 (저소음 바다소금축),49790,49790,,49790,49790,49790,49790,49790
94028687,QSENN Q87 PBT 유무선 기계식 블루퍼플 (중고),45310,,,,,,,
74810426,QSENN Q87 PBT 유무선 기계식 블루퍼플 (퍼플축),45800,45800,,45800,45800,45800,45800,45800
74810195,QSENN Q87 PBT 유무선 기계식 크림치즈 (저소음 바다소금축),49790,49790,,49790,49790,49790,49790,49790
74810207,QSENN Q87 PBT 유무선 기계식 크림치즈 (크림치즈축),45800,45800,,45800,45800,45800,45800,45800
74810354,QSENN Q87 PBT 유무선 기계식 화이트 (애플민트축),45800,45800,,45800,45800,45800,45800,45800
74248535,QSENN Q87 PBT 유무선 기계식 화이트 (저소음 바다소금축),49790,49790,,49790,49790,49790,49790,49790
68686589,QSENN Q99 유무선 기계식 블랙 (민트축),53800,53800,,53800,53800,53800,53800,53800
68686661,QSENN Q99 유무선 기계식 블랙 (바다소금축 넌클릭),58400,58400,,58400,58400,58400,58400,58400
68686694,QSENN Q99 유무선 기계식 블랙 (저소음 라임축),64400,64400,,64500,64600,64700,64800,64800
73253603,QSENN Q99 유무선 기계식 블랙 (저소음 바다소금축),58400,58400,,58400,58400,58400,58400,58400
68687138,QSENN Q99 유무선 기계식 블루퍼플 (저소음 바다소금축),57230,57230,,57230,57230,57230,57230,57230
68687153,QSENN Q99 유무선 기계식 블루퍼플 (저소음 크림옐로우PRO),69900,69900,,69900,69900,69900,69900,69900
68687120,QSENN Q99 유무선 기계식 블루퍼플 (퍼플축),53800,53800,,53800,53800,53800,53800,53800
95284748,QSENN Q99 유무선 기계식 커스텀 베어본,38900,38900,,38900,38900,38900,38900,38900
68687027,QSENN Q99 유무선 기계식 크림치즈 (미드나잇축),58400,58400,,58400,58400,58400,58400,58400
71720429,QSENN Q99 유무선 기계식 크림치즈 (저소음 바다소금축),58400,58400,,58400,58400,58400,58400,58400
68687036,QSENN Q99 유무선 기계식 크림치즈 (저소음 바다축),65800,65800,,65800,65800,65800,65800,65800
68686973,QSENN Q99 유무선 기계식 크림치즈 (크림치즈축),52400,52400,,52400,52400,52400,52400,52400
68686955,QSENN Q99 유무선 기계식 화이트 (바다소금축 리니어),58400,58400,,58400,58400,58400,58400,58400
68686703,QSENN Q99 유무선 기계식 화이트 (애플민트축),52400,52400,,52400,52400,52400,52400,52400
72755042,QSENN Q99 유무선 기계식 화이트 (저소음 바다소금축),58400,58400,,58400,58400,58400,58400,58400
68686733,QSENN Q99 유무선 기계식 화이트 (저소음 피치축),66800,66800,,66800,66800,66800,66800,66800
78098555,QSENN R75 유무선 기계식 블랙 (바다소금축 리니어),62850,62850,,62850,62850,62850,62850,62850
78098540,QSENN R75 유무선 기계식 블랙 (애플민트축),61800,61800,,61800,61800,61800,61800,61800
78098513,QSENN R75 유무선 기계식 블루퍼플 (바다소금축 넌클릭),64800,64800,,64800,64800,64800,64800,64800
73948289,QSENN R75 유무선 기계식 블루퍼플 (퍼플축),61800,61800,,61800,61800,61800,61800,61800
78098606,QSENN R75 유무선 기계식 크림치즈 (크림치즈축),61800,61800,,61800,61800,61800,61800,61800
78098585,QSENN R75 유무선 기계식 화이트 (미드나잇축),67800,67800,,67800,67800,67800,67800,67800
78098573,QSENN R75 유무선 기계식 화이트 (민트축),64300,64300,,64300,64300,64300,64300,64300
78098576,QSENN R75 유무선 기계식 화이트 (애플민트축),61800,61800,,61800,61800,61800,61800,61800
18167000,QSENN SEM-DT 큰글씨,10600,10600,,10600,10600,10600,10600,10600
18110864,QSENN SEM-DT 큰글씨 Wireless,18400,18400,,18400,18400,18400,18400,18400
6859030,QSENN SEM-DT25T 그린 LED 텐키리스,15900,15900,,15900,15900,15900,15900,15900
11996414,QSENN SEM-DT25TS LED 텐키리스,19900,19900,,19900,19900,19900,19900,19900
3274936,QSENN SEM-DT35 NEW PS2 (블랙),12400,12400,,12400,12400,12400,12400,12400
3274946,QSENN SEM-DT35 NEW PS2 (화이트),12400,12400,,12400,12400,12400,12400,12400
20018744,QSENN SEM-DT35 NEW USB (민트),11990,11990,,11990,11990,11990,11990,11990
3274953,QSENN SEM-DT35 NEW USB (블랙),12400,12400,,12400,12400,12400,12400,12400
20018753,QSENN SEM-DT35 NEW USB (핑크),14900,14900,,14900,14900,14900,14900,14900
3274956,QSENN SEM-DT35 NEW USB (화이트),11900,11900,,11900,12400,12400,12400,12400
3277626,QSENN SEM-DT35 실리콘 키스킨,1600,1600,,1600,1600,1600,1600,1600
5339279,QSENN SEM-DT35S LED Stella (블랙),13690,13690,,13690,13690,13690,13690,13690
58100786,QSENN SEM-DT35S LED Stella (화이트),14890,14890,,14890,14890,14890,14890,14890
19993439,QSENN SEM-DT35W 무선 (민트),15900,15900,,15900,15900,15900,15900,15900
19993331,QSENN SEM-DT35W 무선 (블랙),15900,15900,,15900,15900,15900,15900,15900
19993433,QSENN SEM-DT35W 무선 (핑크),15900,15900,,15900,15900,15900,15900,15900
19993385,QSENN SEM-DT35W 무선 (화이트),15900,15900,,15900,15900,15900,15900,15900
97904138,QSENN SEM-DT45 NEW Plus (PS/2 중고),4970,4970,,4970,4970,4970,4970,4970
11996540,QSENN SEM-DT45 NEW Plus (PS/2),14740,14740,,14740,14740,14740,14740,14740
11996561,"QSENN SEM-DT45 NEW Plus (USB, 블랙)",10600,10600,,10600,10600,10600,10600,10600
17983721,"QSENN SEM-DT45 NEW Plus (USB, 화이트)",10600,10600,,10600,10600,10540,10540,10540
17459624,QSENN SEM-DT45 Plus 무선 (민트),13540,13540,,13540,13540,13540,13540,13540
17459549,QSENN SEM-DT45 Plus 무선 (블랙),10600,10600,,10600,10600,10600,10600,10600
17459609,QSENN SEM-DT45 Plus 무선 (핑크),13540,13540,,13540,13540,13540,13540,13540
17459588,QSENN SEM-DT45 Plus 무선 (화이트),13540,13540,,13540,13540,13540,13540,13540
17040326,QSENN SEM-DT65T LED,24800,24800,,24800,24800,24800,24800,24800
18167246,QSENN SEM-KM 큰글씨 키보드 마우스 세트,13900,13900,,13900,13900,13900,13900,13900
18307235,QSENN SEM-MK 큰글씨 무선 키보드 마우스 세트,18400,18400,,18400,18400,18400,18400,18400
3331725,QSENN SNK-3000,10600,10600,,10600,10600,10600,10600,10600
3369181,QSENN SWT-1200 실리콘 키스킨,6040,6040,,6040,6040,6040,6040,6040
103479983,QSENN X104 풀윤활 가스켓 기계식 라벤더 (실론시나몬축),39800,39800,,39800,39800,39800,39800,39800
103479989,QSENN X104 풀윤활 가스켓 기계식 모카무스 (실론시나몬축),39800,39800,,39800,39800,39800,39800,39800
103480001,QSENN X104 풀윤활 가스켓 기계식 벚꽃 (실론밀크축),39800,39800,,39800,39800,39800,39800,39800
103479995,QSENN X104 풀윤활 가스켓 기계식 스모크드 펄 그레이 (실론밀크축),39800,39800,,39800,39800,39800,39800,39800
103752779,QSENN 구름 팜레스트 (레인보우),5400,5400,,5400,5400,5400,5400,5400
73886150,QSENN 구름 팜레스트 (블루),5400,5400,,5400,5400,5400,5400,5400
74052716,QSENN 구름 팜레스트 (화이트),5400,5400,,5400,5400,5400,5400,5400
96980330,QSENN 베이지브라운 키캡,17400,17400,,17400,17400,17400,17400,17400
96980414,QSENN 블루베어 바닐라소다 키캡,20400,20400,,20400,20400,20400,20400,20400
73886189,QSENN 엔젤윙 팜레스트 (블루),5400,5400,,5400,5400,5400,5400,5400
74052722,QSENN 엔젤윙 팜레스트 (화이트),5400,5400,,5400,5400,5400,5400,5400
96980291,QSENN 카라멜그린 키캡,19900,19900,,19900,19900,19900,19900,19900
96980375,QSENN 핑크베어 스트로베리 키캡,20400,20400,,20400,20400,20400,20400,20400
26584664,RAPOO X1800S 무선 키보드 마우스 세트,20300,20300,,20300,20300,20300,20300,20300
17632478,RHINO GEAR K-312U,10010,10010,,10010,10010,10010,10010,10010
96257570,RHINO GEAR RG-GK100,7800,7800,,7800,7650,7650,7650,7650
32001449,RHINO GEAR RG-GMK100 키보드 마우스 세트,12200,12200,,12200,12200,12200,12200,12200
18435059,RHINO GEAR RG-K100 키패드,6890,6890,,6890,6890,6890,6890,6900
17937470,RHINO GEAR RG-K2 미니 키보드,5540,5540,,5540,5540,5540,5540,5540
28059809,RHINO GEAR RG-KM05 키보드 마우스 세트,5400,5400,,5400,5400,5400,5400,5400
16092845,RHINO GEAR RG-KM100 텐키리스 키보드 마우스 세트,8000,8000,,8000,8000,8000,8000,8000
17632655,RHINO GEAR RG-KM200U 키보드 마우스 세트,8500,8500,,8500,8500,8500,8500,8500
