98229488,블루마토 손목보호 (M),11290,11290,,11290,11290,11290,11290,11290
98229485,블루마토 손목보호 (S),6830,6830,,6830,6830,6830,6830,6830
10166538,비치온 VN2-WPA36 텐키리스 알루미늄 손목 받침대 (블랙),26700,26700,,26700,26700,26700,26700,26700
74490806,비치온 VN2-WPA36 텐키리스 알루미늄 손목 받침대 (실버),26700,26700,,26700,26700,26700,26700,26700
10166598,비치온 VN2-WPA44 알루미늄 손목 받침대 (블랙),26700,26700,,26700,26700,26700,26700,26700
21694292,비치온 토체프 전용,5500,5500,,5500,5500,5500,5500,5500
104624321,비트엠 Newsync BITK-BK10 키보드 마우스 세트,15220,15220,,15220,15220,15220,15220,15220
104624324,비트엠 Newsync BITK-WT10 키보드 마우스 세트,14990,14990,,14990,14990,14990,14990,14990
14431265,비프렌드 KB800 (블랙),23140,23140,,23140,23140,23140,23140,23140
14431400,비프렌드 KB800 (실버/화이트),23310,23310,,23310,23310,23310,23310,23310
11226774,비프렌드 RF800K 무선 (블랙),24890,24890,,24890,24890,24890,24890,24890
11226783,비프렌드 RF800K 무선 (실버 화이트),24900,24900,,24900,24900,24900,24900,24900
30310724,빠밤 키보드 높이 조절 피트 H2,9200,9200,,9200,9200,9200,9200,9200
54813449,사오파오 GMK Style,19900,19900,,19900,19900,19900,19900,19900
54813869,사오파오 GMK 소야밀크st 체리,19900,19900,,19900,19900,19900,19900,19900
70250525,사오파오 MOA 5면 시나모롤 쿠로미 모음 120Pcs,34900,34900,,34900,34900,34900,34900,34900
67578635,사오파오 MOA 캐릭터 핑크 마이멜로디,29900,29900,,29900,29900,29900,29900,29900
67578599,사오파오 MOA 캐릭터 핑크 헬로키티,29900,29900,,29900,29900,29900,29900,29900
67578701,사오파오 MOA 캐릭터 화이트 포차코,29900,29900,,29900,29900,29900,29900,29900
72718814,사오파오 New 사과,168160,168160,,168160,168160,168160,168160,168160
44763560,사오파오 OEM LED 컬러 그라디언트,19900,19900,,19900,19900,19900,19900,19900
44764781,사오파오 OEM NEW 푸딩키캡,18000,18000,,18000,18000,18000,18000,18000
72983918,사오파오 고양이발 젤리,18900,18900,,18900,18900,18900,18900,18900
73121039,사오파오 동물원,14900,14900,,14900,14900,14900,14900,14900
28390742,사오파오 러블리퍼플 키캡,9900,9900,,9900,9900,9900,9900,9900
55385375,사오파오 마리오 XDA,19900,19900,,19900,19900,19900,19900,19900
72984089,사오파오 모디열 분필,9900,9900,,9900,9900,9900,9900,9900
55385642,사오파오 미니멀블랙,24900,24900,,24900,24900,24900,24900,24900
73766528,사오파오 밀크허니비,19900,19900,,19900,19900,19900,19900,19900
73768175,사오파오 버추얼워,9900,9900,,9900,9900,9900,9900,9900
28390895,사오파오 빈티지블루 키캡 OEM,24900,24900,,24900,24900,24900,24900,24900
72984167,사오파오 아이스크림,9900,9900,,9900,9900,9900,9900,9900
56449808,사오파오 우주공간 한글,22400,22400,,22400,22400,22400,22400,22400
44765306,사오파오 체리 블랙 그라디언트,24300,24300,,24300,24300,24300,24300,24300
54484085,사오파오 체리 시바 강아지2,19900,19900,,19900,19900,19900,19900,19900
54484007,사오파오 체리 컬러 포인트 키캡,14900,14900,,14900,14900,14900,14900,14900
73121684,사오파오 카페,29900,29900,,29900,29900,29900,29900,29900
56344670,사오파오 클라우드,9900,9900,,9900,9900,9900,9900,9900
55385729,사오파오 퓨처펑크,19900,19900,,19900,19900,19900,19900,19900
72978644,살림여왕 한글,18640,18640,,21350,21350,21350,21350,21350
96369731,삼성전자 EJ-B7800UBKGKR 무선,109630,109750,,102520,102640,102650,102760,102880
13620794,삼성전자 PK1100 전용 키스킨,4000,4000,,4000,4000,4000,4000,4000
16781726,삼성전자 SK-M1100B,22900,22900,,22900,22900,22900,22900,22900
70766876,삼성전자 SK-M1600B 무선,29900,29900,,29900,29900,29900,29900,29900
14631326,삼성전자 SKG-210PB 전용 키스킨,4000,4000,,4000,4000,4000,4000,4000
1056910,삼성전자 SKG-3000UB (키스킨 미포함),21500,21500,,21500,21500,21500,21500,21500
1103703,삼성전자 SKG-3000UB (키스킨 포함),21500,21500,,21500,21500,21500,21500,21500
14630975,삼성전자 SKP-1000B 전용 키스킨,2820,2820,,2820,2820,2820,2820,2820
18736754,삼성전자 SKP-900B 전용,1883,1883,,1883,1883,1883,1883,1883
5638241,삼성전자 SKP-900B 키보드 마우스 세트 (키스킨 미포함),26900,26900,,26900,26900,26900,26900,26900
120728692,삼성전자 SKS-9000U 키스킨,6020,6020,,6020,6020,6020,6020,6020
14627642,삼성전자 SKS-9000UB 전용 키스킨,3630,3630,,3630,3630,3630,3630,3630
73889735,삼성전자 SP-M1800Q 무선 키보드 마우스 세트,62500,62500,,62500,62500,62500,62500,62500
89525408,삼성전자 SP-M1900QB 무선 키보드 마우스 세트,54000,54000,,54000,54000,54000,54000,54000
98918525,삼성전자 SP-R1600W 무선 키보드 마우스 세트,39900,39900,,39900,39900,39900,39900,39900
5782793,삼성전자 SPA-JKA1BUB,21500,21500,,21500,21500,21500,21500,21500
14618894,삼성전자 SPA-JKA1BUB 전용 키스킨,2500,2500,,2500,2500,2500,2500,2500
92103980,삼성전자 SPA-JKA1BUW,21500,21500,,21500,21500,21500,21500,21500
6436163,삼성전자 SPA-KKA1BUW 유선 키보드,19900,19900,,19900,19900,19900,19900,19900
14628647,삼성전자 SRP-9400B 전용 키스킨,2490,2490,,2490,2490,2490,2490,2490
1101923,"삼성전자 키보드 키스킨(skg-2000pb,skg-2000uw,skg-3000ub호환)",1590,1590,,1590,1590,1590,1590,1590
3261936,삼지아이티 PISnet 블루키,23900,23900,,23900,23900,23900,23900,23900
16188614,상도아이앤티 ANYZONE ABT50 멀티페어링 블루투스 키보드 (블랙),17900,17900,,17900,17900,17900,17900,17900
16188632,상도아이앤티 ANYZONE ABT50 멀티페어링 블루투스 키보드 (화이트),16900,16900,,16900,16900,16900,16900,16900
9874485,상도아이앤티 ANYZONE ANK-300 숫자 키패드,7000,7000,,7000,7000,7000,7000,7000
17825426,상도아이앤티 ANYZONE ANY-K1 무선 키보드 마우스 세트,12800,12800,,12800,12800,12800,12800,12800
17685953,상도아이앤티 ANYZONE ANY-K2 키보드,4770,4770,,4770,4770,4770,4770,4770
17668715,상도아이앤티 ANYZONE ANY-K3 키보드 마우스 세트,5900,5900,,5900,5900,5900,5900,5900
94809722,상도아이앤티 ANYZONE ANY-K4 무선 (블랙),19900,19900,,19900,19900,19900,19900,19900
94809755,상도아이앤티 ANYZONE ANY-K4 무선 (화이트),19900,19900,,19000,19000,19900,19000,19900
94809809,상도아이앤티 ANYZONE ANY-K5 무선 (블랙그레이),16050,16050,,16050,16050,16050,16050,16050
94809833,상도아이앤티 ANYZONE ANY-K5 무선 (화이트그레이),16090,16090,,16090,16090,16090,16090,16090
98918957,상도아이앤티 ANYZONE ANY-K6 (베이지),21900,21900,,21900,21900,19900,21900,21900
98918936,상도아이앤티 ANYZONE ANY-K6 (블랙),21900,21900,,21900,21900,19900,21900,21900
122704972,상도아이앤티 ANYZONE ANY-K7 (다크그레이),32490,32490,,30800,30800,32490,30800,30800
122704979,상도아이앤티 ANYZONE ANY-K7 (블랙핑크),32900,32490,,30800,30800,32490,30800,30800
5950745,상도아이앤티 ANYZONE K-5300C PU,10710,10820,,10940,10950,11060,11090,10360
11125974,상도아이앤티 ANYZONE K-5300C UU,9800,9800,,9800,9800,9800,9800,9800
5950774,상도아이앤티 ANYZONE K-5500C,9800,9800,,9800,9800,9800,9800,9800
10436850,상도아이앤티 ANYZONE K-7000C UU 키보드 마우스 세트,11900,11900,,11900,11900,11900,11900,11900
5669363,상도아이앤티 ANYZONE K-7100C 키보드 마우스 세트,11790,11790,,11790,11790,11790,11790,11790
8093443,상도아이앤티 ANYZONE K400 유선 미니 키보드,6700,6700,,6700,6700,6700,6700,6700
8639216,상도아이앤티 ANYZONE K500 USB 미니 키보드,10660,10660,,10660,10660,10660,10660,10660
10063347,상도아이앤티 ANYZONE K700 초콜릿 키보드 (핑크),8000,8000,,8000,8000,8000,8000,8000
5950813,상도아이앤티 ANYZONE KM-5300U,7500,7500,,7500,7500,7500,7500,7500
5669114,상도아이앤티 ANYZONE KM-7000U 유선 키보드,7960,7960,,7960,7960,7960,7960,7960
16464989,상도아이앤티 ANYZONE T7 대나무 손목 받침대,11380,11380,,11380,11380,11380,11380,11380
16452572,상도아이앤티 ANYZONE T8 TKL 대나무 손목 받침대,9730,9730,,9730,9730,9730,9730,9730
7791040,상도아이앤티 ANYZONE WMK-300 무선 키보드 마우스 세트 (블랙),17760,17760,,17760,18140,18110,18110,17760
7791118,상도아이앤티 ANYZONE WMK-300 무선 키보드 마우스 세트 (화이트),17760,17760,,17760,18140,18110,18110,17760
11638076,샤이닝몰 COMSOME BXK-200 키보드 청소용도구 클리닝키트,2900,2900,,2900,2900,2900,2900,2900
94089074,샤이닝몰 컴썸 DK-500,18810,18810,,18810,18810,18810,18810,18810
13543949,샤이닝몰 컴썸 키보드 손목받침대,9800,9800,,9800,9800,9800,9800,9800
4054398,서진네트웍스 BK-5000S,7400,7400,,7400,7400,7400,7400,7400
4816588,서진네트웍스 BK-6000S,20714,20714,,20714,21160,21160,21160,20720
72004289,서진네트웍스 UNICORN BK-3000S 무선 키보드 마우스 세트,10900,10900,,10300,10400,10400,10400,10400
17651012,서진네트웍스 UNICORN BK-500SB 블루투스 키보드,17700,17700,,17700,17700,17700,17700,17700
17302934,서진네트웍스 UNICORN BK-8000S 무선 키보드 마우스 세트,13600,13600,,14200,10500,10500,13600,13600
40720274,서진네트웍스 UNICORN BK-800SB 블루투스,21900,21900,,20900,15400,20900,20900,15400
40720223,서진네트웍스 UNICORN BK-900SB 블루투스,20790,20790,,20790,20800,20800,19800,20790
96366224,서진네트웍스 UNICORN BK-950SB 무선 키보드 마우스 세트,33740,33740,,33740,33740,33740,33740,33740
12498533,"세컨드찬스 GEEKSTAR MKK 마블 카와이 어벤져스 무소음 무선 키보드 (블랙팬서, 블랙)",16900,16900,,16900,16900,16900,16900,16900
12498710,"세컨드찬스 GEEKSTAR MKK 마블 카와이 어벤져스 무소음 무선 키보드 (블랙팬서, 화이트)",16900,16900,,16900,16900,16900,16900,16900
74117378,스마일준 12지신,8950,8950,,8950,8950,8950,8950,8950
101012411,스마텍 STBK-4000 (블랙),9900,9900,,9900,9900,9900,9900,9900
101012417,스마텍 STBK-4000 (화이트),9900,9900,,9900,9900,9900,9900,9900
3635318,스카이디지탈 NKEYBOARD BAG 키보드 전용 가방,24900,24900,,24900,24900,24900,24900,24900
99051869,스카이디지탈 NKEYBOARD NK21 (갈축),39500,39500,,39500,39500,39500,39500,39500
102549983,스카이디지탈 NKEYBOARD NK21 (적축),39500,39500,,39500,39500,39500,39500,39500
67509251,스카이디지탈 NKEYBOARD NKEY 8K,47790,47790,,47790,,,,
97848377,스카이디지탈 NKEYBOARD NKEY 8K 중고,37600,37600,,37600,37600,37600,37600,37600
97854986,스카이디지탈 NKEYBOARD NKEY-1 (중고),26120,26200,,26320,26370,26440,26490,26560
28577327,스카이디지탈 WL320 전용,7350,7350,,7350,7350,7350,7350,7350
2009589,스카이디지탈 nkeyboard nkey 전용 실리콘 키스킨,3400,3400,,3400,3400,3400,3400,3400
96709670,스틸시리즈 Apex 3 TKL Aqua US,89900,89900,,89900,89900,89900,89900,79110
96709655,스틸시리즈 Apex 3 TKL Lavender US,89900,89900,,89900,89900,89900,89900,79110
80149382,스틸시리즈 Apex 3 TKL White US,85000,85000,,85000,85000,85000,79120,79110
67625105,스틸시리즈 Apex Pro Gen 3 US,358500,358500,,358500,359000,348500,359000,385390
78971555,스틸시리즈 Apex Pro Mini Gen 3 US,312550,312550,,312550,312550,312550,298500,299000
67625198,스틸시리즈 Apex Pro TKL Gen 3 KR,319000,318500,,318500,318500,308500,319000,329000
67625183,스틸시리즈 Apex Pro TKL Gen 3 US,215890,215890,,215890,215890,215170,215260,215380
78971435,스틸시리즈 Apex Pro TKL Gen 3 White KR,319000,318500,,318500,318500,308500,319000,329000
78971459,스틸시리즈 Apex Pro TKL Gen 3 White US,319000,318500,,318500,318500,308500,319000,329000
67625165,스틸시리즈 Apex Pro WL TKL Gen 3 US,445550,445550,,445550,445550,445550,445550,439000
93315740,스틸시리즈 아티산 월드 오브 워크래프트 에디션,126420,126420,,126420,126420,126420,126420,126420
94081673,스포트라이트 권투글러브 손목받침대,8510,8510,,8970,8970,8970,8970,8970
18398198,스포트라이트 나비매듭 손목보호 키보드 팜레스트 (36),8900,8900,,8900,8900,8900,8900,8900
18398189,스포트라이트 나비매듭 손목보호 키보드 팜레스트 (44),9900,9900,,9900,9900,9900,9900,9900
63853943,스포트라이트 댕댕이발바닥 시즌2 팜레스트 세트,23440,23440,,23440,23440,23440,23440,23440
17863778,스포트라이트 댕댕이발바닥 팜레스트 (38),12890,12890,,12890,12890,12890,12890,12630
91040051,스포트라이트 댕댕이발바닥 팜레스트 (46),13300,13300,,13300,13300,13300,13300,13300
91040216,스포트라이트 댕댕이발바닥 팜레스트 세트 (38),24000,24000,,24000,24000,24000,24000,24000
91040261,스포트라이트 댕댕이발바닥 팜레스트 세트 (46),24990,24990,,24990,24990,24990,24990,24990
96423302,스포트라이트 롤리팝 세트,22900,22900,,22900,22900,22900,22900,22900
94082015,스포트라이트 롤리팝 손목받침대,12900,12900,,12900,12900,12900,12900,12900
63871880,스포트라이트 스티치오피스 키보드 손목받침대,9660,9660,,9660,9660,9660,9660,9660
63873665,스포트라이트 스티치오피스 팜레스트 세트,19340,19340,,19340,19340,19340,19340,19340
92186087,스포트라이트 조약돌 세트 (노블화이트),21430,21430,,21430,21430,21430,21430,21430
92186084,스포트라이트 조약돌 세트 (로맨스블루),21430,21430,,21430,21430,21430,21430,21430
92186105,스포트라이트 조약돌 세트 (스트로베리핑크),21430,21430,,21430,21430,21430,21430,21430
92186093,스포트라이트 조약돌 세트 (올드로즈),21430,21430,,21430,21430,21430,21430,21430
92186099,스포트라이트 조약돌 세트 (울트라바이올렛),21430,21430,,21430,21430,21430,21430,21430
92186090,스포트라이트 조약돌 세트 (페블그레이),21430,21430,,21430,21430,21430,21430,21430
63845873,스포트라이트 캔디 컬렉션 팜레스트 세트,12590,12590,,12590,12590,12590,12590,12590
63847514,스포트라이트 캔디 컬렉션 플러스 팜레스트 세트,22320,22320,,22320,22320,22320,22320,21890
78782276,시이닷 네모진 키캡,72850,72850,,72850,72850,72850,72850,72850
78782129,시이닷 다이어리 키캡,79800,79800,,79800,79800,79800,79800,79800
78782258,시이닷 아바로떼스베 믹뜰란 키캡,68790,68790,,68790,68790,68790,68790,68790
78782264,시이닷 와글바글 키캡,75810,75810,,75810,75810,75810,75810,74210
78782351,시이닷 한국의 미 키캡 (교태전 단청),68830,68830,,68830,68830,68830,68830,68830
78782339,시이닷 한국의 미 키캡 (단청),72580,72580,,72580,72580,72580,72560,72560
78782306,시이닷 한국의 미 키캡 (모노 단청),68830,68830,,68830,68830,68830,68830,68830
78782324,시이닷 한국의 미 키캡 (화이트 단청),68830,68830,,68830,68830,68830,68830,68830
14075930,써멀테이크 WR1 키보드 손목받침대,19900,19900,,19900,19900,19900,19900,19900
98184707,쓰리윈즈 인터픽셀 IPK104 PRO 유무선 기계식 (저소음 솜사탕축),84710,84710,,84710,84710,84710,84710,84710
98184716,쓰리윈즈 인터픽셀 IPK104 PRO 유무선 기계식 (저소음 피치축),79000,84550,,79000,79000,79000,84550,79000
122694392,쓰리윈즈 인터픽셀 IPK301 무선,59000,59000,,59000,59000,59000,59000,59000
59927240,아이노트 아크릴 팜레스트 (미니),12300,12300,,12300,12300,12300,12300,12300
59927141,아이노트 아크릴 팜레스트 (텐키리스),12300,12300,,12300,12300,12300,12300,12300
59927036,아이노트 아크릴 팜레스트 (풀타입),13980,13980,,13980,13980,13980,13980,13980
72227390,아이리버 EQwear-ERGO WAVE EW3 무선 (블랙),49500,49500,,49500,49500,49500,49500,49500
72227378,아이리버 EQwear-ERGO WAVE EW3 무선 (화이트),49500,49500,,49500,49500,49500,49500,49500
6577900,아이리버 EQwear-K30 유선 키보드 (민트),17700,17700,,17700,17700,17700,17700,17700
6577891,아이리버 EQwear-K30 유선 키보드 (베이비핑크),17700,17700,,17700,17700,17700,17700,17700
6577873,아이리버 EQwear-K30 유선 키보드 (블랙),15500,15500,,15500,15500,15500,15500,15500
6577905,아이리버 EQwear-K30 유선 키보드 (블루),17700,17700,,17700,17700,17700,17700,17700
6577896,아이리버 EQwear-K30 유선 키보드 (퍼플),17700,17700,,17700,17700,17700,17700,17700
6577893,아이리버 EQwear-K30 유선 키보드 (핫핑크),17700,17700,,17700,17700,17700,17700,17700
6577888,아이리버 EQwear-K30 유선 키보드 (화이트),17700,17700,,17700,17700,17700,17700,17700
6680404,아이리버 EQwear-X30 무선 키보드 마우스 세트 (파스텔),19900,19900,,19900,19900,19900,19900,19900
6680398,아이리버 EQwear-X30 무선 키보드 마우스 세트 (핑크),19900,19900,,19900,19900,19900,19900,19900
4820136,아이리버 IR-K2000 (로즈골드),15990,15990,,15990,15990,15990,15990,15990
4820122,아이리버 IR-K2000 (블랙),15990,15990,,15990,15990,15990,15990,15990
4820131,아이리버 IR-K2000 (화이트),15990,15990,,15990,15990,15990,15990,15990
77317844,아이리버 IR-WMK5000 전용 키스킨,3000,3000,,3000,3000,3000,3000,3000
99916463,아이리버 K101 (블랙),14800,14800,,14800,14800,14800,14800,14800
99916472,아이리버 K101 (화이트),14800,14800,,14800,14800,14800,14800,14800
97778282,아이리버 K601U (블랙),24500,24500,,24500,24500,24500,24500,24500
97778294,아이리버 K601U (화이트),24500,24500,,24500,24500,24500,24500,24500
98919410,아이리버 KM101 키보드 마우스 세트 (블랙),19500,19500,,19500,19500,19500,19500,19500
98919428,아이리버 KM101 키보드 마우스 세트 (화이트),19500,19500,,19500,19500,19500,19500,19500
15452816,아이리버 MEDIC-BK5 항균 블루투스 키보드 (블랙),25120,25120,,25120,25120,25120,25120,29000
15453266,아이리버 MEDIC-BK5 항균 블루투스 키보드 (화이트),25900,25900,,24700,24700,24700,25900,25900
101072042,아이리버 MVS601 무선 키보드 마우스 세트 (라벤더),38490,38490,,36500,38500,36500,36500,36500
101072036,아이리버 MVS601 무선 키보드 마우스 세트 (블랙),38490,38490,,38490,38490,38490,38490,38490
101072048,아이리버 MVS601 무선 키보드 마우스 세트 (화이트),38490,38490,,36500,38500,38500,36500,36500
101630087,아이리버 MWK601 무선 (라벤더),28900,28900,,27400,28900,27400,27400,27400
101630081,아이리버 MWK601 무선 (블랙),28890,28890,,27400,27400,27400,27400,28890
101630090,아이리버 MWK601 무선 (화이트),28890,28890,,28890,28890,28890,28890,28890
15673292,아이리버 Medic-K1 항균 유선 저소음 키보드 (블랙),19700,19700,,19700,19700,19700,19700,19700
15673310,아이리버 Medic-K1 항균 유선 저소음 키보드 (핑크),19990,19990,,19990,19990,19990,19990,19990
15673301,아이리버 Medic-K1 항균 유선 저소음 키보드 (화이트),19700,19700,,19700,19700,19700,19700,19700
122653495,아이리버 WK101 무선 (블랙),18900,18900,,18900,18900,18900,18900,18900
122653496,아이리버 WK101 무선 (화이트),18900,18900,,18900,18900,18900,18900,18900
98771498,아이리버 WS101 무선 키보드 마우스 세트 (블랙),24890,24890,,23600,24900,23600,24900,24900
98771504,아이리버 WS101 무선 키보드 마우스 세트 (핑크),24890,24890,,24900,24900,24900,24900,24900
98771501,아이리버 WS101 무선 키보드 마우스 세트 (화이트),23430,23210,,23320,22270,23590,24890,23590
97778426,아이리버 WS301 무선 키보드 마우스 세트 (블랙),31900,31900,,31900,31900,31900,31900,31900
97778435,아이리버 WS301 무선 키보드 마우스 세트 (화이트),31900,31900,,31900,31900,31900,31900,31900
99053465,아이리버 WS301 전용 키스킨,4000,4000,,4000,4000,4000,4000,4000
122653891,아이몰 Z15 무선 (블랙),27450,27450,,27450,27450,27450,27450,27450
122653885,아이몰 Z15 무선 (화이트),27450,27450,,27450,27450,27450,27450,27450
4875087,아이온코리아 BOSSWIZ BK-7000,18000,18000,,18000,18000,18000,18000,18000
16798244,아이온코리아 BOSSWIZ BOK-31B 블루투스 키보드 (블랙),22500,22500,,22500,22500,22500,22500,22500
16822562,아이온코리아 BOSSWIZ BOK-31B 블루투스 키보드 (실버),19500,19500,,19500,19500,19500,19500,19500
4841620,아이온코리아 BOSSWIZ K80 (블랙),15000,15000,,15000,15000,15000,15000,15000
4841627,아이온코리아 BOSSWIZ K80 (화이트),15000,15000,,15000,15000,15000,15000,15000
3899883,아이온코리아 BOSSWIZ K9 LED 게이밍 키보드,15900,15900,,15900,15890,15890,15890,15890
8179873,아이온코리아 PLANTIUM K303,15100,15100,,15100,15100,15100,15100,15100
3999621,아이온코리아 비트아이티뮤즈 BT1000 (블랙),13190,13190,,13190,13190,13190,13190,13190
3999624,아이온코리아 비트아이티뮤즈 BT1000 (화이트),13200,13200,,13200,13200,13200,13200,13200
15222866,아이존아이앤디 EZ BTK-50 블루투스 키보드 (실버),19840,19840,,19840,19840,19840,19840,19840
18678191,아이존아이앤디 EZ WP-30,6030,6030,,6030,6030,6030,6030,6080
56141648,아이친구 블루투스,9700,9700,,9700,9700,9700,9700,9700
56141669,아이친구 블루투스 키보드 마우스 세트,18800,18800,,18800,18800,18800,18800,18800
28187525,아이콘스 카카오프렌즈 KFW-100 (죠르디),12900,12900,,24800,24800,24800,24800,24800
28187555,아이콘스 카카오프렌즈 KFW-100 (춘식이),24790,24790,,24790,24790,24800,24800,24800
75989741,아이콘스 카카오프렌즈 춘식이 키보드 쿠션,8930,8930,,8930,8930,8930,8930,8930
29398226,아이퀸 고급형 메모리폼 손목 받침대 세트,11900,11900,,11900,11900,11900,11900,11900
28826780,아이퀸 키보드 마우스 손목 쿠션 세트,10900,10900,,10900,10900,10900,10900,10900
92103815,아이피엑스 카카오프렌즈 KFK-001 무선,22000,22000,,20000,20000,13000,13000,13000
99554528,아즈라 E ZERO OCTOPUS 8K HE (블랙),219000,219000,,219000,219000,219000,219000,219000
72719108,아지오 캐스케이드 슬림 포인트 키캡,49000,49000,,49000,49000,49000,49000,49000
93068552,아카코 구름구름 팜레스트,7280,7280,,8720,8720,8720,8720,8720
2233596,아티스 CS101 키보드 스티커,2730,2730,,2730,2730,2730,2730,2730
15303485,알텍랜싱 ALBC6214 유선 버티컬 키보드 마우스 세트,12400,12400,,12400,12400,12400,12400,12400
15356312,"알텍랜싱 ALBC6314 무선 키보드 마우스 세트 (민트, 키스킨 미포함)",13800,13800,,13800,13800,13800,13800,13800
15356318,"알텍랜싱 ALBC6314 무선 키보드 마우스 세트 (핑크, 키스킨 미포함)",13800,13800,,13800,13800,13800,13800,13800
15327230,"알텍랜싱 ALBK6314 무선 키보드 (민트, 키스킨포함)",10100,10100,,10100,10100,10100,10100,10100
15327206,"알텍랜싱 ALBK6314 무선 키보드 (블랙, 키스킨포함)",26650,26650,,10800,10800,10800,10800,10800
15327239,"알텍랜싱 ALBK6314 무선 키보드 (핑크, 키스킨포함)",10500,10500,,10500,10500,10500,10500,10500
15327221,"알텍랜싱 ALBK6314 무선 키보드 (화이트, 키스킨포함)",10800,10800,,10800,10800,10800,10800,10800
17203619,알텍랜싱 ALBK6331,7630,7630,,7630,7630,7630,7630,7630
10577571,알파스캔 AOC GK500 게이밍 RGB LED 기계식,27900,27900,,27900,27900,27900,27900,27900
119686265,애니젠 K-7100C,15090,15090,,15090,15090,15090,15090,14770
92679164,애니클리어 PDB-KWR02 받침대 팜레스트 세트,16900,16900,,16900,16900,16900,16900,16830
62647007,액티브키 AK-C8100,142000,142000,,142000,142000,142000,142000,142000
95850980,앱코 A108K 3모드 퀵스압 유무선 기계식 마일드 블루 (맘모스축),69900,69900,,69900,69900,69900,69900,69900
95851013,앱코 A108K 3모드 퀵스압 유무선 기계식 마일드 블루 (벚꽃축),73530,73530,,73530,73530,73530,73530,73530
102355322,앱코 A108K 3모드 퀵스압 유무선 기계식 말차그린 (맘모스축),69900,69900,,69900,69900,69900,69900,69900
102355325,앱코 A108K 3모드 퀵스압 유무선 기계식 말차그린 (벚꽃축),73530,73530,,73530,73530,73530,73530,73530
102355316,앱코 A108K 3모드 퀵스압 유무선 기계식 피오니 (맘모스축),68970,68970,,68970,68970,68970,68970,68970
102355319,앱코 A108K 3모드 퀵스압 유무선 기계식 피오니 (벚꽃축),74900,74900,,74900,74900,74900,74900,74900
95850770,앱코 A87K 3모드 퀵스압 유무선 기계식 (맘모스축),78960,79080,,79310,79440,79450,79540,79660
95850806,앱코 A87K 3모드 퀵스압 유무선 기계식 (벚꽃축),68900,68900,,68900,68900,68900,59940,59940
103690748,앱코 ACH105 오피스워커 유무선 기계식 라벤더 (벚꽃축),89000,89000,,89000,89000,89000,89000,89000
103690739,앱코 ACH105 오피스워커 유무선 기계식 라벤더 (저소음 바다소금축),79000,79000,,79000,79000,79000,79000,79000
103690742,앱코 ACH105 오피스워커 유무선 기계식 라벤더 (저소음 택타일 바다소금축),79000,79000,,79000,79000,79000,79000,79000
122645090,앱코 ACH105 오피스워커 유무선 기계식 블랙 (벚꽃축),89000,89000,,89000,89000,89000,89000,89000
122645087,앱코 ACH105 오피스워커 유무선 기계식 블랙 (저소음 바다소금축),79000,79000,,79000,79000,79000,79000,79000
122645088,앱코 ACH105 오피스워커 유무선 기계식 블랙 (저소음 택타일 바다소금축),79000,79000,,79000,79000,79000,79000,79000
103690751,앱코 ACH105 오피스워커 유무선 기계식 앨리스블루 (벚꽃축),89000,89000,,89000,89000,89000,89000,89000
103690760,앱코 ACH105 오피스워커 유무선 기계식 앨리스블루 (저소음 바다소금축),79000,79000,,79000,79000,79000,79000,79000
