product_code,product_name,2026-07-19,2026-07-18,2026-07-17,2026-07-16,2026-07-15,2026-07-14,2026-07-13,2026-07-12
92357459,1stPlayer NEO87 유무선 기계식 (나이트 퍼플),141920,141920,,141920,141920,141920,141920,141920
92357306,1stPlayer NEO87 유무선 기계식 (레트로),68000,68000,,68000,68000,68000,68000,68000
92357558,1stPlayer NEO87 유무선 기계식 (스텔라),93000,99000,,93000,96000,99000,93000,99000
92357399,1stPlayer NEO87 유무선 기계식 (크림 버건디),75000,75000,,75000,75000,75000,75000,75000
10891317,3M K50 USB 유선 키보드 (블랙),23430,23430,,23430,23430,23430,23430,23430
10890852,3M MK-150 무선 키보드 마우스 세트 (블랙),23090,23100,,24090,24090,22900,24090,24090
10890867,3M MK-150 무선 키보드 마우스 세트 (화이트),23090,23100,,24090,24090,22900,24090,24090
10890924,3M MK-250 무선 키보드 마우스 세트 (블랙),27900,27900,,27900,27900,27900,27900,27900
10890990,3M MK-250 무선 키보드 마우스 세트 (핑크),27900,27900,,27900,27900,27900,27900,27900
10890978,3M MK-250 무선 키보드 마우스 세트 (화이트),27900,27900,,27900,27900,27900,27900,27900
28123457,3M WR309LE 손목받침대,11630,11630,,11990,11990,11990,11990,11990
92187749,3M WR85B,11050,11050,,11900,11900,11900,11900,11900
77313287,80Retros GAME1989 기계식 커스텀 베어본,319000,319000,,319000,319000,319000,319000,319000
92045849,80Retros GB PAD 유무선,199000,199000,,199000,199000,199000,199000,199000
99054602,80Retros GB40 레트로 유무선,199000,199000,,199000,199000,199000,199000,199000
77312324,80Retros GB65 기계식,298000,298000,,298000,298000,298000,298000,298000
122696026,80Retros GB65 기계식 커스텀 베어본,249000,249000,,249000,249000,249000,249000,249000
97357376,8bitdo Retro 108 유무선 기계식 F 에디션,159000,159000,,159000,159000,159000,159000,159000
88137002,8bitdo Retro 108 유무선 기계식 N 에디션,159000,159000,,159000,159000,159000,159000,159000
97357643,8bitdo Retro 유무선 기계식 C64 에디션,139500,139500,,139500,139500,139500,139500,139500
69697262,8bitdo Retro 유무선 기계식 F에디션,129000,129000,,129000,129000,129000,119000,119000
97357601,8bitdo Retro 유무선 기계식 M 에디션,129000,129000,,129000,129000,129000,129000,129000
96369803,8bitdo Retro 유무선 기계식 Mecha BREAK: PANTHER 에디션 (해외구매),118200,118200,,118200,118200,118200,118200,118200
97357574,8bitdo Retro 유무선 기계식 N 에디션,129000,129000,,129000,129000,129000,129000,129000
74253509,8bitdo Retro 유무선 기계식 Xbox 에디션 (해외구매),103640,103640,,103640,103640,103640,103640,103640
97955285,8bitdo Retro 유무선 기계식 중고,111200,111200,,111200,111200,111200,111200,111200
93702140,8bitdo Retro18 유무선 기계식 C64 에디션,59000,59000,,59000,59000,59000,59000,59000
64984271,8bitdo Retro18 유무선 기계식 C64 에디션 (해외구매),32500,32500,,32500,32500,32500,32500,32500
68437127,8bitdo Retro18 유무선 기계식 F 에디션,59000,59000,,59000,59000,59000,59000,59000
65006120,8bitdo Retro18 유무선 기계식 F 에디션 (해외구매),32500,32500,,32500,32500,32500,32500,32500
97357745,8bitdo Retro18 유무선 기계식 M 에디션,59000,59000,,59000,59000,59000,59000,59000
65011625,8bitdo Retro18 유무선 기계식 M 에디션 (해외구매),32500,32500,,32500,32500,32500,32500,32500
97357757,8bitdo Retro18 유무선 기계식 N 에디션,59000,59000,,59000,59000,59000,59000,59000
64992551,8bitdo Retro18 유무선 기계식 N 에디션 (해외구매),32500,32500,,32500,32500,32500,32500,32500
98228084,8bitdo 손목받침대 (해외구매),16890,16890,,16890,16890,16890,16890,16890
94445426,A4Tech Bloody AT87,109500,109500,,109500,109500,109500,109500,109500
103751768,AJAZZ AJ-AK01,59000,59000,,59000,59000,59000,59000,59000
104624438,AJAZZ AJ-WK01 유무선 기계식,69000,69000,,69000,69000,69000,69000,69000
69698447,AJAZZ AK650 유무선 기계식 (해외구매),60870,60870,,60870,60870,60870,60870,60870
89525834,AJAZZ AK680 MAX 1K (해외구매),32020,32020,,32020,32020,32020,32020,32020
89525861,AJAZZ AK680 MAX 8K (해외구매),53280,53280,,53280,53280,53280,53280,53280
89525954,AJAZZ AK680 MAX 유무선 (해외구매),41760,41760,,41760,41760,41760,41760,41760
74338652,AJAZZ ALUX68 (해외구매),30266,30266,,30266,30266,30266,30266,32544
74338691,AJAZZ ALUX68 MAX (해외구매),65060,65060,,65060,65060,65060,65060,65060
74338664,AJAZZ ALUX68 PLUS (해외구매),50860,50860,,50860,50860,50860,50860,50860
27498209,AJAZZ 후아노 과일 복숭아 스위치 45pcs,21360,21360,,21360,21360,21360,21360,21360
71720309,AKKO Bun Wonderland 식빵 키캡 세트 138Pcs,34900,34900,,34900,34900,34900,34900,34900
106692857,AKKO MONSGEEK FUN60 MAX 무선 (블랙),74880,74640,,74880,74880,74660,74760,74880
106728227,AKKO MONSGEEK FUN60 MAX 무선 (화이트),84460,84460,,84460,84270,84270,84270,82680
76462553,AKKO MONSGEEK FUN60 MAX 유무선 해외구매,37500,37500,,37500,37500,37500,37500,37500
98075972,AKKO MONSGEEK FUN60 PRO (블랙),36000,36000,,36000,36000,36000,36000,36000
76462475,AKKO MONSGEEK FUN60 PRO (해외구매),23080,23080,,23080,23080,23080,23080,23080
106728182,AKKO MONSGEEK FUN60 PRO (화이트),36000,36000,,36000,36000,36000,36000,36000
76462496,AKKO MONSGEEK FUN60 PRO 유무선 (해외구매),28500,28500,,28500,28500,28500,28500,28500
106692875,AKKO MONSGEEK FUN60 ULTRA 유무선,158320,158320,,158550,158560,158560,158680,158800
76462856,AKKO MONSGEEK FUN60 ULTRA 유무선 해외구매,57230,57230,,57230,57230,57230,53500,53500
76462850,AKKO MONSGEEK FUN60 ULTRA 해외구매,47900,47900,,47900,47900,47900,47900,47900
76462442,AKKO MONSGEEK FUN60 유무선 (해외구매),17900,17900,,17900,17900,17900,17900,17900
98924099,AKKO MONSGEEK M2 기계식 커스텀 베어본 (해외구매),117700,117700,,117700,117700,117700,117700,117700
78710582,AKKO 드래곤볼 PBT 키캡 108키 (베지터),34900,34900,,34900,34900,34900,34900,34900
78710570,AKKO 드래곤볼 PBT 키캡 108키 (손오공),34900,34900,,34900,34900,34900,34900,34900
77965277,AKKO 몬스긱 가위바위보 엄지척 키캡,6000,6000,,6000,6000,6000,6000,6000
27497321,AKKO 오션블루 스위치 45pcs,17500,17500,,17500,17500,17500,17500,17500
27497132,AKKO 젤리블랙 스위치 45pcs,19080,19080,,19080,19080,19080,19080,19080
27497171,AKKO 젤리블루 스위치 45pcs,19080,19080,,19080,19080,19080,19080,19080
106709105,AKKO 크리스마스 판타지 키캡 137키,49800,49800,,49800,49800,49800,49800,49800
27497477,AKKO 크림블루프로 스위치 45pcs,14450,14450,,14450,14450,14450,14450,14450
27497438,AKKO 크림옐로우프로 스위치 45pcs,14400,14400,,14400,14400,14400,14400,14400
27497519,AKKO 폼 브라운 스위치 45pcs,21360,21360,,21360,21360,21360,21360,21360
27496946,AKKO 피아노 스위치 45pcs,17660,17660,,17660,17660,17660,17660,17660
19427495,ANYZEN A10 키보드 마우스 세트,16500,16500,,16500,16500,16500,16500,16500
19427849,ANYZEN A10 키보드 마우스 세트 with Pad,17500,17500,,17500,17500,17500,17500,17500
19304882,ANYZEN A30 키보드 마우스 세트,21180,21180,,21180,21180,21180,21180,21180
19427909,ANYZEN A30 키보드 마우스 세트 with Pad,20130,20130,,20130,20130,20130,20130,20130
19636859,ANYZEN A50 키보드 버티컬 마우스 세트,14830,14830,,14830,14830,14830,14830,14830
19636880,ANYZEN A50 키보드 버티컬 마우스 세트 with Pad,15890,15890,,15890,15890,15890,15890,15890
19689695,ANYZEN A60 키보드 버티컬 마우스 세트,17000,17000,,17000,17000,17000,17000,17000
19689749,ANYZEN A60 키보드 버티컬 마우스 세트 with Pad,17890,17890,,17890,17890,17890,17890,17890
19533839,ANYZEN A70 키보드 버티컬 마우스 세트,17290,17290,,17290,17290,17290,17290,17390
19533893,ANYZEN A70 키보드 버티컬 마우스 세트 with Pad,19070,19070,,19070,19070,19070,19070,19070
14040011,ANYZEN AMK-250 키보드 마우스 세트,13000,13000,,13000,13000,13000,13000,13000
6383542,ANYZEN AMK-250 키보드 마우스 세트 with PAD,18000,18000,,18000,18000,18000,18000,18000
10333785,ANYZEN AMK-350 세트 with PAD,23290,23290,,23290,23290,23290,23290,23290
29480837,ANYZEN AMK-350 키보드 마우스 세트,22230,22230,,22230,22230,22230,22230,22230
104044268,ANYZEN BTK-100 무선,21180,21180,,21180,21180,21180,21180,21180
105964952,ANYZEN BTK-300 무선,9890,9890,,9890,9890,9890,9890,9890
18661733,ANYZEN K-2000P,10060,10060,,10060,10060,10060,10060,10060
1664508,ANYZEN K-5300C,15680,15680,,15680,15680,15680,15680,15680
18661751,ANYZEN K-7000C 키보드 마우스 세트,14140,14140,,14140,14140,14140,14140,14140
4698428,ANYZEN K100U 유선키보드,10350,10350,,10350,10350,10350,10350,10350
15943325,ANYZEN K110 유선키보드,7200,7200,,7200,7200,7200,7200,7200
7989883,ANYZEN K130 USB 유선 키보드,12470,12470,,12470,12470,12470,12470,12470
4698449,ANYZEN K200 미니키보드,9150,9150,,9150,10590,10590,10590,10590
105964946,ANYZEN K200C,19000,19000,,19000,19000,19000,19000,19000
29343362,ANYZEN K250 (블랙),12600,12600,,12610,12600,12600,12600,12600
91563872,ANYZEN K250 (화이트),17600,17600,,17600,17600,17600,17600,17600
29489273,ANYZEN K250 With Pad (블랙),14970,14970,,14970,14970,14970,14970,14970
91563446,ANYZEN K250 With Pad (화이트),19600,19600,,19600,19600,19600,19600,19600
29974481,ANYZEN K260 (블랙),10000,10000,,10000,10000,10000,10000,10000
92356889,ANYZEN K260 (화이트),18490,18490,,18490,18490,18490,18490,18490
29974493,ANYZEN K260 With Pad (블랙),11500,11500,,11500,11500,11500,11500,11500
92356919,ANYZEN K260 With Pad (화이트),19490,19490,,19490,19490,19490,19490,19490
29937023,ANYZEN K270 (블랙),10720,10720,,10720,10720,10720,10720,10720
92625845,ANYZEN K270 (화이트),12300,12300,,12300,12300,12300,12300,12300
29937206,ANYZEN K270 With Pad (블랙),11730,11730,,11730,11730,11730,11730,11730
92625881,ANYZEN K270 With Pad (화이트),15800,15800,,15800,15800,15800,15800,15800
122633057,ANYZEN K300,12710,12710,,13100,13100,13100,13100,13100
105967592,ANYZEN K300C,9900,9900,,9900,9900,10000,9900,9900
4576905,ANYZEN K400 유선 미니키보드,7500,7500,,7500,7500,7500,7500,7500
13083755,ANYZEN KM2200 유선 키보드 마우스 세트,11290,11290,,11290,11290,11290,11290,11290
62641859,ANYZEN KM3000 With Pad 키보드 마우스 세트,19000,19000,,19000,19000,19000,19000,19000
62641841,ANYZEN KM3000 키보드 마우스 세트,18500,18500,,18500,18500,18500,18500,18500
62794472,ANYZEN KM4000 키보드 마우스 세트,32550,32550,,32550,32550,32550,32550,32550
5645544,ANYZEN MK-100 USB 유선 세트,10590,10590,,10590,10590,10590,10590,10590
4698525,ANYZEN MK-100 유선 세트,7800,7800,,7800,7800,7800,7800,7800
10333404,ANYZEN MK100 PU 세트 with PAD,19000,19000,,19000,19000,19000,19000,19000
10333371,ANYZEN MK100 USB 세트 with PAD,12710,12710,,12710,12710,12710,12710,12710
15943442,ANYZEN MK110 유선 키보드 마우스 세트,7340,7340,,7340,7340,7340,7340,7340
15943481,ANYZEN MK110 유선 키보드 마우스 세트 with Pad,8310,8310,,8310,8310,8310,8310,8310
8119210,ANYZEN MK130 USB 세트 with PAD,17690,17690,,17690,17690,17690,17690,17690
7991620,ANYZEN MK130 USB 키보드 마우스 세트,12500,12500,,12500,12500,12500,12500,12500
7990516,ANYZEN MK170 PU 키보드 마우스 세트,15700,15700,,15700,15700,15700,15700,15700
10639314,ANYZEN MK200 유선 키보드 마우스 세트 (민트),11650,11650,,11650,11650,11650,11650,11650
10639275,ANYZEN MK200 유선 키보드 마우스 세트 (블랙),11650,11650,,11650,11650,11650,11650,11650
10639323,ANYZEN MK200 유선 키보드 마우스 세트 (핑크),11650,11650,,11650,11650,11650,11650,11650
61418018,ANYZEN MK310 With Pad 키보드 마우스 세트,24900,24900,,24900,24900,24900,24900,24900
61418027,ANYZEN MK310 키보드 마우스 세트,9500,9500,,9500,9500,9500,9500,9500
58096739,ANYZEN PKC-K1 With Pad 키보드 마우스 세트,24900,24900,,24900,24900,24900,24900,24900
57919337,ANYZEN PKC-K1 키보드 마우스 세트,24900,24900,,24900,24900,24900,24900,24900
58113584,ANYZEN PKC-K20 with pad 키보드 마우스 세트,26250,26250,,26250,26250,26250,26250,26250
58113449,ANYZEN PKC-K20 키보드 마우스 세트,26250,26250,,26250,26250,26250,26250,26250
60307940,ANYZEN PKC-K30 With Pad 키보드 마우스 세트,12500,12500,,12500,12500,12500,12500,12500
60307937,ANYZEN PKC-K30 키보드 마우스 세트,9900,9900,,9900,9900,9900,9900,9900
93498056,APAYADO DK68 유무선 기계식 (해외구매),41200,41200,,41200,41200,41200,41200,41200
93442217,APAYADO K3 기계식 (해외구매),17230,17230,,17230,17230,17230,17230,17230
74005943,APAYADO K33 (해외구매),20890,20890,,20890,20890,20890,20890,20890
93442091,APAYADO K61 기계식 (해외구매),22740,22740,,22740,22740,22740,22740,22740
93442460,APAYADO K82 기계식 (해외구매),30410,30410,,30410,30410,30410,30410,30410
93498188,APAYADO KL97 기계식 (해외구매),29040,29040,,29040,29040,29040,29040,29040
93441515,APAYADO M70 (해외구매),16440,16440,,16440,16440,16440,16440,17490
93442601,APAYADO T023 (해외구매),15100,15100,,15100,15100,15100,15100,15100
93441725,APAYADO T21 기계식 (해외구매),23220,23190,,23200,23210,23210,23220,23220
90437783,APPLE MXCJ3KH/A 유무선,157170,157170,,157170,157170,157170,157170,157170
90437708,APPLE MXCK3CJ/A 유무선,199000,199000,,199000,199000,199000,199000,199000
90115004,APPLE MXCK3KE/A 영어 유무선,199000,199000,,199000,199000,199000,199000,199000
74484314,APPLE MXCK3KH/A 유무선,185070,185070,,185070,185070,185070,185070,185070
74053196,APPLE MXCL3KE/A 유무선,129270,129270,,129270,129270,129270,129270,129270
72592274,APPLE MXCL3KH/A 유무선,129270,129270,,129270,129270,129270,129270,129270
74053328,APPLE MXK73CJ/A 유무선,249000,249000,,249000,249000,249000,249000,249000
74053301,APPLE MXK73KE/A 유무선,249000,249000,,249000,249000,249000,249000,249000
72592202,APPLE MXK73KH/A 유무선,229000,229000,,229000,229000,229000,229000,229000
74053460,APPLE MXK83KC/A 유무선,279000,279000,,279000,279000,279000,279000,279000
74053472,APPLE MXK83KH/A 유무선,249000,249000,,249000,249000,249000,249000,249000
73948085,ASUS Marshmallow KW100 무선,59990,61800,,61820,61820,61820,61820,56470
92888570,ASUS ROG AZOTH X 유무선 기계식 (SNOW축),299000,299000,,298000,298000,298000,298000,299000
92888585,ASUS ROG AZOTH X 유무선 기계식 (STORM축),298000,298000,,298000,299000,299000,299000,299000
97836170,ASUS ROG FALCATA 유무선,449100,449100,,449100,449100,449100,449100,449100
101953184,ASUS ROG FALCHION ACE HFX ZywOo 에디션,237650,237770,,238010,238130,238250,238350,238470
70103147,ASUS ROG FALCHION ACE HFX 기계식 (마그네틱축),179100,179100,,179100,179100,179100,179100,179100
122652068,ASUS ROG Falchion Ace 75 HE 블랙 (V2축),298990,298990,,298990,298990,298990,292930,292940
122652085,ASUS ROG Falchion Ace 75 HE 화이트 (V2X축),299000,299000,,299000,299000,299000,299000,299000
122652051,ASUS ROG Falchion Ace 75 HE 화이트 (V2축),298990,298990,,298990,298990,298990,292930,292940
13417076,ASUS ROG PBT KEYCAP SET,25640,25640,,25640,25640,25640,25630,25630
17017928,ASUS ROG RX PBT 이중사출 키캡 세트,25900,25900,,,,,,
92546342,ASUS ROG STRIX SCOPE II X 기계식 (STORM축),159000,159000,,159000,159000,159000,159000,159000
122718970,ASUS ROG 에이조스 익스트림 20주년 리미티드 에디션,949000,949000,,949000,949000,949000,,
73947686,ASUS TUF Gaming K1 (해외구매),70470,70570,,65370,65370,63990,63990,64540
95847023,ATK 68 RX (해외구매),84370,84370,,84370,84370,84370,84370,85440
99290588,ATK 68 V3 (해외구매),207160,207160,,159640,159640,159640,159640,159640
99288383,ATK QK Hex80 (해외구매),272540,272540,,272540,272540,272540,272540,272540
78611390,ATK RS6 (해외구매),123210,123210,,123210,123210,123210,123210,123210
122663187,ATK RS6 Air (레이크 그린),89000,89000,,89000,89000,89000,89000,89000
122663174,ATK RS6 Air (블랙),89000,89000,,89000,89000,89000,89000,89000
122663183,ATK RS6 Air (핑크),89000,89000,,89000,89000,89000,89000,89000
122663179,ATK RS6 Air (화이트),89000,89000,,89000,89000,89000,89000,89000
100192586,ATK RS6 Air 해외구매,78700,78700,,78700,78700,78700,78700,78710
78611399,ATK RS6 ULTRA (해외구매),140210,140210,,140210,140210,140210,140210,140210
122663220,ATK RS7 Air (레이크 그린),98000,98000,,97800,98000,98000,98000,98000
122663211,ATK RS7 Air (블랙),98000,98000,,97800,98000,98000,98000,98000
122663222,ATK RS7 Air (오렌지),98000,98000,,97800,98000,98000,98000,98000
122663217,ATK RS7 Air (핑크),98000,98000,,97800,98000,98000,98000,98000
122663215,ATK RS7 Air (화이트),98000,98000,,97800,98000,98000,98000,98000
107770715,ATK RS7 Air 해외구매,92730,92730,,92730,92730,92730,92730,92730
99290138,ATK RS7 V2 (해외구매),181090,181090,,181090,181090,181090,181090,181090
99290141,ATK RS7 V2 Ultra (해외구매),199000,199000,,199000,199000,199000,199000,200640
122619005,ATK Yogo 75 Pro 유무선 기계식 블랙 (저소음 딥씨축),198000,198000,,198000,198000,198000,198000,198000
122710686,ATK Yogo 75 Pro 유무선 기계식 블랙 (중고),168300,168300,,168300,168300,168300,168300,168300
122619007,ATK Yogo 75 Pro 유무선 기계식 실버 화이트 (저소음 딥씨축),198000,198000,,198000,198000,198000,198000,198000
122710687,ATK Yogo 75 Pro 유무선 기계식 실버 화이트 (중고),168300,168300,,168300,168300,168300,168300,168300
109596182,ATK Yogo 75 유무선 기계식 블랙 (저소음 딥씨축),189000,189000,,189000,189000,189000,189000,189000
122710695,ATK Yogo 75 유무선 기계식 블랙 (중고),152150,152150,,152150,152150,152150,152150,152150
109596194,ATK Yogo 75 유무선 기계식 실버 화이트 (저소음 딥씨축),189000,189000,,189000,189000,189000,189000,189000
122710696,ATK Yogo 75 유무선 기계식 실버 화이트 (중고),152150,160650,,152150,152150,152150,152150,152150
109596191,ATK Yogo 75 유무선 기계식 실버 화이트 (클라우드축),179000,179000,,179000,179000,179000,179000,179000
109596197,ATK Yogo 75 유무선 기계식 크림 옐로우 (저소음 딥씨축),198000,198000,,198000,198000,198000,198000,198000
122710697,ATK Yogo 75 유무선 기계식 크림 옐로우 (중고),160650,160650,,160650,160650,160650,160650,160650
109596203,ATK Yogo 75 유무선 기계식 크림 옐로우 (클라우드축),189000,189000,,189000,189000,189000,189000,189000
74056931,ATTACK SHARK K85 (해외구매),61780,61780,,61780,61780,61780,61780,61780
74481521,ATTACK SHARK M87 유무선 기계식 (해외구매),78270,78270,,78270,78270,78270,78270,78270
98227460,ATTACK SHARK R82 HE (해외구매),27900,27900,,27900,27900,27900,27900,27900
106763501,ATTACK SHARK X68HE,90000,90000,,90000,90000,90000,90000,90000
73891343,ATTACK SHARK X75 유무선 기계식 (해외구매),89080,89080,,89080,89080,89080,89080,89080
98226989,ATTACK SHARK X820 ULTRA 유무선 기계식 (해외구매),58900,58900,,58900,58900,58900,58900,58900
90435968,ATTACK SHARK X85 PRO 유무선 기계식 (해외구매),29500,29500,,29500,29500,29500,29500,29500
74056700,ATTACK SHARK X87 유무선 기계식 (해외구매),70560,70560,,70560,70560,70560,70560,70560
62650448,AULA AC210 무선 키보드 마우스 세트 (해외구매),44400,44400,,44400,44400,44400,44400,44400
96366869,AULA AG60 (해외구매),106340,106350,,106360,106360,106360,106360,106360
96366890,AULA AG60 Max (해외구매),227400,227400,,227400,227400,227400,227400,227400
96366875,AULA AG60 Pro (해외구매),126390,126390,,126390,126390,126390,126390,126390
122703899,AULA AG63 (해외구매),132500,132500,,132500,132500,132500,132500,132500
72983492,AULA AU75 유무선 기계식,89000,89000,,89000,89000,89000,89000,89000
68780987,AULA EPOMAKER x F65 유무선 기계식 (해외구매),111200,111200,,91540,91540,91540,91540,91540
94026458,AULA F108 PRO 유무선 기계식 오로라 블랙 한글 (경해축),99000,99000,,99000,99000,99000,99000,99000
94026449,AULA F108 PRO 유무선 기계식 오로라 블랙 한글 (세이야축),85000,85000,,85000,85000,85000,85000,85000
94026440,AULA F108 PRO 유무선 기계식 오로라 블랙 한글 (저소음 바다축),89000,89000,,89000,89000,89000,89000,89000
94026455,AULA F108 PRO 유무선 기계식 오로라 블랙 한글 (저소음 솜사탕축),89000,89000,,89000,89000,89000,89000,89000
97310108,AULA F108 PRO 유무선 기계식 오로라 블랙 한글 (중고),71200,71200,,75650,71200,71200,75650,73950
94026473,AULA F108 PRO 유무선 기계식 치즈 화이트 한글 (경해축),99000,99000,,99000,99000,99000,99000,99000
94026470,AULA F108 PRO 유무선 기계식 치즈 화이트 한글 (세이야축),85000,85000,,85000,85000,85000,85000,85000
94026476,AULA F108 PRO 유무선 기계식 치즈 화이트 한글 (저소음 바다축),89000,89000,,89000,89000,89000,89000,89000
94026467,AULA F108 PRO 유무선 기계식 치즈 화이트 한글 (저소음 솜사탕축),89000,89000,,89000,89000,89000,89000,89000
97310120,AULA F108 PRO 유무선 기계식 치즈 화이트 한글 (중고),71200,71200,,71200,71200,73950,73950,68000
74006669,AULA F108 PRO 유무선 기계식 해외구매 (옵션선택구성),57330,57330,,57330,57330,57330,57330,57330
76331336,AULA F108 PRO 유무선 기계식 해외구매 (청우축),55760,55760,,55760,55760,55760,55760,55760
76331351,AULA F108 PRO 유무선 기계식 해외구매 (카라멜라떼축),55760,55760,,55760,55760,55760,55760,55760
76331342,AULA F108 PRO 유무선 기계식 해외구매 (풍령축),42900,42900,,42900,42900,42900,42900,42900
122692022,AULA F108 PRO 유무선 기계식 화이트 한글 (저소음 로즈축),99800,99800,,99800,99800,99800,99800,99800
122722777,AULA F108 Pro V2 유무선 기계식 모던 블랙 (세이야축),89000,89000,,89000,89000,89000,79000,79000
122722776,AULA F108 Pro V2 유무선 기계식 모던 블랙 (유성축),94000,94000,,84000,84000,84000,84000,84000
122722772,AULA F108 Pro V2 유무선 기계식 모던 블랙 (저소음 바다축),94000,94000,,94000,94000,94000,84000,84000
122722787,AULA F108 Pro V2 유무선 기계식 샌드 베이지 (세이야축),89000,89000,,89000,89000,89000,79000,79000
122722785,AULA F108 Pro V2 유무선 기계식 샌드 베이지 (유성축),94000,94000,,84000,84000,84000,84000,84000
122722782,AULA F108 Pro V2 유무선 기계식 샌드 베이지 (저소음 바다축),124720,124720,,124720,94000,94000,84000,84000
108423053,AULA F108 기계식 라이트 그레이 (세이야축),59000,59000,,59000,59000,59000,59000,59000
108423050,AULA F108 기계식 라이트 그레이 (저소음 바다축),65000,65000,,65000,65000,65000,65000,65000
122710672,AULA F108 기계식 라이트 그레이 (중고),44250,44250,,44250,44250,44250,44250,44250
122691422,AULA F108 유무선 기계식 블러쉬 핑크 한글 (세이야축),84000,84000,,84000,84000,84000,84000,84000
122691426,AULA F108 유무선 기계식 블러쉬 핑크 한글 (저소음 로즈축),89000,89000,,89000,89000,89000,89000,89000
122691423,AULA F108 유무선 기계식 블러쉬 핑크 한글 (저소음 바다축),89000,89000,,89000,89000,89000,89000,89000
70003607,AULA F108 유무선 기계식 스카이 블랙 한글 (경해축),92000,92000,,92000,92000,92000,92000,92000
70003532,AULA F108 유무선 기계식 스카이 블랙 한글 (세이야축),77000,77000,,77000,77000,77000,77000,77000
70003601,AULA F108 유무선 기계식 스카이 블랙 한글 (저소음 바다축),82000,82000,,82000,82000,82000,82000,82000
78609734,AULA F108 유무선 기계식 스카이 블랙 한글 (저소음 솜사탕축),82000,82000,,82000,82000,82000,82000,82000
94029218,AULA F108 유무선 기계식 스카이 블랙 한글 (중고),65600,65600,,65600,74620,65600,,
70003592,AULA F108 유무선 기계식 스카이 블랙 한글 (황축),82000,82000,,82000,82000,82000,82000,82000
70003616,AULA F108 유무선 기계식 올리비아 화이트 한글 (경해축),92000,92000,,92000,92000,92000,92000,92000
70003631,AULA F108 유무선 기계식 올리비아 화이트 한글 (세이야축),77000,77000,,77000,77000,77000,77000,77000
70003625,AULA F108 유무선 기계식 올리비아 화이트 한글 (저소음 바다축),82000,82000,,82000,82000,82000,82000,82000
77312216,AULA F108 유무선 기계식 올리비아 화이트 한글 (저소음 솜사탕축),82000,82000,,82000,82000,82000,82000,82000
94029224,AULA F108 유무선 기계식 올리비아 화이트 한글 (중고),65600,65600,,65600,65600,65600,65600,65600
70003628,AULA F108 유무선 기계식 올리비아 화이트 한글 (황축),82000,82000,,82000,82000,82000,82000,82000
122710938,AULA F108 유무선 기계식 치즈 화이트 (황축),82000,82000,,82000,82000,82000,82000,82000
73428701,AULA F108 유무선 기계식 해외구매 (옵션선택구성),43220,43220,,43220,43220,43220,43220,43220
76338974,AULA F108 유무선 기계식 해외구매 (카라멜라떼축),46900,46900,,46900,46900,46900,46900,46900
76338983,AULA F108 유무선 기계식 해외구매 (풍령축),55050,55050,,55050,55050,55050,55050,55050
69697967,AULA F2087Pro 유무선 기계식 (해외구매),35900,35900,,35900,35900,35900,35900,35900
62647625,AULA F2088 기계식 (해외구매),26580,26580,,26580,26580,59990,59990,59990
37929992,AULA F21 유무선 (해외구매),16560,16560,,16560,16560,16560,16560,16560
74006096,AULA F65 유무선 기계식 (해외구매),39590,39590,,39590,39590,39590,39590,39590
92043803,AULA F65 유무선 기계식 스카이 블랙 (경해축),67000,67000,,67000,67000,67000,67000,67000
73560839,AULA F65 유무선 기계식 스카이 블랙 (세이야축),57000,57000,,57000,57000,57000,57000,57000
